0.0,4.0,5.0,17.0,0.0,0.0,0.0,9d3da08ee69163bd87d7db65e94400482c32c634,0.0,1555311389.0,0.0,1.0,roles/storage/nfs/client/tasks/config.yml,0.0,2.0,10.0,0.0,0.0,0.0,0.0,0.0,0.0,0.0,0.0,0.0,0.0,0.0,0.0,0.0,1.0,2.0,1.0,0.0,0.0,2.0,1.0,0.0,1.0,0.0,0.0,0.0,0.0,0.0,0.0,0.0,0.0,0.0,0.0,0.0,10.0,0.0,0.0,0.0,0.0,0.0,0.0,0.0,0.0,0.0,1.0,0.0,3.0,43.0,2.0,0.0,0.0,2.0,roles/storage/nfs/client/tasks/config.yml,goodrain/rainbond-ansible,5.29,name check nf server stat path path regist check server shell nfsoption echo els echo nfsoption regist nfsopt sudo connect local name configur etcfstab client action mount name nfsmount src nfsserver nfspath fstypenf opt path statemount check path defin,0.0,0.0,0.0,0.0,0.0,0.0,0.0,0.0,0.0,0.0,0.0,0.0,0.0,0.0,0.0,0.0,0.0,0.0,0.0,0.0,0.0,0.0,0.0,0.0,0.0,0.0,0.0,0.0,0.0,0.0,0.0,0.0,0.0,0.0,0.0,0.0,0.0,0.0,0.0,0.0,0.0,0.0,0.0,0.0,0.0,0.0,0.0,0.0
0.0,5.0,5.0,17.0,6.0,6.0,6.0,9d3da08ee69163bd87d7db65e94400482c32c634,1.0,1555311389.0,1.0,0.0,roles/prepare/defaults/main.yml,100.0,5.0,5.0,6.0,7.0,7.0,7.0,1.0,1.0,1.0,2.0,0.0,0.0,0.0,0.0,0.0,0.0,0.0,0.0,0.0,0.0,0.0,1.0,0.0,0.0,0.0,0.0,0.0,0.0,0.0,0.0,0.0,0.0,0.0,0.0,0.0,5.0,0.0,0.0,0.0,0.0,0.0,0.0,0.0,0.0,0.0,0.0,0.0,1.0,10.0,0.0,0.0,0.0,0.0,roles/prepare/defaults/main.yml,goodrain/rainbond-ansible,3.32,min cpu min ram min disk ntp server path local network,0.0,2.0,2.0,2.0,2.0,0.0,0.0,0.0,0.0,0.0,0.0,0.0,0.0,0.0,0.0,0.0,0.0,0.0,0.0,0.0,0.0,0.0,0.0,0.0,0.0,0.0,0.0,0.0,0.0,2.0,0.0,0.0,0.0,0.0,0.0,0.0,0.0,0.0,0.0,0.0,0.0,0.0,4.0,0.0,0.0,0.0,0.0,0.74
0.0,4.0,5.0,17.0,0.0,0.0,0.0,9d3da08ee69163bd87d7db65e94400482c32c634,0.0,1555311389.0,0.0,0.0,roles/storage/nfs/client/defaults/main.yml,0.0,0.0,4.0,0.0,0.0,0.0,0.0,0.0,0.0,0.0,0.0,0.0,0.0,0.0,0.0,0.0,0.0,0.0,0.0,0.0,0.0,0.0,1.0,0.0,0.0,0.0,0.0,0.0,0.0,0.0,0.0,0.0,0.0,0.0,0.0,0.0,4.0,0.0,0.0,0.0,0.0,0.0,0.0,0.0,0.0,0.0,0.0,0.0,1.0,8.0,0.0,0.0,0.0,0.0,roles/storage-client/defaults/main.yml,goodrain/rainbond-ansible,2.75,nfsserver hostvar group master nfspath grdata nfsmount grdata nfsoption,0.0,0.0,0.0,0.0,0.0,0.0,0.0,0.0,0.0,0.0,0.0,0.0,0.0,0.0,0.0,0.0,0.0,0.0,0.0,0.0,0.0,0.0,0.0,0.0,0.0,0.0,0.0,0.0,0.0,0.0,0.0,0.0,0.0,0.0,0.0,0.0,0.0,0.0,0.0,0.0,0.0,0.0,0.0,0.0,0.0,0.0,0.0,0.0
0.0,4.0,5.0,17.0,0.0,0.0,0.0,9d3da08ee69163bd87d7db65e94400482c32c634,0.0,1555311389.0,0.0,0.0,roles/image/tasks/online_download_tgz.yml,0.0,5.0,24.0,2.0,0.0,0.0,0.0,0.0,0.0,0.0,0.0,0.0,0.0,0.0,0.0,0.0,0.0,8.0,4.0,0.0,0.0,6.0,0.0,0.0,4.0,0.0,0.0,0.0,0.0,0.0,0.0,0.0,0.0,0.0,0.0,0.0,24.0,0.0,0.0,0.0,0.0,6.0,2.0,0.0,0.0,0.0,0.0,0.0,6.0,124.0,4.0,0.0,0.0,2.0,roles/image/tasks/online_download_tgz.yml,goodrain/rainbond-ansible,5.51,name check check path download stat path regist check imag base tgz download name next task may take time execut debug msg next task may take time execut wait download path check imag base tgz path defin name rainbond download base imag tgz get url url base imag url dest path check imag base tgz path defin name check check path download stat path regist check imag rainbond tgz download name next task may take time execut debug msg next task may take time execut wait download path check imag rainbond tgz path defin name rainbond download rainbond imag tgz get url url rainbond imag url dest path check imag rainbond tgz path defin,0.0,0.0,0.0,0.0,0.0,0.0,0.0,0.0,0.0,0.0,0.0,0.0,0.0,0.0,0.0,0.0,0.0,0.0,0.0,0.0,0.0,0.0,0.0,0.0,0.0,0.0,0.0,0.0,0.0,0.0,0.0,0.0,0.0,0.0,0.0,0.0,0.0,0.0,0.0,0.0,0.0,0.0,0.0,0.0,0.0,0.0,0.0,0.0
0.0,2.0,5.0,17.0,0.0,0.0,0.0,9d3da08ee69163bd87d7db65e94400482c32c634,0.0,1555311389.0,0.0,0.0,roles/storage/nfs/server/handlers/main.yml,0.0,0.0,2.0,0.0,0.0,0.0,0.0,0.0,0.0,0.0,0.0,0.0,0.0,0.0,0.0,1.0,1.0,0.0,0.0,0.0,0.0,1.0,0.0,0.0,0.0,0.0,0.0,0.0,0.0,0.0,0.0,0.0,0.0,0.0,0.0,0.0,2.0,0.0,0.0,0.0,0.0,0.0,0.0,0.0,0.0,0.0,0.0,0.0,1.0,6.0,1.0,0.0,0.0,0.0,roles/storage-server/handlers/main.yml,goodrain/rainbond-ansible,2.58,name reload nf command exportf,0.0,0.0,0.0,0.0,0.0,0.0,0.0,0.0,0.0,0.0,0.0,0.0,0.0,0.0,0.0,0.0,0.0,0.0,0.0,0.0,0.0,0.0,0.0,0.0,0.0,0.0,0.0,0.0,0.0,0.0,0.0,0.0,0.0,0.0,0.0,0.0,0.0,0.0,0.0,0.0,0.0,0.0,0.0,0.0,0.0,0.0,0.0,0.0
0.0,7.0,5.0,17.0,0.0,0.0,0.0,9d3da08ee69163bd87d7db65e94400482c32c634,0.0,1555311389.0,0.0,0.0,roles/prepare/tasks/debian.yml,0.0,9.0,74.0,3.0,0.0,0.0,0.0,0.0,0.0,0.0,0.0,0.0,0.0,0.0,0.0,0.0,4.0,6.0,2.0,0.0,0.0,10.0,0.0,0.0,0.0,0.0,1.0,0.0,0.0,0.0,0.0,0.0,0.0,0.0,0.0,0.0,49.0,0.0,1.0,0.0,0.0,9.0,1.0,0.0,1.0,0.0,0.0,0.0,10.0,177.0,27.0,0.0,0.0,2.0,roles/prepare/tasks/debian.yml,goodrain/rainbond-ansible,6.29,name check http proxi path raw grep qsi acquir http proxi path regist need http proxi fail chang check mode environ http proxi defin name add http proxi path http proxi defin raw echo acquir http proxi http proxi path becom environ http proxi defin need http path name check http proxi path raw grep qsi acquir http proxi path regist need http proxi fail chang check mode environ http proxi defin name add http proxi path http proxi defin raw echo acquir http proxi http proxi path becom environ http proxi defin need http path name ubuntu lxd ufw packag apt name ufw lxd lxdclient lxcf lxccommon nscd dnsmasq state absent tag prepar name instal ubuntu packag apt name nfscommon conntrack socat bashcomplet rsync ipset ipvsadm nettool expect updat cach ye autoclean ye state latest name configur ulimit lineinfil dest etcprofil regexp ulimit shn line ulimit shn name prepar journal log file name item statedirectori item path varlogjourn name optim set journal log templat path path name restart journald servic namesystemdjournald staterestart,0.0,0.0,0.0,0.0,0.0,0.0,0.0,0.0,0.0,0.0,0.0,0.0,0.0,0.0,0.0,0.0,0.0,0.0,0.0,0.0,0.0,0.0,0.0,0.0,0.0,0.0,0.0,0.0,0.0,0.0,0.0,0.0,0.0,0.0,0.0,0.0,0.0,0.0,0.0,0.0,0.0,0.0,0.0,0.0,0.0,0.0,0.0,0.0
0.0,4.0,5.0,17.0,0.0,0.0,0.0,9d3da08ee69163bd87d7db65e94400482c32c634,0.0,1555311389.0,0.0,0.0,roles/kube-master/tasks/main.yml,0.0,10.0,42.0,0.0,0.0,0.0,0.0,0.0,0.0,0.0,0.0,0.0,0.0,0.0,0.0,1.0,4.0,6.0,3.0,0.0,0.0,11.0,0.0,0.0,3.0,4.0,0.0,0.0,0.0,0.0,0.0,0.0,0.0,0.0,0.0,0.0,42.0,0.0,0.0,0.0,0.0,16.0,12.0,0.0,0.0,0.0,3.0,0.0,11.0,174.0,11.0,0.0,0.0,1.0,roles/kube-master/tasks/main.yml,goodrain/rainbond-ansible,5.69,name run imag pull command usrlocalbincheck img name check imag pull stat path tmpinstallcheck img regist check img name pull kubernet apiserv path shell docker pull path kube apiserv imag check path defin name pull kubernet control manag path shell docker pull path kube control manag imag check path defin name pull kubernet schedul path shell docker pull path kube schedul imag check path defin name rainbond copi master role templat src path dest node role dir path name rainbond copi kube apiserv script templat src path dest script dir path mode name rainbond copi kube controllermanag script templat src path dest script dir path mode name rainbond copi kube schedul script templat src path dest script dir path mode name rainbond copi kube audit polici templat src path dest kubecfg dir path name rainbond copi kubectl binari deploy copi src local tool binhyperkub dest bin dir kubectl mode,0.0,0.0,0.0,0.0,0.0,0.0,0.0,0.0,0.0,0.0,0.0,0.0,0.0,0.0,0.0,0.0,0.0,0.0,0.0,0.0,0.0,0.0,0.0,0.0,0.0,0.0,0.0,0.0,0.0,0.0,0.0,0.0,0.0,0.0,0.0,0.0,0.0,0.0,0.0,0.0,0.0,0.0,0.0,0.0,0.0,0.0,0.0,0.0
0.0,4.0,5.0,17.0,0.0,0.0,0.0,9d3da08ee69163bd87d7db65e94400482c32c634,0.0,1555311389.0,0.0,0.0,roles/network_plugin/flannel/defaults/main.yml,0.0,1.0,6.0,0.0,0.0,0.0,0.0,0.0,0.0,0.0,0.0,0.0,0.0,0.0,0.0,0.0,0.0,0.0,0.0,0.0,0.0,0.0,1.0,0.0,0.0,0.0,0.0,0.0,0.0,0.0,0.0,0.0,0.0,0.0,0.0,0.0,3.0,0.0,0.0,0.0,0.0,0.0,0.0,0.0,0.0,0.0,0.0,0.0,1.0,23.0,0.0,0.0,0.0,0.0,roles/network_plugin/flannel/defaults/main.yml,goodrain/rainbond-ansible,4.23,nodeip hostvar inventori hostnam etcd endpoint item group etcd http hostvar item etcd port path endif endfor flannel etcd prefix kubernetesnetwork,0.0,0.0,0.0,0.0,0.0,0.0,0.0,0.0,0.0,0.0,0.0,0.0,0.0,0.0,0.0,0.0,0.0,0.0,0.0,0.0,0.0,0.0,0.0,0.0,0.0,0.0,0.0,0.0,0.0,0.0,0.0,0.0,0.0,0.0,0.0,0.0,0.0,0.0,0.0,0.0,0.0,0.0,0.0,0.0,0.0,0.0,0.0,0.0
0.0,16.0,5.0,17.0,0.0,0.0,0.0,9d3da08ee69163bd87d7db65e94400482c32c634,0.0,1555311389.0,0.0,0.0,roles/etcd/defaults/main.yml,0.0,4.0,16.0,0.0,0.0,0.0,0.0,0.0,0.0,0.0,0.0,0.0,0.0,0.0,0.0,0.0,0.0,0.0,0.0,0.0,0.0,0.0,1.0,0.0,0.0,0.0,0.0,2.0,0.0,0.0,0.0,0.0,0.0,0.0,0.0,0.0,7.0,0.0,0.0,0.0,0.0,0.0,0.0,0.0,0.0,0.0,0.0,0.0,1.0,93.0,0.0,0.0,0.0,0.0,roles/etcd/defaults/main.yml,goodrain/rainbond-ansible,4.96,etcd master inventori hostnam group etcd etcd member name host group etcd inventori hostnam host etcd path endif endfor etcd access address hostvar inventori hostnam etcd peer url http etcd access address etcd port etcd client url http etcd access address etcd port http etcd access address etcd port etcd peer address item group etcd group newmast etcd path http hostvar item etcd port path endif endfor etcd access address item group etcd group newmast http hostvar item etcd port path endif endfor,0.0,0.0,0.0,0.0,0.0,0.0,0.0,0.0,0.0,0.0,0.0,0.0,0.0,0.0,0.0,0.0,0.0,0.0,0.0,0.0,0.0,0.0,0.0,0.0,0.0,0.0,0.0,0.0,0.0,0.0,0.0,0.0,0.0,0.0,0.0,0.0,0.0,0.0,0.0,0.0,0.0,0.0,0.0,0.0,0.0,0.0,0.0,0.0
0.0,5.0,5.0,17.0,0.0,0.0,0.0,9d3da08ee69163bd87d7db65e94400482c32c634,0.0,1555311389.0,0.0,0.0,roles/docker/handlers/main.yml,0.0,5.0,29.0,0.0,0.0,0.0,0.0,0.0,0.0,0.0,0.0,0.0,0.0,0.0,0.0,2.0,3.0,1.0,0.0,0.0,0.0,6.0,0.0,0.0,0.0,0.0,0.0,0.0,0.0,0.0,0.0,0.0,0.0,0.0,0.0,0.0,24.0,0.0,0.0,0.0,0.0,6.0,0.0,0.0,0.0,0.0,1.0,0.0,6.0,101.0,8.0,0.0,1.0,1.0,roles/docker/handlers/main.yml,goodrain/rainbond-ansible,4.98,name restart docker command bintru notifi docker reload systemd docker reload path docker reload docker docker paus docker restart docker wait docker name docker reload systemd shell systemctl daemonreload name docker reload path servic name path state restart ansibl famili core contain linux core name docker reload docker servic name docker state restart name docker paus docker restart paus second prompt wait docker restart name docker wait docker command docker bin dir docker imag regist docker readi retri delay docker path,0.0,0.0,0.0,0.0,0.0,0.0,0.0,0.0,0.0,0.0,0.0,0.0,0.0,0.0,0.0,0.0,0.0,0.0,0.0,0.0,0.0,0.0,0.0,0.0,0.0,0.0,0.0,0.0,0.0,0.0,0.0,0.0,0.0,0.0,0.0,0.0,0.0,0.0,0.0,0.0,0.0,0.0,0.0,0.0,0.0,0.0,0.0,0.0
0.0,5.0,5.0,17.0,0.0,0.0,0.0,9d3da08ee69163bd87d7db65e94400482c32c634,0.0,1555311389.0,0.0,0.0,roles/health/tasks/main.yml,0.0,19.0,86.0,3.0,0.0,0.0,0.0,0.0,0.0,0.0,0.0,0.0,0.0,0.0,0.0,0.0,0.0,12.0,5.0,0.0,0.0,19.0,0.0,0.0,5.0,8.0,0.0,0.0,0.0,0.0,0.0,0.0,0.0,0.0,0.0,0.0,81.0,0.0,5.0,0.0,0.0,26.0,20.0,0.0,0.0,0.0,0.0,0.0,19.0,329.0,17.0,0.0,0.0,4.0,roles/health/tasks/main.yml,goodrain/rainbond-ansible,5.83,name health add health role templat src path dest node role dir path name rainbond add dn role templat src path dest node role dir path name health add dn health check templat src base dir path dest rbd dir path mode name health add local dn health check templat src path dest rbd dir path mode name health add network health check templat src network cluster network path dest rbd dir path mode tag health name health add storag health check templat src base dir path dest rbd dir path mode name health add nf health check templat src base dir hackfileshealthcheck path dest rbd dir healthcheck path mode name rainbond check cni bin stat path rbd dir bincalico regist cni done name rainbond copi cni bin copi src item dest rbd dir bin ownerroot mode fileglob rbd dir etctoolscnibin cni path defin name rainbond copi tool copi src item dest bin dir ownerroot mode fileglob rbd dir etctoolsbin cni path defin name rainbond check kubecfg stat path kubecfg dir path regist kubecfg done name rainbond copi kubecfg copi src item dest kubecfg dir fileglob kubecfg dir kubecfg path defin name rainbond check ssl stat path dir path regist ssl done name rainbond copi ssl copi src item dest dir fileglob dir ssl path defin name rainbond check region ssl stat path region dir path regist ssl done name rainbond copi region ssl copi src item dest region dir fileglob region dir ssl path defin name health copi docker check templat src base dir hackfileshealthcheck path dest rbd dir healthcheck path mode name health add health health role templat src path dest node role dir path storag type nf name health add health health role templat src path dest node role dir path storag type nf,0.0,0.0,0.0,0.0,0.0,0.0,0.0,0.0,0.0,0.0,0.0,0.0,0.0,0.0,0.0,0.0,0.0,0.0,0.0,0.0,0.0,0.0,0.0,0.0,0.0,0.0,0.0,0.0,0.0,0.0,0.0,0.0,0.0,0.0,0.0,0.0,0.0,0.0,0.0,0.0,0.0,0.0,0.0,0.0,0.0,0.0,0.0,0.0
0.0,2.0,5.0,17.0,0.0,0.0,0.0,9d3da08ee69163bd87d7db65e94400482c32c634,0.0,1555311389.0,0.0,0.0,roles/prepare/tasks/main.yml,0.0,6.0,18.0,1.0,0.0,0.0,0.0,0.0,0.0,0.0,0.0,0.0,0.0,0.0,0.0,0.0,0.0,4.0,1.0,0.0,0.0,7.0,0.0,0.0,0.0,0.0,0.0,0.0,0.0,0.0,0.0,6.0,0.0,0.0,0.0,0.0,17.0,0.0,0.0,0.0,0.0,6.0,1.0,0.0,0.0,0.0,0.0,0.0,7.0,53.0,1.0,0.0,0.0,0.0,roles/prepare/tasks/main.yml,goodrain/rainbond-ansible,5.03,name popul rainbond host file blockinfil dest etchost block hostvar group master rainbond domain state present creat ye backup ye marker import task path instal type offlin import task path import task path ansibl distribut ubuntu ansibl distribut debian import task path ansibl distribut cent import task path import task path,0.0,0.0,0.0,0.0,0.0,0.0,0.0,0.0,0.0,0.0,0.0,0.0,0.0,0.0,0.0,0.0,0.0,0.0,0.0,0.0,0.0,0.0,0.0,0.0,0.0,0.0,0.0,0.0,0.0,0.0,0.0,0.0,0.0,0.0,0.0,0.0,0.0,0.0,0.0,0.0,0.0,0.0,0.0,0.0,0.0,0.0,0.0,0.0
0.0,15.0,5.0,17.0,0.0,0.0,0.0,9d3da08ee69163bd87d7db65e94400482c32c634,0.0,1555311389.0,0.0,0.0,roles/etcd-proxy/defaults/main.yml,0.0,4.0,16.0,0.0,0.0,0.0,0.0,0.0,0.0,0.0,0.0,0.0,0.0,0.0,0.0,0.0,0.0,0.0,0.0,0.0,0.0,0.0,1.0,0.0,0.0,0.0,0.0,2.0,0.0,0.0,0.0,0.0,0.0,0.0,0.0,0.0,7.0,0.0,0.0,0.0,0.0,0.0,0.0,0.0,0.0,0.0,0.0,0.0,1.0,89.0,0.0,0.0,0.0,0.0,roles/etcd-proxy/defaults/main.yml,goodrain/rainbond-ansible,4.87,etcd master inventori hostnam group etcd etcd member name host group etcd inventori hostnam host etcd path endif endfor etcd access address hostvar inventori hostnam etcd peer url http etcd access address etcd port etcd client url http etcd access address etcd port http etcd access address etcd port etcd peer address item group etcd etcd path http hostvar item etcd port path endif endfor etcd access address item group etcd http hostvar item etcd port path endif endfor,0.0,0.0,0.0,0.0,0.0,0.0,0.0,0.0,0.0,0.0,0.0,0.0,0.0,0.0,0.0,0.0,0.0,0.0,0.0,0.0,0.0,0.0,0.0,0.0,0.0,0.0,0.0,0.0,0.0,0.0,0.0,0.0,0.0,0.0,0.0,0.0,0.0,0.0,0.0,0.0,0.0,0.0,0.0,0.0,0.0,0.0,0.0,0.0
0.0,5.0,5.0,17.0,0.0,0.0,0.0,9d3da08ee69163bd87d7db65e94400482c32c634,0.0,1555311389.0,0.0,0.0,roles/rainvar/tasks/main.yml,0.0,0.0,5.0,0.0,0.0,0.0,0.0,0.0,0.0,0.0,0.0,0.0,0.0,0.0,0.0,0.0,0.0,0.0,0.0,0.0,0.0,1.0,0.0,0.0,0.0,0.0,0.0,0.0,0.0,0.0,0.0,0.0,0.0,0.0,0.0,0.0,4.0,0.0,0.0,0.0,0.0,1.0,0.0,0.0,0.0,0.0,0.0,0.0,1.0,10.0,1.0,0.0,0.0,0.0,roles/rainvar/tasks/main.yml,goodrain/rainbond-ansible,3.32,name set task variabl debug msg check path tag alway,0.0,0.0,0.0,0.0,0.0,0.0,0.0,0.0,0.0,0.0,0.0,0.0,0.0,0.0,0.0,0.0,0.0,0.0,0.0,0.0,0.0,0.0,0.0,0.0,0.0,0.0,0.0,0.0,0.0,0.0,0.0,0.0,0.0,0.0,0.0,0.0,0.0,0.0,0.0,0.0,0.0,0.0,0.0,0.0,0.0,0.0,0.0,0.0
0.0,4.0,8.0,57.0,0.0,0.0,0.0,17af158689c5dbf7a4387e8645c69106b3a2ecc7,0.0,1558272992.0,0.0,0.0,roles/monitor/tasks/main.yml,0.0,0.0,4.0,0.0,0.0,0.0,0.0,0.0,0.0,0.0,0.0,0.0,0.0,0.0,0.0,0.0,0.0,0.0,0.0,0.0,0.0,1.0,0.0,0.0,0.0,0.0,0.0,0.0,0.0,0.0,0.0,0.0,0.0,0.0,0.0,0.0,4.0,0.0,0.0,0.0,0.0,2.0,2.0,0.0,0.0,0.0,0.0,0.0,1.0,13.0,1.0,0.0,0.0,0.0,roles/monitor/tasks/main.yml,goodrain/rainbond-ansible,3.55,name monitor copi monitor role templat src path dest node role dir path,0.0,0.0,0.0,0.0,0.0,0.0,0.0,0.0,0.0,0.0,0.0,0.0,0.0,0.0,0.0,0.0,0.0,0.0,0.0,0.0,0.0,0.0,0.0,0.0,0.0,0.0,0.0,0.0,0.0,0.0,0.0,0.0,0.0,0.0,0.0,0.0,0.0,0.0,0.0,0.0,0.0,0.0,0.0,0.0,0.0,0.0,0.0,0.0
0.0,6.0,8.0,57.0,3.0,3.0,3.0,17af158689c5dbf7a4387e8645c69106b3a2ecc7,1.0,1558272992.0,1.0,0.0,roles/prepare/tasks/check.yml,100.0,13.0,81.0,0.0,4.0,4.0,4.0,1.0,1.0,1.0,1.0,0.0,0.0,0.0,0.0,0.0,2.0,23.0,14.0,0.0,0.0,14.0,0.0,0.0,0.0,0.0,0.0,0.0,1.0,0.0,0.0,0.0,0.0,0.0,0.0,0.0,56.0,0.0,1.0,0.0,0.0,12.0,0.0,0.0,0.0,0.0,2.0,0.0,14.0,390.0,13.0,0.0,0.0,2.0,roles/prepare/tasks/check.yml,goodrain/rainbond-ansible,6.89,name stop ansibl version low assert ansibl path compar run ye name stop non systemd type assert ansibl servic mgr systemd ignor error name stop unknown assert ansibl distribut cent red hat debian ubuntu ignor error name stop cpu suffici master fail msg machin suffici cpu run rainbond least min cpu core inventori hostnam group master enabl check enabl ansibl processor vcpu min cpuint name stop cpu suffici worker fail msg machin suffici cpu run rainbond least min cpu core inventori hostnam group worker enabl check enabl ansibl processor vcpu min cpuint name stop memori small master fail msg machin suffici ram run rainbond least min ram inventori hostnam group master enabl check enabl ansibl memtot min ramint name stop memori small worker fail msg machin suffici ram run rainbond least min ram inventori hostnam group worker enabl check enabl ansibl memtot min ramint name determin mountpoint deploy dir exist shell tail awk print regist deploy partit chang set fact disk alert path deploy path path avail min diskint enabl check enabl item ansibl mount name stop disk small debug msg file system mount deploy path meet minimum disk space requir least min disk disk alert defin disk alert enabl check enabl name minimum kernel version fail msg docker requir minimum kernel version docker kernel min version ansibl distribut ansibl distribut version ansibl kernel version docker kernel min version name preflight check linux famili distribut version fail msg system version lower red hat enterpris linux cent deprec pleas use cent see http path ansibl famili red hat ansibl distribut cent red hat ansibl distribut version name preflight check check linux kernel overcommit memori paramet shell sysctl path memori becom regist overcommit memori name preflight check fail linux kernel path memori paramet set fail msg recommend set path memori set overcommit path int,0.0,0.0,0.0,3.0,0.0,0.0,0.0,0.0,0.0,0.0,1.0,1.0,0.0,0.0,0.0,0.0,0.0,0.0,0.0,0.0,0.0,0.0,0.0,0.0,0.0,0.0,0.0,0.0,0.0,0.0,0.0,0.0,0.0,0.0,0.0,0.0,0.0,0.0,0.0,0.0,0.0,0.0,3.0,0.0,0.0,0.0,0.0,0.02
0.0,7.0,8.0,57.0,0.0,0.0,0.0,17af158689c5dbf7a4387e8645c69106b3a2ecc7,1.0,1558272992.0,0.0,0.0,roles/k8s/compute/defaults/main.yml,0.0,0.0,8.0,0.0,0.0,0.0,0.0,0.0,0.0,0.0,0.0,0.0,0.0,0.0,0.0,0.0,0.0,0.0,0.0,0.0,0.0,0.0,1.0,0.0,0.0,0.0,0.0,1.0,0.0,0.0,0.0,0.0,0.0,0.0,0.0,0.0,5.0,0.0,0.0,0.0,0.0,0.0,0.0,0.0,0.0,0.0,0.0,0.0,1.0,29.0,0.0,0.0,0.0,0.0,roles/kube-worker/defaults/main.yml,goodrain/rainbond-ansible,4.63,worker access address hostvar inventori hostnam etcd endpoint item group etcd etcd path http hostvar item etcd port path endif endfor kube reserv cpum memorymi ephemeralstoragegi system reserv cpum memorymi ephemeralstoragegi max pod,0.0,0.0,0.0,0.0,0.0,0.0,0.0,0.0,0.0,0.0,0.0,0.0,0.0,0.0,0.0,0.0,0.0,0.0,0.0,0.0,0.0,0.0,0.0,0.0,0.0,0.0,0.0,0.0,0.0,0.0,0.0,0.0,0.0,0.0,0.0,0.0,0.0,0.0,0.0,0.0,0.0,0.0,0.0,0.0,0.0,0.0,0.0,0.0
0.0,4.0,8.0,57.0,0.0,0.0,0.0,17af158689c5dbf7a4387e8645c69106b3a2ecc7,2.0,1558272992.0,1.0,0.0,roles/storage/gfs/tasks/main.yml,100.0,12.0,58.0,0.0,2.0,1.0,1.0,2.0,1.0,1.0,1.0,0.0,0.0,0.0,0.0,0.0,2.0,8.0,2.0,0.0,0.0,10.0,3.0,0.0,4.0,4.0,1.0,0.0,0.0,0.0,0.0,0.0,0.0,0.0,0.0,0.0,53.0,0.0,1.0,0.0,0.0,17.0,9.0,0.0,0.0,0.0,2.0,0.0,13.0,181.0,13.0,0.0,0.0,2.0,roles/prepare/tasks/once.yml,goodrain/rainbond-ansible,6.24,name gf copi check storag templat src check path dest tmpinstallcheck path mode name gf run check storag shell bash tmpinstallcheck path tmpinstallcheck path name gf check grdata stat path regist check grdata name instal gf repo cento action yum pkgcentosreleaseglust statepres ansibl famili red hat instal type onlin name instal nf client cento action yum pkgglusterfsfus statepres ansibl famili red hat name ensur grdata directori exist action file pathgrdata statedirectori name write etcfstab blockinfil dest etcfstab block storag cmd state present creat ye backup ye check path defin name mount grdata shell mount name check grdata rainbond file name item statedirectori item grdataservicesssh grdataservicesstorag grdataservicesofflineimag grdatakubernet name deploy check ssh stat path path path regist deploy check ssh deleg path name copi ssh pub key builder pub key copi src path path dest grdataservicessshbuild path mode deploy check path defin name copi ssh key builder key copi src path rsa dest grdataservicessshbuild rsa mode deploy check path defin name copi ssh config copi src base dir hackfilessshconfig dest grdataservicessshconfig mode deploy check path defin,0.0,0.0,0.0,0.0,0.0,0.0,0.0,0.0,0.0,0.0,0.0,0.0,0.0,0.0,0.0,0.0,0.0,0.0,0.0,0.0,0.0,0.0,0.0,0.0,0.0,0.0,0.0,0.0,0.0,0.0,0.0,0.0,0.0,0.0,0.0,0.0,0.0,0.0,0.0,0.0,0.0,0.0,2.0,0.0,0.0,0.0,0.0,0.03
0.0,3.0,8.0,57.0,27.0,27.0,27.0,17af158689c5dbf7a4387e8645c69106b3a2ecc7,1.0,1558272992.0,1.0,0.0,roles/network_plugin/reset/tasks/calico.yml,100.0,6.0,20.0,0.0,27.0,27.0,27.0,0.0,0.0,0.0,1.0,0.0,0.0,0.0,0.0,0.0,5.0,0.0,0.0,0.0,0.0,7.0,0.0,0.0,0.0,0.0,0.0,0.0,0.0,0.0,0.0,0.0,0.0,0.0,0.0,0.0,20.0,0.0,0.0,0.0,0.0,6.0,0.0,0.0,0.0,0.0,5.0,0.0,7.0,70.0,9.0,0.0,0.0,0.0,roles/image/tasks/unpack_tag.yml,goodrain/rainbond-ansible,4.6,name stop calico shell node servic stop calico cclear name disabl calico shell systemctl disabl calico systemctl stop calico name remov calico config shell path path path path name remov calico cni config shell path tmp name calico interfac shell ifconfig tunl name restart kubelet systemd state restart daemon reload ye name kubelet name restart node systemd state restart daemon reload ye name node,0.0,-1.0,3.0,10.0,0.0,0.0,0.0,0.0,0.0,3.0,-4.0,-2.0,0.0,0.0,4.0,0.0,0.0,-2.0,0.0,0.0,0.0,-1.0,0.0,0.0,0.0,0.0,0.0,0.0,0.0,10.0,0.0,0.0,0.0,0.0,6.0,0.0,0.0,0.0,0.0,3.0,0.0,4.0,3.0,6.0,0.0,0.0,-1.0,-0.6
0.0,15.0,8.0,57.0,0.0,0.0,0.0,17af158689c5dbf7a4387e8645c69106b3a2ecc7,1.0,1558272992.0,0.0,0.0,roles/etcd/compute/defaults/main.yml,0.0,4.0,16.0,0.0,0.0,0.0,0.0,0.0,0.0,0.0,0.0,0.0,0.0,0.0,0.0,0.0,0.0,0.0,0.0,0.0,0.0,0.0,1.0,0.0,0.0,0.0,0.0,2.0,0.0,0.0,0.0,0.0,0.0,0.0,0.0,0.0,7.0,0.0,0.0,0.0,0.0,0.0,0.0,0.0,0.0,0.0,0.0,0.0,1.0,89.0,0.0,0.0,0.0,0.0,roles/etcd-proxy/defaults/main.yml,goodrain/rainbond-ansible,4.87,etcd master inventori hostnam group etcd etcd member name host group etcd inventori hostnam host etcd path endif endfor etcd access address hostvar inventori hostnam etcd peer url http etcd access address etcd port etcd client url http etcd access address etcd port http etcd access address etcd port etcd peer address item group etcd etcd path http hostvar item etcd port path endif endfor etcd access address item group etcd http hostvar item etcd port path endif endfor,0.0,0.0,0.0,0.0,0.0,0.0,0.0,0.0,0.0,0.0,0.0,0.0,0.0,0.0,0.0,0.0,0.0,0.0,0.0,0.0,0.0,0.0,0.0,0.0,0.0,0.0,0.0,0.0,0.0,0.0,0.0,0.0,0.0,0.0,0.0,0.0,0.0,0.0,0.0,0.0,0.0,0.0,0.0,0.0,0.0,0.0,0.0,0.0
0.0,5.0,8.0,57.0,6.0,2.0,6.0,17af158689c5dbf7a4387e8645c69106b3a2ecc7,3.0,1558272992.0,1.0,0.0,roles/upgrade/tasks/main.yml,100.0,8.0,42.0,0.0,13.0,4.0,7.0,7.0,2.0,5.0,2.0,0.0,0.0,0.0,0.0,0.0,1.0,0.0,0.0,0.0,0.0,9.0,0.0,0.0,0.0,6.0,0.0,0.0,0.0,0.0,0.0,0.0,0.0,0.0,0.0,0.0,41.0,0.0,1.0,0.0,0.0,19.0,10.0,0.0,0.0,0.0,1.0,0.0,9.0,143.0,9.0,0.0,0.0,1.0,roles/upgrade/tasks/main.yml,goodrain/rainbond-ansible,5.55,name upgrad copi imag upgrad script templat src path dest path mode name upgrad copi upgrad consol sql templat src path dest path mode name upgrad copi upgrad region sql templat src path dest path mode name upgrad upgrad imag path shell bash path path regist upgradex task result upgradex task result succeed retri name upgrad copi grctl binari deploy copi src local tool bingrctl dest bin dir grctl mode name upgrad stop node servic systemd state stop name node name upgrad copi node binari deploy copi src local tool binnod dest bin dir node mode name tool copi rainbond tool copi src item dest bin dir ownerroot mode fileglob base dir hackfilesbingrtool name upgrad start node servic systemd state start name node,0.0,0.0,1.0,5.0,0.0,0.0,0.0,0.0,0.0,0.0,0.0,0.0,0.0,0.0,1.0,0.0,0.0,0.0,1.0,0.0,0.0,0.0,0.0,0.0,0.0,0.0,0.0,0.0,0.0,5.0,0.0,0.0,0.0,0.0,3.0,2.0,0.0,0.0,0.0,0.0,0.0,1.0,15.0,1.0,0.0,0.0,0.0,0.01
0.0,3.0,8.0,57.0,0.0,0.0,0.0,17af158689c5dbf7a4387e8645c69106b3a2ecc7,1.0,1558272992.0,0.0,0.0,roles/k8s/manage/defaults/main.yml,0.0,0.0,5.0,0.0,0.0,0.0,0.0,0.0,0.0,0.0,0.0,0.0,0.0,0.0,0.0,0.0,0.0,0.0,0.0,0.0,0.0,0.0,1.0,0.0,0.0,0.0,0.0,0.0,0.0,0.0,0.0,0.0,0.0,0.0,0.0,0.0,2.0,0.0,0.0,0.0,0.0,0.0,0.0,0.0,0.0,0.0,0.0,0.0,1.0,21.0,0.0,0.0,0.0,0.0,roles/kube-master/defaults/main.yml,goodrain/rainbond-ansible,4.07,master access address hostvar inventori hostnam etcd endpoint item group etcd http hostvar item etcd port path endif endfor,0.0,0.0,0.0,0.0,0.0,0.0,0.0,0.0,0.0,0.0,0.0,0.0,0.0,0.0,0.0,0.0,0.0,0.0,0.0,0.0,0.0,0.0,0.0,0.0,0.0,0.0,0.0,0.0,0.0,0.0,0.0,0.0,0.0,0.0,0.0,0.0,0.0,0.0,0.0,0.0,0.0,0.0,0.0,0.0,0.0,0.0,0.0,0.0
0.0,2.0,8.0,57.0,0.0,0.0,0.0,17af158689c5dbf7a4387e8645c69106b3a2ecc7,0.0,1558272992.0,0.0,0.0,roles/storage/nfs/server/defaults/main.yml,0.0,0.0,2.0,0.0,0.0,0.0,0.0,0.0,0.0,0.0,0.0,0.0,0.0,0.0,0.0,0.0,0.0,0.0,0.0,0.0,0.0,0.0,1.0,0.0,0.0,0.0,0.0,0.0,0.0,0.0,0.0,0.0,0.0,0.0,0.0,0.0,2.0,0.0,0.0,0.0,0.0,0.0,0.0,0.0,0.0,0.0,0.0,0.0,1.0,4.0,0.0,0.0,0.0,0.0,roles/storage-server/defaults/main.yml,goodrain/rainbond-ansible,2.0,nf rpcbind state start nf rpcbind enabl,0.0,0.0,0.0,0.0,0.0,0.0,0.0,0.0,0.0,0.0,0.0,0.0,0.0,0.0,0.0,0.0,0.0,0.0,0.0,0.0,0.0,0.0,0.0,0.0,0.0,0.0,0.0,0.0,0.0,0.0,0.0,0.0,0.0,0.0,0.0,0.0,0.0,0.0,0.0,0.0,0.0,0.0,0.0,0.0,0.0,0.0,0.0,0.0
