0.0,5.0,4.0,27.0,0.0,0.0,0.0,993f9bd441f0ea79f782b66954b922a65c6eeb1e,0.0,1551796318.0,0.0,0.0,roles/thirdparty/tasks/main.yml,0.0,6.0,34.0,0.0,0.0,0.0,0.0,0.0,0.0,0.0,0.0,0.0,0.0,0.0,0.0,0.0,0.0,8.0,4.0,0.0,0.0,7.0,0.0,0.0,4.0,1.0,0.0,0.0,0.0,0.0,0.0,0.0,0.0,0.0,0.0,0.0,34.0,0.0,0.0,0.0,0.0,10.0,8.0,0.0,0.0,0.0,0.0,0.0,7.0,105.0,7.0,0.0,0.0,3.0,roles/thirdparty/tasks/main.yml,goodrain/rainbond-ansible,5.24,name thirdparti check docker daemon stat path regist check docker daemon name thirdparti write docker daemon templat src path dest path check docker path defin name thirdparti check path stat path path regist check admin kubeconfig deleg path name thirdparti copi path templat src path dest path check admin path defin deleg path name thirdparti copi path templat src path dest path check admin path defin deleg path name thirdparti check kubectl stat path usrlocalbinkubectl regist check kubectl name thirdparti copi kubectl copi src usrbinkubectl dest usrlocalbinkubectl mode backup ye check path defin,0.0,0.0,0.0,0.0,0.0,0.0,0.0,0.0,0.0,0.0,0.0,0.0,0.0,0.0,0.0,0.0,0.0,0.0,0.0,0.0,0.0,0.0,0.0,0.0,0.0,0.0,0.0,0.0,0.0,0.0,0.0,0.0,0.0,0.0,0.0,0.0,0.0,0.0,0.0,0.0,0.0,0.0,0.0,0.0,0.0,0.0,0.0,0.0
0.0,5.0,4.0,27.0,0.0,0.0,0.0,993f9bd441f0ea79f782b66954b922a65c6eeb1e,0.0,1551796318.0,0.0,0.0,roles/docker/tasks/systemd.yml,0.0,12.0,54.0,9.0,0.0,0.0,0.0,0.0,0.0,0.0,0.0,0.0,0.0,0.0,0.0,0.0,0.0,15.0,10.0,0.0,0.0,12.0,0.0,0.0,1.0,2.0,2.0,0.0,0.0,0.0,0.0,0.0,0.0,0.0,0.0,0.0,54.0,0.0,0.0,0.0,0.0,19.0,17.0,0.0,0.0,0.0,0.0,0.0,12.0,201.0,11.0,0.0,0.0,2.0,NA,goodrain/rainbond-ansible,6.08,name creat docker servic systemd directori exist file path path state directori name write docker proxi dropin templat src path dest path http proxi defin http proxi defin name write docker environ file templat src path dest rbd dir path name check docker dir file pathetcdock statedirectori mode name docker check daemon exist stat path regist docker daemon check name write docker daemon cent templat src path dest path ansibl distribut cent docker daemon path defin name write docker daemon debianubuntu templat src path dest path ansibl distribut ubuntu ansibl distribut debian docker daemon path defin name write path systemd file templat src path dest path regist docker servic file notifi restart docker ansibl famili core contain linux core docker path defin name write docker option systemd dropin templat src path dest path notifi restart docker docker path defin name copi docker orphan clean script node copi src path dest bin dir path mode docker orphan clean bool name write docker orphan clean systemd dropin templat src path dest path notifi restart docker docker orphan clean bool meta flush handler,,,,,,,,,,,,,,,,,,,,,,,,,,,,,,,,,,,,,,,,,,,,,,,,
0.0,4.0,4.0,27.0,0.0,0.0,0.0,993f9bd441f0ea79f782b66954b922a65c6eeb1e,0.0,1551796318.0,0.0,0.0,roles/storage/nfs/client/vars/main.yml,0.0,0.0,4.0,0.0,0.0,0.0,0.0,0.0,0.0,0.0,0.0,0.0,0.0,0.0,0.0,0.0,0.0,0.0,0.0,0.0,0.0,0.0,1.0,0.0,0.0,0.0,0.0,0.0,0.0,0.0,0.0,0.0,0.0,0.0,0.0,0.0,4.0,0.0,0.0,0.0,0.0,0.0,0.0,0.0,0.0,0.0,0.0,0.0,1.0,17.0,0.0,0.0,0.0,0.0,roles/storage-client/vars/main.yml,goodrain/rainbond-ansible,3.34,ubuntu ansibl distribut ubuntu debian ansibl distribut debian debian ubuntu ansibl distribut ubuntu debian cento ansibl distribut cent,0.0,0.0,0.0,0.0,0.0,0.0,0.0,0.0,0.0,0.0,0.0,0.0,0.0,0.0,0.0,0.0,0.0,0.0,0.0,0.0,0.0,0.0,0.0,0.0,0.0,0.0,0.0,0.0,0.0,0.0,0.0,0.0,0.0,0.0,0.0,0.0,0.0,0.0,0.0,0.0,0.0,0.0,0.0,0.0,0.0,0.0,0.0,0.0
0.0,3.0,4.0,27.0,5.0,2.0,5.0,993f9bd441f0ea79f782b66954b922a65c6eeb1e,2.0,1551796318.0,1.0,0.0,roles/db/tasks/main.yml,100.0,6.0,24.0,0.0,7.0,4.0,6.0,2.0,1.0,1.0,1.5,0.0,0.0,0.0,0.0,1.0,2.0,2.0,1.0,0.0,0.0,7.0,0.0,0.0,1.0,0.0,1.0,0.0,0.0,0.0,0.0,0.0,0.0,0.0,0.0,0.0,23.0,0.0,1.0,0.0,0.0,6.0,6.0,0.0,0.0,0.0,1.0,0.0,7.0,95.0,7.0,0.0,0.0,1.0,roles/db/tasks/main.yml,goodrain/rainbond-ansible,5.3,name run imag pull command usrlocalbincheck img name check imag pull stat path tmpcheck img regist check img name pull path shell docker pull path rbd imag check path defin name prepar dir file name item statedirectori item rbd dir path name copi role templat src path dest node role dir path name copi conf templat src path dest rbd dir path name copi init script templat src path dest rbd dir path,0.0,0.0,0.0,0.0,0.0,0.0,0.0,0.0,0.0,0.0,0.0,0.0,0.0,0.0,0.0,0.0,0.0,0.0,0.0,0.0,0.0,0.0,0.0,0.0,0.0,0.0,0.0,0.0,0.0,0.0,0.0,0.0,0.0,0.0,0.0,0.0,0.0,0.0,0.0,0.0,0.0,0.0,0.0,0.0,0.0,0.0,0.0,0.0
0.0,1.0,4.0,27.0,0.0,0.0,0.0,993f9bd441f0ea79f782b66954b922a65c6eeb1e,0.0,1551796318.0,0.0,0.0,roles/storage/nfs/server/vars/RedHat-7.yml,0.0,0.0,1.0,0.0,0.0,0.0,0.0,0.0,0.0,0.0,0.0,0.0,0.0,0.0,0.0,0.0,0.0,0.0,0.0,0.0,0.0,0.0,1.0,0.0,0.0,0.0,0.0,0.0,0.0,0.0,0.0,0.0,0.0,0.0,0.0,0.0,1.0,0.0,0.0,0.0,0.0,0.0,0.0,0.0,0.0,0.0,0.0,0.0,1.0,2.0,0.0,0.0,0.0,0.0,roles/storage-server/vars/RedHat-7.yml,goodrain/rainbond-ansible,1.0,nf server daemon nfsserver,0.0,0.0,0.0,0.0,0.0,0.0,0.0,0.0,0.0,0.0,0.0,0.0,0.0,0.0,0.0,0.0,0.0,0.0,0.0,0.0,0.0,0.0,0.0,0.0,0.0,0.0,0.0,0.0,0.0,0.0,0.0,0.0,0.0,0.0,0.0,0.0,0.0,0.0,0.0,0.0,0.0,0.0,0.0,0.0,0.0,0.0,0.0,0.0
0.0,4.0,4.0,27.0,-4.0,-2.0,0.0,993f9bd441f0ea79f782b66954b922a65c6eeb1e,2.0,1551796318.0,1.0,0.0,roles/storage/nfs/server/tasks/main.yml,100.0,9.0,43.0,0.0,4.0,2.0,4.0,8.0,4.0,4.0,3.0,0.0,0.0,0.0,0.0,0.0,3.0,3.0,1.0,0.0,0.0,10.0,0.0,0.0,2.0,4.0,0.0,0.0,0.0,0.0,0.0,1.0,0.0,0.0,0.0,0.0,43.0,0.0,0.0,0.0,0.0,18.0,8.0,0.0,0.0,0.0,3.0,0.0,10.0,121.0,7.0,0.0,0.0,2.0,roles/storage-server/tasks/main.yml,goodrain/rainbond-ansible,5.34,name storag copi check storag templat src check path dest tmpcheck path mode name storag run check storag shell bash tmpcheck path name storag check grdata stat path regist check grdata server name storag check init stat path regist check grdata server import task path name copi export file templat src path dest etcexport owner root group root mode notifi reload nf check grdata path defin name copi export file templat src path dest etcexport owner root group root mode notifi reload nf check grdata path defin name updat export shell exportf name health copi health storag check templat src path dest tmpcheck path owner root group root mode name health run health storag check shell bash tmpcheck path,0.0,0.0,0.0,0.0,0.0,0.0,0.0,0.0,0.0,0.0,0.0,0.0,0.0,0.0,0.0,0.0,0.0,0.0,0.0,0.0,0.0,0.0,0.0,0.0,0.0,0.0,0.0,0.0,0.0,0.0,0.0,0.0,0.0,0.0,0.0,0.0,0.0,0.0,0.0,0.0,0.0,0.0,0.0,0.0,0.0,0.0,0.0,0.0
0.0,4.0,4.0,27.0,0.0,0.0,0.0,993f9bd441f0ea79f782b66954b922a65c6eeb1e,0.0,1551796318.0,0.0,0.0,roles/storage/nfs/server/tasks/setup-RedHat.yml,0.0,1.0,7.0,0.0,0.0,0.0,0.0,0.0,0.0,0.0,0.0,0.0,0.0,0.0,0.0,0.0,0.0,0.0,0.0,0.0,0.0,2.0,0.0,0.0,0.0,0.0,0.0,0.0,0.0,0.0,0.0,0.0,0.0,0.0,0.0,0.0,7.0,0.0,0.0,0.0,0.0,3.0,0.0,0.0,0.0,0.0,0.0,0.0,2.0,27.0,3.0,0.0,0.0,0.0,roles/storage-server/tasks/setup-RedHat.yml,goodrain/rainbond-ansible,4.28,name ensur nf util instal packag namenfsutil statepres name ensur rpcbind run configur servic name rpcbind state nf rpcbind state enabl nf rpcbind enabl,0.0,0.0,0.0,0.0,0.0,0.0,0.0,0.0,0.0,0.0,0.0,0.0,0.0,0.0,0.0,0.0,0.0,0.0,0.0,0.0,0.0,0.0,0.0,0.0,0.0,0.0,0.0,0.0,0.0,0.0,0.0,0.0,0.0,0.0,0.0,0.0,0.0,0.0,0.0,0.0,0.0,0.0,0.0,0.0,0.0,0.0,0.0,0.0
0.0,1.0,4.0,27.0,0.0,0.0,0.0,993f9bd441f0ea79f782b66954b922a65c6eeb1e,0.0,1551796318.0,0.0,0.0,roles/prepare/tasks/once.yml,0.0,3.0,4.0,2.0,0.0,0.0,0.0,0.0,0.0,0.0,0.0,0.0,0.0,0.0,0.0,0.0,0.0,0.0,0.0,0.0,0.0,0.0,4.0,0.0,0.0,0.0,0.0,0.0,0.0,0.0,0.0,0.0,0.0,0.0,0.0,0.0,4.0,0.0,0.0,0.0,0.0,0.0,0.0,0.0,0.0,0.0,0.0,0.0,4.0,10.0,4.0,0.0,0.0,0.0,NA,goodrain/rainbond-ansible,2.52,name make domain prepar name make domain name rsync updat domain name key,,,,,,,,,,,,,,,,,,,,,,,,,,,,,,,,,,,,,,,,,,,,,,,,
0.0,4.0,4.0,27.0,0.0,0.0,0.0,993f9bd441f0ea79f782b66954b922a65c6eeb1e,0.0,1551796318.0,0.0,0.0,roles/lb/tasks/main.yml,0.0,2.0,12.0,0.0,0.0,0.0,0.0,0.0,0.0,0.0,0.0,0.0,0.0,0.0,0.0,0.0,0.0,0.0,0.0,0.0,0.0,3.0,0.0,0.0,0.0,1.0,1.0,0.0,0.0,0.0,0.0,0.0,0.0,0.0,0.0,0.0,10.0,0.0,2.0,0.0,0.0,2.0,2.0,0.0,0.0,0.0,0.0,0.0,3.0,47.0,3.0,0.0,0.0,0.0,roles/lb/tasks/main.yml,goodrain/rainbond-ansible,4.87,name prepar dir file name item statedirectori item rbd dir etcrbdgatewayssl name copi path certif copi src item dest rbd dir etcrbdgatewayssl ownerroot mode fileglob base dir path name copi role templat src path dest node role dir path,0.0,0.0,0.0,0.0,0.0,0.0,0.0,0.0,0.0,0.0,0.0,0.0,0.0,0.0,0.0,0.0,0.0,0.0,0.0,0.0,0.0,0.0,0.0,0.0,0.0,0.0,0.0,0.0,0.0,0.0,0.0,0.0,0.0,0.0,0.0,0.0,0.0,0.0,0.0,0.0,0.0,0.0,0.0,0.0,0.0,0.0,0.0,0.0
0.0,4.0,4.0,27.0,0.0,0.0,0.0,993f9bd441f0ea79f782b66954b922a65c6eeb1e,1.0,1551796318.0,1.0,0.0,roles/network_plugin/calico/tasks/main.yml,100.0,7.0,25.0,2.0,1.0,1.0,1.0,1.0,1.0,1.0,1.0,0.0,0.0,0.0,0.0,1.0,2.0,2.0,1.0,0.0,0.0,7.0,0.0,0.0,1.0,1.0,0.0,0.0,0.0,0.0,0.0,0.0,0.0,0.0,0.0,0.0,25.0,0.0,0.0,0.0,0.0,9.0,8.0,0.0,0.0,0.0,1.0,0.0,7.0,95.0,7.0,0.0,0.0,1.0,roles/network_plugin/calico/tasks/main.yml,goodrain/rainbond-ansible,5.44,name run imag pull command usrlocalbincheck img calico name check imag pull stat path tmpcheck calico img regist check calico img name pull calico path shell docker pull path calico imag check calico path defin name rainbond copi network role templat src path dest node role dir path name network copi calico conf templat src path dest path name network copi calicoctl binari deploy copi src local tool bincalicoctl dest bin dir calicoctl mode name network copi calicoctl cfg templat src path dest path,0.0,0.0,0.0,0.0,0.0,0.0,0.0,0.0,0.0,0.0,0.0,0.0,0.0,0.0,0.0,0.0,0.0,0.0,0.0,0.0,0.0,0.0,0.0,0.0,0.0,0.0,0.0,0.0,0.0,0.0,0.0,0.0,0.0,0.0,0.0,0.0,0.0,0.0,0.0,0.0,0.0,0.0,0.0,0.0,0.0,0.0,0.0,0.0
0.0,4.0,4.0,27.0,0.0,0.0,0.0,993f9bd441f0ea79f782b66954b922a65c6eeb1e,0.0,1551796318.0,0.0,0.0,roles/master/tasks/main.yml,0.0,4.0,18.0,0.0,0.0,0.0,0.0,0.0,0.0,0.0,0.0,0.0,0.0,0.0,0.0,0.0,3.0,6.0,2.0,0.0,0.0,5.0,0.0,0.0,2.0,1.0,0.0,0.0,0.0,0.0,0.0,0.0,0.0,0.0,0.0,0.0,18.0,0.0,0.0,0.0,0.0,3.0,2.0,0.0,0.0,0.0,3.0,0.0,5.0,70.0,5.0,0.0,0.0,1.0,roles/nodeinit/templates/updatedb.sh.j2,goodrain/rainbond-ansible,5.1,name rainbond instal ansibl onlin shell pip instal ansibl instal type onlin name rainbond instal ansibl offlin shell yum instal sshpass pythonpip ansibl instal type onlin name storag check init stat path regist check manag share name rainbond add share templat src path dest path mode check manag path defin name rainbond run share shell bash path check manag path defin,0.0,0.0,0.0,0.0,0.0,0.0,0.0,0.0,0.0,0.0,0.0,0.0,0.0,0.0,0.0,0.0,0.0,0.0,0.0,0.0,0.0,0.0,0.0,0.0,0.0,0.0,0.0,0.0,0.0,0.0,0.0,0.0,0.0,0.0,0.0,0.0,0.0,0.0,0.0,0.0,0.0,0.0,0.0,0.0,0.0,0.0,0.0,0.0
0.0,22.0,4.0,27.0,6.0,3.0,6.0,993f9bd441f0ea79f782b66954b922a65c6eeb1e,2.0,1551796318.0,1.0,0.0,roles/docker/defaults/main.yml,100.0,10.0,22.0,5.0,8.0,4.0,7.0,2.0,1.0,1.0,1.5,0.0,0.0,0.0,0.0,0.0,0.0,0.0,0.0,0.0,0.0,0.0,1.0,0.0,0.0,0.0,0.0,0.0,0.0,0.0,0.0,0.0,0.0,0.0,0.0,0.0,22.0,0.0,0.0,0.0,0.0,0.0,0.0,0.0,0.0,0.0,0.0,0.0,1.0,43.0,0.0,0.0,0.0,0.0,roles/docker/defaults/main.yml,goodrain/rainbond-ansible,5.38,docker dn server strict docker contain storag setup yum conf path yum repo dir path docker yum conf etcyum path docker repo base url http path basearchst docker repo gpgkey http path docker ubuntu repo base url http path docker ubuntu repo gpgkey http path docker debian repo base url http path docker debian repo gpgkey http path docker bin dir usrbin docker orphan clean reg mirror http path reg mirror http path log driver jsonfil log level warn log max size log max file storag dir varlibdock insecur reg path docker min version,0.0,0.0,0.0,0.0,0.0,0.0,0.0,0.0,0.0,0.0,0.0,0.0,0.0,0.0,0.0,0.0,0.0,0.0,0.0,0.0,0.0,0.0,0.0,0.0,0.0,0.0,0.0,0.0,0.0,0.0,0.0,0.0,0.0,0.0,0.0,0.0,0.0,0.0,0.0,0.0,0.0,0.0,0.0,0.0,0.0,0.0,0.0,0.0
0.0,3.0,4.0,27.0,1.0,1.0,1.0,993f9bd441f0ea79f782b66954b922a65c6eeb1e,1.0,1551796318.0,1.0,0.0,roles/prepare/tasks/offline.yml,100.0,5.0,18.0,0.0,7.0,7.0,7.0,6.0,6.0,6.0,7.0,0.0,0.0,0.0,0.0,1.0,2.0,7.0,4.0,1.0,0.0,6.0,0.0,0.0,0.0,0.0,2.0,0.0,0.0,0.0,0.0,0.0,0.0,0.0,0.0,0.0,18.0,0.0,0.0,0.0,0.0,0.0,0.0,0.0,0.0,0.0,1.0,0.0,6.0,83.0,6.0,0.0,0.0,1.0,roles/prepare/tasks/offline.yml,goodrain/rainbond-ansible,5.34,name offlin creat init directori file path statedirectori name offlin creat backup directori file path statedirectori name offlin check offlin repo stat path regist offlin repo name offlin clean old repositori shell path path touch path ansibl distribut cent offlin path defin name offlin add cent repositori templat path path ansibl distribut cent offlin path defin name offlin yumcleanmetadata command yum clean arg warn ansibl distribut cent,0.0,0.0,0.0,0.0,0.0,0.0,0.0,0.0,0.0,0.0,0.0,0.0,0.0,0.0,0.0,0.0,0.0,0.0,0.0,0.0,0.0,0.0,0.0,0.0,0.0,0.0,0.0,0.0,0.0,0.0,0.0,0.0,0.0,0.0,0.0,0.0,0.0,0.0,0.0,0.0,0.0,0.0,0.0,0.0,0.0,0.0,0.0,0.0
0.0,5.0,4.0,27.0,0.0,0.0,0.0,993f9bd441f0ea79f782b66954b922a65c6eeb1e,1.0,1551796318.0,1.0,0.0,roles/image/tasks/offline_images.yml,100.0,25.0,5.0,118.0,26.0,26.0,26.0,26.0,26.0,26.0,15.0,0.0,0.0,0.0,0.0,0.0,1.0,0.0,0.0,0.0,0.0,1.0,0.0,0.0,0.0,0.0,0.0,0.0,0.0,0.0,0.0,0.0,0.0,0.0,0.0,0.0,5.0,0.0,0.0,0.0,0.0,0.0,0.0,0.0,0.0,0.0,1.0,0.0,1.0,20.0,1.0,0.0,0.0,1.0,roles/image/tasks/offline_images.yml,goodrain/rainbond-ansible,4.22,name rainbond load imag local shell bash base dir path regist load task result load task result succeed retri,0.0,0.0,0.0,0.0,0.0,0.0,0.0,0.0,0.0,0.0,0.0,0.0,0.0,0.0,0.0,0.0,0.0,0.0,0.0,0.0,0.0,0.0,0.0,0.0,0.0,0.0,0.0,0.0,0.0,0.0,0.0,0.0,0.0,0.0,0.0,0.0,0.0,0.0,0.0,0.0,0.0,0.0,0.0,0.0,0.0,0.0,0.0,0.0
0.0,3.0,4.0,27.0,0.0,0.0,0.0,993f9bd441f0ea79f782b66954b922a65c6eeb1e,0.0,1551796318.0,0.0,0.0,roles/storage/nfs/client/tasks/setup.yml,0.0,4.0,14.0,0.0,0.0,0.0,0.0,0.0,0.0,0.0,0.0,0.0,0.0,0.0,0.0,0.0,0.0,4.0,0.0,0.0,0.0,0.0,5.0,0.0,0.0,0.0,0.0,0.0,0.0,0.0,0.0,0.0,0.0,0.0,0.0,0.0,14.0,0.0,0.0,0.0,1.0,0.0,0.0,0.0,0.0,0.0,0.0,0.0,5.0,65.0,5.0,0.0,0.0,0.0,roles/storage/nfs/client/tasks/setup.yml,goodrain/rainbond-ansible,4.82,name instal nf client debian action apt pkgnfscommon statepres ansibl famili debian name instal nf client cento action yum pkgnfsutil statepres ansibl famili red hat name ensur rpcbind run cent action servic namerpcbind statestart enabledy ansibl famili red hat name ensur rpcbind run debian action servic namerpcbind statestart enabledy ansibl famili debian name ensur nfsmount directori exist action file path nfsmount statedirectori,0.0,0.0,0.0,0.0,0.0,0.0,0.0,0.0,0.0,0.0,0.0,0.0,0.0,0.0,0.0,0.0,0.0,0.0,0.0,0.0,0.0,0.0,0.0,0.0,0.0,0.0,0.0,0.0,0.0,0.0,0.0,0.0,0.0,0.0,0.0,0.0,0.0,0.0,0.0,0.0,0.0,0.0,0.0,0.0,0.0,0.0,0.0,0.0
0.0,1.0,4.0,27.0,0.0,0.0,0.0,993f9bd441f0ea79f782b66954b922a65c6eeb1e,0.0,1551796318.0,0.0,0.0,roles/nodeinit/defaults/main.yml,0.0,0.0,1.0,0.0,0.0,0.0,0.0,0.0,0.0,0.0,0.0,0.0,0.0,0.0,0.0,0.0,0.0,0.0,0.0,0.0,0.0,0.0,1.0,0.0,0.0,0.0,0.0,0.0,0.0,0.0,0.0,0.0,0.0,0.0,0.0,0.0,1.0,0.0,0.0,0.0,0.0,0.0,0.0,0.0,0.0,0.0,0.0,0.0,1.0,2.0,0.0,0.0,0.0,0.0,roles/nodeinit/defaults/main.yml,goodrain/rainbond-ansible,1.0,lbip hostvar group,0.0,0.0,0.0,0.0,0.0,0.0,0.0,0.0,0.0,0.0,0.0,0.0,0.0,0.0,0.0,0.0,0.0,0.0,0.0,0.0,0.0,0.0,0.0,0.0,0.0,0.0,0.0,0.0,0.0,0.0,0.0,0.0,0.0,0.0,0.0,0.0,0.0,0.0,0.0,0.0,0.0,0.0,0.0,0.0,0.0,0.0,0.0,0.0
0.0,5.0,4.0,27.0,0.0,0.0,0.0,993f9bd441f0ea79f782b66954b922a65c6eeb1e,1.0,1551796318.0,1.0,0.0,roles/nodeup/tasks/main.yml,100.0,1.0,10.0,0.0,2.0,2.0,2.0,2.0,2.0,2.0,2.0,0.0,0.0,0.0,0.0,0.0,1.0,0.0,0.0,0.0,0.0,2.0,0.0,0.0,0.0,1.0,0.0,0.0,0.0,0.0,0.0,0.0,0.0,0.0,0.0,0.0,10.0,0.0,0.0,0.0,0.0,3.0,2.0,0.0,0.0,0.0,1.0,0.0,2.0,29.0,2.0,0.0,0.0,1.0,roles/nodeup/tasks/main.yml,goodrain/rainbond-ansible,4.38,name rainbond prepar node templat src path dest path mode name rainbond node shell bash path regist nodeup task result nodeup task result succeed retri,0.0,0.0,0.0,0.0,0.0,0.0,0.0,0.0,0.0,0.0,0.0,0.0,0.0,0.0,0.0,0.0,0.0,0.0,0.0,0.0,0.0,0.0,0.0,0.0,0.0,0.0,0.0,0.0,0.0,0.0,0.0,0.0,0.0,0.0,0.0,0.0,0.0,0.0,0.0,0.0,0.0,0.0,0.0,0.0,0.0,0.0,0.0,0.0
0.0,7.0,4.0,27.0,24.0,24.0,24.0,993f9bd441f0ea79f782b66954b922a65c6eeb1e,1.0,1551796318.0,1.0,0.0,roles/prepare/tasks/centos.yml,100.0,4.0,36.0,3.0,24.0,24.0,24.0,0.0,0.0,0.0,1.0,0.0,0.0,0.0,0.0,0.0,1.0,1.0,0.0,0.0,0.0,5.0,0.0,0.0,0.0,0.0,0.0,0.0,0.0,0.0,0.0,0.0,0.0,0.0,0.0,0.0,20.0,0.0,0.0,0.0,0.0,7.0,1.0,0.0,1.0,0.0,1.0,0.0,5.0,70.0,21.0,0.0,0.0,0.0,roles/prepare/tasks/centos.yml,goodrain/rainbond-ansible,5.54,name pkg remov cento pkg yum name firewalld pythonfirewal firewalldfilesystem dnsmasq nscd state absent tag prepar name pkg add epel repo yum nameepelreleas statelatest instal type onlin name pkg instal cento packag yum name conntracktool psmisc nfsutil socat bashcomplet rsync ipset ipvsadm nettool expect state latest name system disabl selinux shell setenforc fail name system disabl selinux forov lineinfil dest etcselinuxconfig regexp selinux line selinuxdis,0.0,0.0,0.0,0.0,0.0,0.0,0.0,0.0,0.0,0.0,0.0,0.0,0.0,0.0,0.0,0.0,0.0,0.0,0.0,0.0,0.0,0.0,0.0,0.0,0.0,0.0,0.0,0.0,0.0,0.0,0.0,0.0,0.0,0.0,0.0,0.0,0.0,0.0,0.0,0.0,0.0,0.0,0.0,0.0,0.0,0.0,0.0,0.0
0.0,4.0,4.0,27.0,0.0,0.0,0.0,993f9bd441f0ea79f782b66954b922a65c6eeb1e,1.0,1551796318.0,1.0,0.0,roles/nodeinit/tasks/main.yml,100.0,10.0,47.0,0.0,8.0,8.0,8.0,8.0,8.0,8.0,8.0,0.0,0.0,0.0,0.0,0.0,4.0,2.0,0.0,0.0,0.0,11.0,0.0,0.0,2.0,3.0,0.0,0.0,0.0,0.0,0.0,0.0,0.0,0.0,0.0,0.0,47.0,0.0,0.0,0.0,0.0,13.0,8.0,0.0,0.0,0.0,4.0,0.0,11.0,188.0,9.0,0.0,0.0,4.0,roles/nodeinit/tasks/main.yml,goodrain/rainbond-ansible,5.79,name rainbond copi script templat src path dest path mode name rainbond copi imag push script templat src path dest path mode name rainbond copi check insecur registri templat src check path dest tmpcheck path mode name rainbond copi init script templat src path dest path name next task may take time execut debug msg next task may take time execut wait init name rainbond run init shell bash path init path regist updatedb task result updatedb task result succeed retri name rainbond check init shell bash path check path regist checkdb task result checkdb task result succeed retri name rainbond check path shell bash tmpcheck path name rainbond check check stat path regist check goodrainm done name next task may take time execut debug msg next task may take time execut wait push local imag path check goodrainm path defin name rainbond push local imag path shell bash path regist pushimag task result pushimag task result succeed retri check goodrainm path defin,0.0,0.0,0.0,0.0,0.0,0.0,0.0,0.0,0.0,0.0,0.0,0.0,0.0,0.0,0.0,0.0,0.0,0.0,0.0,0.0,0.0,0.0,0.0,0.0,0.0,0.0,0.0,0.0,0.0,0.0,0.0,0.0,0.0,0.0,0.0,0.0,0.0,0.0,0.0,0.0,0.0,0.0,0.0,0.0,0.0,0.0,0.0,0.0
0.0,6.0,4.0,27.0,0.0,0.0,0.0,993f9bd441f0ea79f782b66954b922a65c6eeb1e,1.0,1551796318.0,1.0,0.0,roles/health/defaults/main.yml,100.0,0.0,13.0,0.0,7.0,7.0,7.0,7.0,7.0,7.0,5.0,0.0,0.0,0.0,0.0,0.0,0.0,0.0,0.0,0.0,0.0,0.0,1.0,0.0,0.0,0.0,0.0,0.0,0.0,0.0,0.0,0.0,0.0,0.0,0.0,0.0,3.0,0.0,0.0,0.0,0.0,0.0,0.0,0.0,0.0,0.0,0.0,0.0,1.0,41.0,0.0,0.0,0.0,0.0,roles/health/defaults/main.yml,goodrain/rainbond-ansible,3.77,nodeip hostvar inventori hostnam run mode inventori hostnam group master master els worker endif noderul inventori hostnam group master inventori hostnam group worker manag comput els manag endif els comput endif,0.0,0.0,0.0,0.0,0.0,0.0,0.0,0.0,0.0,0.0,0.0,0.0,0.0,0.0,0.0,0.0,0.0,0.0,0.0,0.0,0.0,0.0,0.0,0.0,0.0,0.0,0.0,0.0,0.0,0.0,0.0,0.0,0.0,0.0,0.0,0.0,0.0,0.0,0.0,0.0,0.0,0.0,0.0,0.0,0.0,0.0,0.0,0.0
0.0,1.0,4.0,27.0,0.0,0.0,0.0,993f9bd441f0ea79f782b66954b922a65c6eeb1e,0.0,1551796318.0,0.0,0.0,roles/storage/nfs/server/vars/Debian.yml,0.0,0.0,1.0,0.0,0.0,0.0,0.0,0.0,0.0,0.0,0.0,0.0,0.0,0.0,0.0,0.0,0.0,0.0,0.0,0.0,0.0,0.0,1.0,0.0,0.0,0.0,0.0,0.0,0.0,0.0,0.0,0.0,0.0,0.0,0.0,0.0,1.0,0.0,0.0,0.0,0.0,0.0,0.0,0.0,0.0,0.0,0.0,0.0,1.0,2.0,0.0,0.0,0.0,0.0,roles/storage-server/vars/Debian.yml,goodrain/rainbond-ansible,1.0,nf server daemon nfskernelserv,0.0,0.0,0.0,0.0,0.0,0.0,0.0,0.0,0.0,0.0,0.0,0.0,0.0,0.0,0.0,0.0,0.0,0.0,0.0,0.0,0.0,0.0,0.0,0.0,0.0,0.0,0.0,0.0,0.0,0.0,0.0,0.0,0.0,0.0,0.0,0.0,0.0,0.0,0.0,0.0,0.0,0.0,0.0,0.0,0.0,0.0,0.0,0.0
0.0,4.0,4.0,27.0,0.0,0.0,0.0,993f9bd441f0ea79f782b66954b922a65c6eeb1e,0.0,1551796318.0,0.0,0.0,roles/network_plugin/flannel/tasks/main.yml,0.0,7.0,27.0,6.0,0.0,0.0,0.0,0.0,0.0,0.0,0.0,0.0,0.0,0.0,0.0,0.0,1.0,0.0,0.0,0.0,0.0,6.0,0.0,0.0,0.0,3.0,0.0,0.0,0.0,0.0,0.0,0.0,0.0,0.0,0.0,0.0,27.0,0.0,0.0,0.0,0.0,13.0,10.0,0.0,0.0,0.0,1.0,0.0,6.0,87.0,6.0,0.0,0.0,0.0,roles/network_plugin/flannel/tasks/main.yml,goodrain/rainbond-ansible,4.89,name rainbond copi network role templat src path dest node role dir path name network copi flanneld servic templat src path dest env dir path mode name network copi init flanneld templat src path dest env dir path mode name network copi flanneld copi src local tool cnibinflanneld dest bin dir flanneld mode name network copi flannel conf templat src path dest path name network run init flanneld shell bash env dir path run deleg group master,0.0,0.0,0.0,0.0,0.0,0.0,0.0,0.0,0.0,0.0,0.0,0.0,0.0,0.0,0.0,0.0,0.0,0.0,0.0,0.0,0.0,0.0,0.0,0.0,0.0,0.0,0.0,0.0,0.0,0.0,0.0,0.0,0.0,0.0,0.0,0.0,0.0,0.0,0.0,0.0,0.0,0.0,0.0,0.0,0.0,0.0,0.0,0.0
0.0,7.0,4.0,27.0,1.0,1.0,1.0,993f9bd441f0ea79f782b66954b922a65c6eeb1e,1.0,1551796318.0,1.0,0.0,roles/prepare/tasks/common.yml,100.0,24.0,151.0,10.0,1.0,1.0,1.0,0.0,0.0,0.0,1.0,0.0,0.0,0.0,0.0,0.0,2.0,4.0,0.0,0.0,0.0,22.0,0.0,0.0,3.0,5.0,2.0,4.0,5.0,0.0,0.0,0.0,0.0,0.0,0.0,0.0,111.0,1.0,3.0,0.0,0.0,50.0,17.0,0.0,3.0,0.0,2.0,0.0,22.0,458.0,22.0,0.0,0.0,1.0,roles/prepare/tasks/common.yml,goodrain/rainbond-ansible,6.97,name dir prepar rainbond file name item statedirectori item bin dir dir cachebuild cachesourc rbd dir path rbd dir etckubernetesssl rbd dir etckuberneteskubecfg rbd dir health rbd dir data rbd dir log rbd dir env rbd dir scriptsinit rbd dir conf rbd dir etccni rbd dir bin rbd dir etcnod rbd dir path rbd dir etctool rbd dir rainbondans path etcdock path grdataservicesssh grdataservicesstorag grdataservicesofflineimag grdatakubernet etcnetwork path etccalico path tag master name host popul inventori host file blockinfil dest etchost block item group master group worker group etcd group group newmast group newwork default uniqu hostvar item item endfor state present creat ye backup ye marker name host localhost ipv host file lineinfil dest etchost line localhost path regexp state present backup ye name host localhost ipv host file lineinfil dest etchost line localhost path regexp state present backup ye name tool copi rainbond tool copi src item dest bin dir ownerroot mode fileglob base dir hackfilesbingrtool name user creat rain user group group name rain gid system ye state present name user creat rain user user name rain uid shell sbinnologin comment rainbond user creat home ye group rain system ye state present name creat remot tmp use anoth modul file path lookup config default remot tmp missingskip wantlisttru first default path state directori mode name system updat ulimit templat path path name system add network manag templat src path dest etcnetwork path ignor error name system disabl swap shell swapoff sysctl path ignor error name system disabl swap fstab lineinfil path etcfstab regexp swap state absent backup ye tag prepar name system modprob modprob name item statepres item netfilt wrr conntrack ipv ignor error tag prepar name system add conntrack kernel modprob namenf conntrack statepres ignor error ansibl kernel name system path templat path path name system sysctl shell sysctl path ignor error name system deploy check ssh stat path path path regist deploy check ssh deleg path name system copi ssh pub key builder pub key copi src path path dest grdataservicessshbuild path mode deploy check path defin name system copi ssh key builder key copi src path rsa dest grdataservicessshbuild rsa mode deploy check path defin name system copi ssh config copi src base dir hackfilessshconfig dest grdataservicessshconfig mode deploy check path defin name system copi path certif copi src base dir path dest path name rainbond copi grctl deploy templat src path dest path,0.0,0.0,0.0,0.0,0.0,0.0,0.0,0.0,0.0,0.0,0.0,0.0,0.0,0.0,0.0,0.0,0.0,0.0,0.0,0.0,0.0,0.0,0.0,0.0,0.0,0.0,0.0,0.0,0.0,0.0,0.0,0.0,0.0,0.0,0.0,0.0,0.0,0.0,0.0,0.0,0.0,0.0,0.0,0.0,0.0,0.0,0.0,0.0
0.0,3.0,4.0,27.0,0.0,0.0,0.0,993f9bd441f0ea79f782b66954b922a65c6eeb1e,1.0,1551796318.0,1.0,0.0,roles/kube-master/defaults/main.yml,100.0,0.0,5.0,0.0,3.0,3.0,3.0,3.0,3.0,3.0,2.0,0.0,0.0,0.0,0.0,0.0,0.0,0.0,0.0,0.0,0.0,0.0,1.0,0.0,0.0,0.0,0.0,0.0,0.0,0.0,0.0,0.0,0.0,0.0,0.0,0.0,2.0,0.0,0.0,0.0,0.0,0.0,0.0,0.0,0.0,0.0,0.0,0.0,1.0,21.0,0.0,0.0,0.0,0.0,roles/kube-master/defaults/main.yml,goodrain/rainbond-ansible,4.3,master access address hostvar inventori hostnam etcd endpoint item group etcd http hostvar item etcd port path endif endfor,0.0,0.0,0.0,0.0,0.0,0.0,0.0,0.0,0.0,0.0,0.0,0.0,0.0,0.0,0.0,0.0,0.0,0.0,0.0,0.0,0.0,0.0,0.0,0.0,0.0,0.0,0.0,0.0,0.0,0.0,0.0,0.0,0.0,0.0,0.0,0.0,0.0,0.0,0.0,0.0,0.0,0.0,0.0,0.0,0.0,0.0,0.0,0.0
0.0,7.0,4.0,27.0,0.0,0.0,0.0,993f9bd441f0ea79f782b66954b922a65c6eeb1e,1.0,1551796318.0,1.0,0.0,roles/network_plugin/calico/defaults/main.yml,100.0,3.0,9.0,2.0,3.0,3.0,3.0,3.0,3.0,3.0,2.0,0.0,0.0,0.0,0.0,0.0,0.0,0.0,0.0,0.0,0.0,0.0,1.0,0.0,0.0,0.0,0.0,0.0,0.0,0.0,0.0,0.0,0.0,0.0,0.0,0.0,6.0,0.0,0.0,0.0,0.0,0.0,0.0,0.0,0.0,0.0,0.0,0.0,1.0,31.0,0.0,0.0,0.0,0.0,roles/network_plugin/calico/defaults/main.yml,goodrain/rainbond-ansible,4.89,calico ipvpool ipip alway felix log lvl warn autodetect method canreach path node multipl network nodeip hostvar inventori hostnam etcd endpoint item group etcd http hostvar item etcd port path endif endfor,0.0,0.0,0.0,0.0,0.0,0.0,0.0,0.0,0.0,0.0,0.0,0.0,0.0,0.0,0.0,0.0,0.0,0.0,0.0,0.0,0.0,0.0,0.0,0.0,0.0,0.0,0.0,0.0,0.0,0.0,0.0,0.0,0.0,0.0,0.0,0.0,0.0,0.0,0.0,0.0,0.0,0.0,0.0,0.0,0.0,0.0,0.0,0.0
