avg_play_size,avg_task_size,change_set_avg,change_set_max,code_churn,code_churn_avg,code_churn_max,commit,commits_count,committed_at,contributors,defective,filepath,highest_experience,lines_blank,lines_code,lines_comment,loc_added,loc_added_avg,loc_added_max,loc_removed,loc_removed_avg,loc_removed_max,median_hunks_count,minor_contributors,num_authorized_key,num_block_error_handling,num_blocks,num_command_calls,num_commands,num_conditions,num_decisions,num_deprecated_keywords,num_deprecated_modules,num_distinct_modules,num_external_modules,num_fact_modules,num_file_exists,num_file_mode,num_file_modules,num_filters,num_ignore_errors,num_import_playbook,num_import_role,num_import_tasks,num_include,num_include_role,num_include_tasks,num_include_vars,num_keys,num_lookups,num_loops,num_math_operations,num_names_with_vars,num_parameters,num_paths,num_plays,num_regex,num_roles,num_sh_commands,num_suspicious_comments,num_tasks,num_tokens,num_unique_names,num_uri,num_user_interaction,num_vars,path_when_added,repo,text_entropy,tokens
0.0,22.0,3.0,37.0,24.0,3.0,133.0,60f87713fc097665376ca0fce1be1ba291a52fe7,7.0,1521309621.0,2.0,0.0,meta/main.yml,51.0,1.0,22.0,0.0,162.0,23.0,133.0,138.0,20.0,129.0,2.0,0.0,0.0,0.0,0.0,0.0,0.0,0.0,0.0,0.0,0.0,0.0,1.0,0.0,0.0,0.0,0.0,0.0,0.0,0.0,0.0,0.0,0.0,0.0,0.0,0.0,11.0,0.0,0.0,0.0,0.0,0.0,0.0,0.0,0.0,0.0,0.0,0.0,1.0,36.0,1.0,0.0,0.0,0.0,meta/main.yml,HanXHX/ansible-mysql,5.06,galaxi info author emilien mantel descript instal configur maria galera cluster debian compani licens gplv min ansibl version platform name debian version stretch galaxi tag databas databas sql packag mysql mariadb replic debian galera cluster stretch depend
0.0,4.0,3.0,37.0,25.0,6.0,19.0,60f87713fc097665376ca0fce1be1ba291a52fe7,4.0,1521309621.0,2.0,0.0,tasks/galera/main.yml,53.66,4.0,20.0,0.0,33.0,8.0,19.0,8.0,2.0,4.0,1.5,0.0,0.0,0.0,0.0,0.0,0.0,6.0,6.0,0.0,0.0,4.0,0.0,0.0,0.0,0.0,0.0,0.0,0.0,0.0,0.0,0.0,2.0,0.0,0.0,0.0,16.0,0.0,0.0,0.0,0.0,4.0,2.0,0.0,0.0,0.0,0.0,0.0,4.0,68.0,5.0,0.0,0.0,1.0,tasks/galera/main.yml,HanXHX/ansible-mysql,5.45,name templat deploy galera configur templat src path dest path regist galeraconfig name includ bootstrap first node includ path inventori hostnam mariadb galera primari node name includ configur node includ path inventori hostnam mariadb galera primari node name servic restart maria need servic name mysql state restart galeraconfig defin path bootstrap run defin inventori hostnam mariadb galera primari node mariadb galera resetup
0.0,9.0,3.0,37.0,35.0,9.0,29.0,60f87713fc097665376ca0fce1be1ba291a52fe7,4.0,1521309621.0,2.0,0.0,tasks/galera/nodes.yml,54.72,7.0,27.0,0.0,44.0,11.0,29.0,9.0,2.0,8.0,1.5,0.0,0.0,0.0,1.0,2.0,2.0,1.0,0.0,0.0,0.0,2.0,1.0,0.0,0.0,0.0,0.0,0.0,0.0,0.0,0.0,0.0,0.0,0.0,0.0,0.0,27.0,0.0,0.0,0.0,0.0,0.0,0.0,0.0,0.0,0.0,0.0,0.0,3.0,77.0,5.0,0.0,0.0,3.0,tasks/galera/nodes.yml,HanXHX/ansible-mysql,5.31,name command get path primari node command cat path regist debiancnf deleg mariadb galera primari node chang name command get current path command cat path regist ondc chang block name servic stop maria servic name mysql state stop name copi past primari node path copi content path dest path mode owner root group root regist past name servic start maria servic name mysql state start path path
0.0,5.0,3.0,37.0,24.0,5.0,23.0,60f87713fc097665376ca0fce1be1ba291a52fe7,5.0,1521309621.0,2.0,0.0,tasks/replication/slave/replication.yml,64.06,4.0,19.0,0.0,44.0,9.0,23.0,20.0,4.0,12.0,1.0,0.0,0.0,0.0,0.0,0.0,0.0,2.0,1.0,0.0,0.0,4.0,0.0,0.0,0.0,0.0,0.0,0.0,0.0,0.0,0.0,0.0,0.0,0.0,0.0,0.0,19.0,0.0,0.0,0.0,0.0,10.0,0.0,0.0,0.0,0.0,0.0,0.0,4.0,65.0,4.0,0.0,0.0,0.0,tasks/slave/replication.yml,HanXHX/ansible-mysql,4.71,name mysql replic stop slave mysql replic mode stopslav name mysql replic configur master host mysql replic mode changemast master host mariadb replic host master port mariadb replic port master user mariadb replic user master password mariadb replic password name mysql replic chang master mysql replic mode changemast master log file mariadb master log file master log po mariadb master log po mariadb master log file defin mariadb master log po defin name mysql replic start slave mysql replic mode startslav
0.0,3.0,3.0,37.0,16.0,3.0,14.0,60f87713fc097665376ca0fce1be1ba291a52fe7,5.0,1521309621.0,2.0,0.0,tasks/replication/slave/gtid.yml,58.33,4.0,8.0,3.0,20.0,4.0,14.0,4.0,1.0,2.0,1.0,0.0,0.0,0.0,0.0,1.0,1.0,0.0,0.0,0.0,0.0,3.0,0.0,0.0,0.0,0.0,0.0,0.0,0.0,0.0,0.0,0.0,0.0,0.0,0.0,0.0,8.0,0.0,0.0,0.0,0.0,2.0,0.0,0.0,0.0,0.0,0.0,0.0,3.0,30.0,3.0,0.0,0.0,0.0,tasks/slave/mariadb_gtid.yml,HanXHX/ansible-mysql,4.32,name mysql replic stop slave mysql replic mode stopslav name command migrat maria gtid command mariadb chang master master use gtidcurr po name mysql replic start slave mysql replic mode startslav
0.0,3.0,3.0,37.0,9.0,2.0,12.0,60f87713fc097665376ca0fce1be1ba291a52fe7,6.0,1521309621.0,2.0,0.0,tasks/replication/main.yml,63.41,2.0,6.0,0.0,25.0,4.0,12.0,16.0,3.0,10.0,1.0,0.0,0.0,0.0,0.0,0.0,0.0,0.0,0.0,0.0,0.0,2.0,0.0,0.0,0.0,0.0,0.0,0.0,0.0,0.0,0.0,0.0,2.0,0.0,0.0,0.0,6.0,0.0,0.0,0.0,0.0,0.0,0.0,0.0,0.0,0.0,0.0,0.0,2.0,18.0,2.0,0.0,0.0,0.0,tasks/detect_gtid.yml,HanXHX/ansible-mysql,3.5,name includ replic master includ path mariadb replic master name includ replic slave includ path mariadb replic slave
0.0,5.0,3.0,37.0,7.0,2.0,5.0,60f87713fc097665376ca0fce1be1ba291a52fe7,4.0,1521309621.0,2.0,0.0,tasks/replication/master.yml,52.94,1.0,5.0,0.0,12.0,3.0,5.0,5.0,1.0,3.0,1.0,0.0,0.0,0.0,0.0,0.0,0.0,0.0,0.0,0.0,0.0,1.0,0.0,0.0,0.0,0.0,0.0,0.0,0.0,0.0,0.0,0.0,0.0,0.0,0.0,0.0,5.0,0.0,0.0,0.0,0.0,2.0,2.0,0.0,0.0,0.0,0.0,0.0,1.0,14.0,1.0,0.0,0.0,0.0,tasks/replication/master.yml,HanXHX/ansible-mysql,3.81,name templat deploy master configur templat src path dest path notifi restart mariadb
0.0,4.0,3.0,37.0,24.0,1.0,27.0,60f87713fc097665376ca0fce1be1ba291a52fe7,21.0,1521309621.0,2.0,1.0,tasks/install/main.yml,52.97,5.0,18.0,0.0,113.0,5.0,27.0,89.0,4.0,25.0,1.0,0.0,0.0,0.0,0.0,0.0,0.0,3.0,1.0,0.0,0.0,5.0,0.0,0.0,0.0,0.0,0.0,0.0,0.0,0.0,0.0,0.0,3.0,0.0,0.0,0.0,18.0,0.0,1.0,0.0,0.0,3.0,0.0,0.0,0.0,0.0,0.0,0.0,5.0,74.0,5.0,0.0,0.0,0.0,tasks/install.yml,HanXHX/ansible-mysql,5.09,name includ use percona repositori includ path mariadb use percona apt name includ instal maria debian repo includ path mariadb origin default mariadb vendor mariadb name includ instal maria maria repo includ path mariadb origin upstream name apt instal maria relat tool apt pkg item instal recommend item mariadb tool name apt instal perconaxtrabackup need apt pkg mariadb xtrabackup packag mariadb instal xtrabackup packag
0.0,4.0,3.0,37.0,24.0,2.0,22.0,60f87713fc097665376ca0fce1be1ba291a52fe7,12.0,1521309621.0,3.0,0.0,tasks/install/mariadb/upstream.yml,54.65,5.0,18.0,0.0,55.0,5.0,22.0,31.0,3.0,10.0,1.5,0.0,0.0,0.0,0.0,0.0,0.0,0.0,0.0,0.0,0.0,5.0,0.0,0.0,0.0,0.0,0.0,0.0,0.0,0.0,0.0,0.0,1.0,0.0,0.0,0.0,18.0,0.0,1.0,0.0,0.0,6.0,2.0,0.0,0.0,0.0,0.0,0.0,5.0,76.0,5.0,0.0,0.0,0.0,tasks/install_mariadb_mariadb.yml,HanXHX/ansible-mysql,5.13,name apt key instal maria key apt key keyserv mariadb key server item item mariadb key id name templat deploy apt pin prevent upgrad debian templat src path dest path name apt repositori add maria repositori apt repositori repo deb mariadb repositori ansibl distribut releas main name apt repositori add maria src repositori apt repositori repo debsrc mariadb repositori ansibl distribut releas main mariadb upstream apt src name includ normal instal includ path
0.0,8.0,3.0,37.0,28.0,9.0,21.0,60f87713fc097665376ca0fce1be1ba291a52fe7,3.0,1521309621.0,2.0,0.0,tasks/secure.yml,55.26,3.0,24.0,0.0,33.0,11.0,21.0,5.0,2.0,4.0,1.0,0.0,0.0,0.0,0.0,0.0,0.0,0.0,0.0,0.0,0.0,3.0,0.0,0.0,0.0,0.0,0.0,0.0,0.0,0.0,0.0,0.0,0.0,0.0,0.0,0.0,16.0,0.0,2.0,0.0,0.0,8.0,0.0,0.0,0.0,0.0,0.0,0.0,3.0,63.0,6.0,0.0,0.0,0.0,tasks/secure.yml,HanXHX/ansible-mysql,4.74,name mysql user updat mysql root password root account mysql user name root host item password mariadb root password item ansibl hostnam localhost name mysql user remov anonym user mysql user name host item state absent item ansibl hostnam localhost name mysql remov test databas mysql name test state absent
0.0,5.0,3.0,37.0,19.0,10.0,19.0,60f87713fc097665376ca0fce1be1ba291a52fe7,2.0,1521309621.0,1.0,0.0,tasks/replication/slave/ssh.yml,100.0,3.0,15.0,0.0,21.0,10.0,19.0,2.0,1.0,2.0,1.5,0.0,1.0,0.0,0.0,1.0,2.0,0.0,0.0,1.0,0.0,3.0,0.0,0.0,0.0,0.0,0.0,0.0,0.0,0.0,0.0,0.0,0.0,0.0,0.0,0.0,15.0,0.0,0.0,0.0,0.0,3.0,0.0,0.0,0.0,0.0,1.0,0.0,3.0,67.0,3.0,0.0,0.0,1.0,tasks/replication/slave/ssh.yml,HanXHX/ansible-mysql,5.42,name shell creat ssh key need slave shell sshkeygen rsa ansibl path path rsa arg creat ansibl path path rsa name command get pub key command cat ansibl path path path regist pub key chang name author key auth slave backup host author key user mariadb backup user state present key pub path deleg mariadb slave import becom ye
0.0,6.0,3.0,37.0,22.0,6.0,21.0,60f87713fc097665376ca0fce1be1ba291a52fe7,4.0,1521309621.0,2.0,0.0,tasks/replication/slave/debiancnf.yml,58.0,3.0,18.0,0.0,36.0,9.0,21.0,14.0,4.0,9.0,2.0,0.0,0.0,0.0,0.0,0.0,0.0,0.0,0.0,0.0,0.0,2.0,1.0,0.0,0.0,1.0,0.0,0.0,0.0,0.0,0.0,0.0,0.0,0.0,0.0,0.0,18.0,0.0,0.0,0.0,0.0,8.0,4.0,0.0,0.0,0.0,0.0,0.0,3.0,58.0,3.0,0.0,0.0,0.0,tasks/slave/debiancnf.yml,HanXHX/ansible-mysql,5.12,name fetch get path master fetch src path dest tmp mariadb slave import path flat ye chang deleg mariadb slave import name local action file secur fetch file local action file pathtmp mariadb slave import path mode becom name copi fetch file path copi src tmp mariadb slave import path dest path owner root group root mode notifi restart mariadb
0.0,5.0,3.0,37.0,31.0,3.0,22.0,60f87713fc097665376ca0fce1be1ba291a52fe7,10.0,1521309621.0,2.0,0.0,tasks/install/mariadb/default.yml,81.54,5.0,25.0,0.0,48.0,5.0,22.0,17.0,2.0,5.0,1.0,0.0,0.0,0.0,0.0,0.0,1.0,3.0,2.0,0.0,0.0,5.0,0.0,0.0,0.0,0.0,0.0,0.0,0.0,0.0,0.0,0.0,0.0,0.0,0.0,0.0,25.0,0.0,0.0,0.0,2.0,10.0,0.0,0.0,0.0,0.0,1.0,0.0,5.0,96.0,5.0,0.0,0.0,1.0,tasks/install_default_mariadb.yml,HanXHX/ansible-mysql,5.54,name shell get maria target version shell langc aptcach depend mariadbserv awk depend print regist apt mariadb version chang name debconf prepar maria silent instal root password debconf name mariadbserv apt mariadb path question mysqlserverroot password vtype password valu mariadb root password mariadb path name debconf prepar maria silent instal root password debconf name mariadbserv apt mariadb path question mysqlserverroot password vtype password valu mariadb root password mariadb path name apt instal maria server apt pkg mariadbserv name apt instal galera apt pkg galera mariadb vendor mariadb galera
0.0,4.0,3.0,37.0,20.0,3.0,14.0,60f87713fc097665376ca0fce1be1ba291a52fe7,7.0,1521309621.0,2.0,0.0,tasks/install/percona/apt.yml,63.64,4.0,15.0,0.0,32.0,5.0,14.0,12.0,2.0,5.0,1.0,0.0,0.0,0.0,0.0,0.0,0.0,0.0,0.0,0.0,0.0,4.0,0.0,0.0,0.0,0.0,0.0,0.0,0.0,0.0,0.0,0.0,0.0,0.0,0.0,0.0,15.0,0.0,0.0,0.0,0.0,6.0,2.0,0.0,0.0,0.0,0.0,0.0,4.0,61.0,4.0,0.0,0.0,0.0,vars/wheezy.yml,HanXHX/ansible-mysql,5.1,name apt key instal percona key apt key keyserv path efa name templat deploy apt pin prevent upgrad debian templat src path dest path name apt repositori add percona repositori apt repositori repo deb mariadb percona repositori ansibl distribut releas main name apt respositori add percona src repositori apt repositori repo debsrc mariadb percona repositori ansibl distribut releas main mariadb upstream apt src
0.0,4.0,3.0,37.0,44.0,5.0,38.0,60f87713fc097665376ca0fce1be1ba291a52fe7,9.0,1521309621.0,2.0,0.0,tasks/replication/slave.yml,51.11,9.0,34.0,0.0,67.0,7.0,38.0,23.0,3.0,6.0,1.0,0.0,0.0,0.0,0.0,0.0,0.0,6.0,10.0,0.0,0.0,9.0,0.0,0.0,0.0,0.0,0.0,0.0,2.0,0.0,0.0,0.0,5.0,0.0,0.0,0.0,34.0,0.0,0.0,0.0,0.0,6.0,2.0,0.0,0.0,0.0,0.0,0.0,9.0,121.0,5.0,0.0,0.0,2.0,tasks/replication_slave.yml,HanXHX/ansible-mysql,5.64,name mysql variabl set read mysql variabl variabl read valu mariadb slave readonli name templat deploy slave configur templat src path dest path notifi restart mariadb name mysql replic get slave statu mysql replic mode getslav ignor error ye regist slave statu name includ transfert path master includ path mariadb slave replic mysqldb slave path defin slave path slave mariadb slave import data name includ import data includ slaveimport path slave path defin slave path slave mariadb slave import data name includ configur replic includ path slave path defin slave path slave mariadb slave forc setup name includ transfert path master includ path mariadb slave replic mysqldb name mysql replic get slave statu mysql replic mode getslav ignor error ye regist slave statu name configur gtid includ path
0.0,4.0,3.0,37.0,79.0,3.0,56.0,60f87713fc097665376ca0fce1be1ba291a52fe7,27.0,1521309621.0,4.0,0.0,tasks/main.yml,69.6,14.0,64.0,0.0,176.0,7.0,56.0,97.0,4.0,24.0,1.0,2.0,0.0,0.0,0.0,0.0,0.0,2.0,4.0,0.0,0.0,14.0,0.0,0.0,0.0,1.0,0.0,1.0,0.0,0.0,0.0,0.0,4.0,0.0,0.0,1.0,62.0,0.0,2.0,0.0,2.0,24.0,9.0,0.0,0.0,0.0,0.0,0.0,14.0,195.0,16.0,0.0,0.0,3.0,tasks/main.yml,HanXHX/ansible-mysql,6.14,name includ var relat version includ var ansibl distribut ansibl distribut releas path name stat check mysql exist stat path usrsbinmysqld regist mariadb exist chang name includ instal includ path name templat deploy configur templat src mariadb config templat dest path regist config name templat deploy extra configur templat src path dest path regist extraconfig name servic restart prevent bug servic name mysql state restart path path mariadb galera resetup name templat creat path root templat src path dest path owner root group root mode backup ye name includ galera includ path mariadb vendor mariadb galera name includ replic includ path mariadb replic master mariadb replic slave name includ secur instal includ path name servic ensur servic start servic name mysql state start name mysql creat databas mysql name item state present item mariadb databas name mysql user manag user path mysql user name path password path priv path host path default localhost state present item mariadb user name templat deploy logrot configur templat src path dest path mariadb manag logrot
0.0,6.0,3.0,37.0,34.0,6.0,23.0,60f87713fc097665376ca0fce1be1ba291a52fe7,6.0,1521309621.0,2.0,0.0,tasks/galera/bootstrap.yml,71.15,7.0,26.0,0.0,43.0,7.0,23.0,9.0,2.0,3.0,1.0,0.0,0.0,0.0,1.0,1.0,1.0,3.0,2.0,1.0,0.0,3.0,1.0,0.0,0.0,0.0,0.0,0.0,0.0,0.0,0.0,0.0,0.0,0.0,0.0,0.0,26.0,0.0,0.0,0.0,0.0,1.0,0.0,0.0,0.0,0.0,0.0,0.0,4.0,91.0,7.0,0.0,0.0,2.0,tasks/galera/bootstrap.yml,HanXHX/ansible-mysql,5.55,set fact booboo mariadb datadir path galera boostrap name stat bootstrap mark stat path booboo regist block name set fact must restart bootstrap set fact mariadb notifi restart name servic stop maria servic namemysql statestop name command bootstrap first node systemd command galera new cluster ansibl servic mgr systemd name servic bootstrap first node clean init servic name mysql state start argument wsrepnewclust regist bootstrap run ansibl servic mgr systemd path mariadb galera resetup name command creat bootstrap mark command touch booboo arg creat booboo
0.0,4.0,3.0,37.0,79.0,13.0,72.0,60f87713fc097665376ca0fce1be1ba291a52fe7,6.0,1521309621.0,2.0,0.0,tasks/replication/slave/import_data.yml,57.89,15.0,61.0,2.0,125.0,21.0,72.0,46.0,8.0,22.0,2.5,0.0,0.0,0.0,0.0,4.0,6.0,1.0,2.0,0.0,0.0,15.0,0.0,0.0,0.0,0.0,3.0,0.0,0.0,0.0,0.0,0.0,0.0,0.0,0.0,0.0,61.0,0.0,0.0,0.0,0.0,18.0,2.0,0.0,0.0,0.0,2.0,1.0,15.0,272.0,15.0,0.0,0.0,5.0,tasks/slave/import_data.yml,HanXHX/ansible-mysql,6.31,name wait sourc data prevent rsync bug todo find anoth hack wait host mariadb slave import port name command prepar backup anoth server command innobackupex notimestamp mariadb backup dir creat mariadb backup dir deleg mariadb slave import regist backup name shell dump shell innobackupex applylog mariadb backup dir deleg mariadb slave import path name file remov mysql backup file path mariadb backup dir mysql state absent deleg mariadb slave import path mariadb slave replic mysqldb name mysql variabl get datadir mysql variabl variabledatadir regist datadir name set fact relat mysql datadir set fact mariadb datadir path mariadb binlog info path xtrabackup binlog info name servic stop maria import data servic name mysql state stop name command sync backup slave todo remov vagrant static user see mariadb backup user work shell sudo rsync rsyncpathsudo rsync ssh strict host key checkingno mariadb backup user mariadb slave import mariadb backup dir mariadb datadir becom name file reappli owner file path mariadb datadir state directori owner mysql group mysql recurs ye name servic start maria servic name mysql state start name shell get master log file command awk print mariadb binlog info regist master log file name shell get master log po command awk print mariadb binlog info regist master log po name shell get master gtid command awk print mariadb binlog info regist master gtid name set fact master log file set fact mariadb master log file master log path mariadb master log po master log path mariadb master gtid master path name file delet dump file path mariadb backup dir stateabs deleg mariadb slave import mariadb slave import flush dump
0.0,5.0,3.0,37.0,7.0,1.0,2.0,60f87713fc097665376ca0fce1be1ba291a52fe7,7.0,1521309621.0,2.0,0.0,handlers/main.yml,63.16,1.0,5.0,0.0,13.0,2.0,5.0,6.0,1.0,3.0,1.0,0.0,0.0,0.0,0.0,0.0,0.0,0.0,0.0,0.0,0.0,1.0,0.0,0.0,0.0,0.0,0.0,0.0,0.0,0.0,0.0,0.0,0.0,0.0,0.0,0.0,5.0,0.0,0.0,0.0,0.0,2.0,0.0,0.0,0.0,0.0,0.0,0.0,1.0,10.0,2.0,0.0,0.0,0.0,handlers/main.yml,HanXHX/ansible-mysql,3.12,name restart mariadb servic name mysql state restart mariadb notifi restart
