0.0,3.0,0.0,0.0,0.0,0.0,0.0,2f3086ea429e9af0ee08d062d0190a214320aac0,0.0,1542339142.0,0.0,0.0,roles/cert/tasks/main.yml,0.0,7.0,18.0,0.0,0.0,0.0,0.0,0.0,0.0,0.0,0.0,0.0,0.0,0.0,0.0,0.0,0.0,1.0,1.0,0.0,0.0,7.0,0.0,0.0,0.0,0.0,0.0,0.0,0.0,0.0,1.0,0.0,0.0,0.0,4.0,0.0,16.0,0.0,0.0,0.0,0.0,1.0,0.0,0.0,0.0,0.0,0.0,0.0,7.0,52.0,4.0,0.0,0.0,3.0,roles/cert/tasks/main.yml,kairen/kube-ansible,5.03,name check ssl json config stat path config regist check config name gener ssl config check path templat path dest config regist gen config includ task path name copi certif key var file key import role name commoncopyfil includ task path includ task path includ task path
0.0,7.0,0.0,0.0,0.0,0.0,0.0,2f3086ea429e9af0ee08d062d0190a214320aac0,0.0,1542339142.0,0.0,0.0,roles/common/copy-files/tasks/main.yml,0.0,3.0,21.0,0.0,0.0,0.0,0.0,0.0,0.0,0.0,0.0,0.0,0.0,0.0,0.0,0.0,0.0,2.0,2.0,0.0,0.0,3.0,0.0,0.0,0.0,1.0,0.0,1.0,0.0,0.0,0.0,0.0,0.0,0.0,0.0,0.0,19.0,0.0,3.0,0.0,0.0,4.0,2.0,0.0,0.0,0.0,0.0,0.0,3.0,73.0,3.0,0.0,0.0,3.0,roles/cni/templates/weave.yml.j2,kairen/kube-ansible,5.06,name check file alreadi exist stat path item item file regist check file name read config file slurp src path item check file result deleg group master run regist read file name write content file item path item path item path copi mode content item path bdecod dest item path nest check file result read file result regist write file
0.0,8.0,0.0,0.0,0.0,0.0,0.0,2f3086ea429e9af0ee08d062d0190a214320aac0,0.0,1542339142.0,0.0,0.0,roles/container-runtime/tasks/docker/config-systemd.yml,0.0,3.0,23.0,0.0,0.0,0.0,0.0,0.0,0.0,0.0,0.0,0.0,0.0,0.0,0.0,0.0,0.0,0.0,0.0,0.0,0.0,3.0,0.0,0.0,0.0,1.0,0.0,0.0,0.0,0.0,0.0,0.0,0.0,0.0,0.0,0.0,21.0,0.0,1.0,0.0,0.0,13.0,2.0,0.0,0.0,0.0,0.0,0.0,3.0,60.0,3.0,0.0,0.0,1.0,roles/cri/docker/tasks/config-systemd.yml,kairen/kube-ansible,5.04,name creat docker system user group group name docker state present name creat docker system user user name docker comment docker user shell sbinnologin state present system ye group docker name copi docker engin servic file host templat src docker item path dest systemd servic dir item owner root group root mode item path path regist chang system servic
0.0,14.0,0.0,0.0,0.0,0.0,0.0,2f3086ea429e9af0ee08d062d0190a214320aac0,0.0,1542339142.0,0.0,0.0,roles/cluster-default/defaults/system-path.yml,0.0,3.0,14.0,0.0,0.0,0.0,0.0,0.0,0.0,0.0,0.0,0.0,0.0,0.0,0.0,0.0,0.0,0.0,0.0,0.0,0.0,0.0,1.0,0.0,0.0,0.0,0.0,0.0,0.0,0.0,0.0,0.0,0.0,0.0,0.0,0.0,14.0,0.0,0.0,0.0,0.0,0.0,0.0,0.0,0.0,0.0,0.0,0.0,1.0,28.0,0.0,0.0,0.0,0.0,roles/cluster-default/defaults/system-path.yml,kairen/kube-ansible,4.81,bin dir usrlocalbin sbin dir usrlocalsbin cach dir tmp config dir path systemd servic dir libsystemdsystem systemd env dir etcdefault systemd dropin dir etcsystemdsystem docker data dir varlibdock docker config dir etcdock nvidia runtim config dir etcnvidiacontainerruntim libnvidia header file path libnvidia lib dir usrlocalliblibnvidia containerd data dir varlibcontainerd containerd config dir etccontainerd
8.0,8.0,0.0,0.0,0.0,0.0,0.0,2f3086ea429e9af0ee08d062d0190a214320aac0,0.0,1542339142.0,0.0,0.0,extra-playbooks/add-node.yml,0.0,2.0,12.0,1.0,0.0,0.0,0.0,0.0,0.0,0.0,0.0,0.0,0.0,0.0,0.0,0.0,0.0,0.0,0.0,0.0,0.0,1.0,1.0,1.0,0.0,0.0,0.0,0.0,0.0,0.0,0.0,0.0,0.0,0.0,0.0,0.0,16.0,0.0,0.0,0.0,0.0,0.0,0.0,2.0,0.0,4.0,0.0,0.0,2.0,29.0,0.0,0.0,0.0,0.0,extra-playbooks/add-node.yml,kairen/kube-ansible,3.77,host addnod gather fact becom role role clusterdefault role containerruntim tag containerruntim host addnod becom role role clusterdefault role kskubeconfig node role node role kssetup node role node tag nodesetup
6.0,6.0,0.0,0.0,0.0,0.0,0.0,2f3086ea429e9af0ee08d062d0190a214320aac0,0.0,1542339142.0,0.0,0.0,extra-playbooks/delete-node.yml,0.0,2.0,9.0,1.0,0.0,0.0,0.0,0.0,0.0,0.0,0.0,0.0,0.0,0.0,0.0,0.0,0.0,0.0,0.0,0.0,0.0,0.0,2.0,0.0,0.0,0.0,0.0,0.0,0.0,0.0,0.0,0.0,0.0,0.0,0.0,0.0,11.0,0.0,0.0,0.0,0.0,0.0,0.0,2.0,0.0,2.0,0.0,0.0,2.0,20.0,0.0,0.0,0.0,0.0,extra-playbooks/delete-node.yml,kairen/kube-ansible,3.28,host master becom ye role role clusterdefault role clusterreset delet host deletenod becom ye role role clusterreset reset
0.0,9.0,0.0,0.0,0.0,0.0,0.0,2f3086ea429e9af0ee08d062d0190a214320aac0,0.0,1542339142.0,0.0,0.0,roles/k8s-setup/tasks/setup-resources.yml,0.0,7.0,70.0,0.0,0.0,0.0,0.0,0.0,0.0,0.0,0.0,0.0,0.0,0.0,0.0,5.0,5.0,1.0,4.0,0.0,0.0,7.0,0.0,0.0,0.0,0.0,0.0,0.0,5.0,0.0,0.0,0.0,0.0,0.0,0.0,0.0,58.0,0.0,1.0,0.0,0.0,0.0,0.0,0.0,0.0,0.0,0.0,0.0,7.0,243.0,7.0,0.0,0.0,7.0,roles/k8s-setup/tasks/setup-resources.yml,kairen/kube-ansible,5.83,name copi kubeapiserv kubelet rbac yaml copi src item dest cach dir item item path path deleg group master run regist copi rbac file name copi tl bootstrap secret templat templat path dest cach dir path deleg group master run regist copi sercet file name creat kubeapiserv kubelet rbac copi rbac file servic start command bin dir kubectl kubeconfig admin kubeconfig appli cach dir path deleg group master run regist creat result creat path retri delay ignor error name creat tl bootstrap secret copi sercet file servic start command bin dir kubectl kubeconfig admin kubeconfig appli cach dir path deleg group master run regist creat result creat path retri delay ignor error name creat tl bootstrap rbac copi rbac file servic start command bin dir kubectl kubeconfig admin kubeconfig appli cach dir path deleg group master run regist creat result creat path retri delay ignor error name set taint effect schedul command bin dir kubectl kubeconfig admin kubeconfig taint node ansibl hostnam path schedul overwrit regist set taint set path retri delay ignor error name creat nvidia devic plugin daemonset contain runtim nvidiadock servic start command bin dir kubectl kubeconfig admin kubeconfig appli http path kube path path deleg group master run regist creat result creat path retri delay ignor error
0.0,6.0,0.0,0.0,0.0,0.0,0.0,2f3086ea429e9af0ee08d062d0190a214320aac0,0.0,1542339142.0,0.0,0.0,roles/container-runtime/tasks/docker/config-opts.yml,0.0,4.0,20.0,0.0,0.0,0.0,0.0,0.0,0.0,0.0,0.0,0.0,0.0,0.0,0.0,0.0,0.0,6.0,3.0,0.0,0.0,4.0,0.0,0.0,0.0,0.0,0.0,0.0,0.0,0.0,0.0,0.0,0.0,0.0,0.0,0.0,20.0,0.0,0.0,0.0,0.0,9.0,3.0,0.0,3.0,0.0,0.0,0.0,4.0,111.0,4.0,0.0,0.0,0.0,roles/cri/docker/tasks/config-registry.yml,kairen/kube-ansible,5.47,name copi docker environ config file templat path dest systemd env dir docker name add insecur registri docker config insecur registri defin insecur registri lineinfil dest systemd env dir docker regexp insecur registri line insecur registri reg insecur registri insecureregistri reg endfor name add registri docker config add registri defin add registri lineinfil dest systemd env dir docker regexp add registri line add registri reg add registri addregistri reg endfor name add extra option docker config docker opt defin docker opt lineinfil dest systemd env dir docker regexp docker opt line docker opt opt docker opt opt endfor
