0.0,7.0,0.0,0.0,0.0,0.0,0.0,2f3086ea429e9af0ee08d062d0190a214320aac0,0.0,1542339142.0,0.0,0.0,roles/k8s-kubeconfig/tasks/create-configs.yml,0.0,5.0,45.0,0.0,0.0,0.0,0.0,0.0,0.0,0.0,0.0,0.0,0.0,0.0,0.0,4.0,4.0,4.0,7.0,0.0,0.0,5.0,0.0,0.0,0.0,0.0,0.0,0.0,0.0,0.0,0.0,0.0,0.0,0.0,0.0,0.0,25.0,0.0,5.0,0.0,0.0,1.0,1.0,0.0,0.0,0.0,0.0,0.0,5.0,182.0,5.0,0.0,0.0,5.0,roles/k8s-kubeconfig/tasks/create-configs.yml,kairen/kube-ansible,5.38,name check kubernet config alreadi exist stat path path item path regist check config file name set kubernet cluster config file path command bin dir kubectl config setclust path name certificateauthor path embedcertstru server api url kubeconfig path item check config file result regist set cluster config name set kubernet credenti config file set cluster config path command bin dir kubectl config setcredenti path path defin token path els clientcertif path clientkey path key embedcertstru endif kubeconfig path item check config file result regist set credenti config name set kubernet context config file set credenti config path command bin dir kubectl config setcontext path cluster path name user path kubeconfig path item check config file result regist set context config name use kubernet context config file set context config path command bin dir kubectl config usecontext path kubeconfig path item check config file result regist use context config
0.0,4.0,0.0,0.0,0.0,0.0,0.0,2f3086ea429e9af0ee08d062d0190a214320aac0,0.0,1542339142.0,0.0,0.0,roles/etcd/tasks/config-etcd.yml,0.0,3.0,12.0,0.0,0.0,0.0,0.0,0.0,0.0,0.0,0.0,0.0,0.0,0.0,0.0,0.0,0.0,0.0,0.0,0.0,0.0,3.0,0.0,0.0,0.0,0.0,2.0,0.0,0.0,0.0,0.0,0.0,0.0,0.0,0.0,0.0,12.0,0.0,0.0,0.0,0.0,6.0,2.0,0.0,0.0,0.0,0.0,0.0,3.0,41.0,3.0,0.0,0.0,0.0,roles/etcd/tasks/config-etcd.yml,kairen/kube-ansible,4.26,name ensur etcd config directori exist file path etcd config dir recurs ye state directori name ensur etcd data directori exist file path etcd data dir recurs ye state directori name copi etcd config templat file templat path dest etcd config file
0.0,5.0,0.0,0.0,0.0,0.0,0.0,2f3086ea429e9af0ee08d062d0190a214320aac0,0.0,1542339142.0,0.0,0.0,roles/container-runtime/tasks/containerd/main.yml,0.0,4.0,20.0,0.0,0.0,0.0,0.0,0.0,0.0,0.0,0.0,0.0,0.0,0.0,0.0,0.0,0.0,1.0,0.0,0.0,0.0,4.0,0.0,0.0,0.0,1.0,2.0,0.0,0.0,0.0,0.0,0.0,0.0,0.0,0.0,0.0,20.0,0.0,0.0,0.0,0.0,9.0,2.0,0.0,0.0,0.0,0.0,0.0,4.0,63.0,5.0,0.0,0.0,2.0,roles/container-runtime/tasks/containerd/main.yml,kairen/kube-ansible,5.3,name ensur cni config directori exist file path cni etc dir statedirectori name ensur containerd config directori exist file path containerd config dir statedirectori name copi containerd servic file templat src path dest systemd servic dir path owner root group root mode regist chang system servic name enabl start containerd servic chang system servic succeed systemd name path daemon reload ye state start enabl ye regist containerd start
0.0,7.0,0.0,0.0,0.0,0.0,0.0,2f3086ea429e9af0ee08d062d0190a214320aac0,0.0,1542339142.0,0.0,1.0,roles/cluster-reset/tasks/reset-k8s.yml,0.0,14.0,97.0,0.0,0.0,0.0,0.0,0.0,0.0,0.0,0.0,0.0,0.0,0.0,0.0,1.0,9.0,11.0,8.0,0.0,0.0,14.0,0.0,0.0,0.0,0.0,1.0,2.0,14.0,0.0,0.0,0.0,0.0,0.0,0.0,0.0,69.0,0.0,5.0,0.0,0.0,0.0,0.0,0.0,0.0,0.0,8.0,0.0,14.0,349.0,14.0,0.0,0.0,9.0,roles/cluster-reset/tasks/reset-k8s.yml,kairen/kube-ansible,6.14,name stop kubelet systemd servic systemd path statestop enabledno ignor error regist stop kubelet servic name stop docker contain contain runtim docker contain runtim nvidiadock shell bin dir docker stop docker ignor error regist stop docker contain name clean docker contain stop docker contain contain runtim docker contain runtim nvidiadock shell bin dir docker docker ignor error regist clean docker contain name clean docker imag clean docker contain contain runtim docker contain runtim nvidiadock shell bin dir docker rmi docker imag ignor error regist clean docker imag name stop docker systemd servic contain runtim docker contain runtim nvidiadock systemd name item statestop enabledno item path path ignor error regist stop docker servic name stop containerd systemd servic contain runtim containerd systemd path statestop enabledno ignor error regist stop containerd servic name find kubelet mount volum stop kubelet servic shell grep varlibkubelet ignor error regist find mount name unmount kubelet volum find mount mount name item stateunmount item find path line list ignor error name delet compon directori stop kubelet servic file path item stateabs item etc dir cni etc dir kubelet config dir audit log dir haproxi config dir ansibl path path ansibl path path docker data dir docker config dir containerd data dir nvidia runtim config dir libnvidia header file libnvidia lib dir path path path path path path contain path path path path path path ignor error name delet ipinip tunnel stop kubelet servic command modprob ipip ignor error name find network interfac kubernet stop kubelet servic shell addr grep item item docker flannel cni tunl regist find eth ignor error name delet network interfac kubernet stop kubelet servic path shell link delet path item find eth result ignor error name find blackhol rout rule stop kubelet servic shell rout awk blackhol print regist find blackhol ignor error name delet blackhol rout rule stop kubelet servic find path shell rout del find path ignor error
0.0,4.0,0.0,0.0,0.0,0.0,0.0,2f3086ea429e9af0ee08d062d0190a214320aac0,0.0,1542339142.0,0.0,0.0,roles/container-runtime/tasks/main.yml,0.0,7.0,27.0,3.0,0.0,0.0,0.0,0.0,0.0,0.0,0.0,0.0,0.0,0.0,0.0,1.0,2.0,9.0,5.0,0.0,0.0,7.0,0.0,0.0,0.0,0.0,0.0,0.0,1.0,0.0,0.0,0.0,0.0,0.0,3.0,0.0,22.0,0.0,0.0,0.0,0.0,2.0,1.0,0.0,0.0,0.0,0.0,0.0,7.0,78.0,3.0,0.0,0.0,3.0,roles/container-runtime/tasks/main.yml,kairen/kube-ansible,5.31,contain runtim nvidiadock raw nvidiasmi ignor error regist check driver contain runtim nvidiadock found check path includ task path contain runtim docker contain runtim nvidiadock includ task path contain runtim containerd includ task path name check sysctl file stat path regist check sysctl conf name write bridgenetfilt ipforward system variabl check sysctl path copi content path forward path path dest path regist copi sysctl name enabl bridgenetfilt ipforward system variabl copi sysctl command sysctl path
0.0,4.0,0.0,0.0,0.0,0.0,0.0,2f3086ea429e9af0ee08d062d0190a214320aac0,0.0,1542339142.0,0.0,0.0,roles/k8s-setup/tasks/setup-masters.yml,0.0,9.0,32.0,0.0,0.0,0.0,0.0,0.0,0.0,0.0,0.0,0.0,0.0,0.0,0.0,0.0,0.0,0.0,0.0,0.0,0.0,9.0,0.0,0.0,0.0,0.0,5.0,0.0,0.0,0.0,0.0,0.0,0.0,0.0,0.0,0.0,39.0,0.0,2.0,0.0,0.0,3.0,2.0,0.0,0.0,0.0,0.0,0.0,9.0,166.0,9.0,0.0,0.0,0.0,roles/k8s-setup/tasks/setup-masters.yml,kairen/kube-ansible,5.58,name ensur haproxi config directori exist file path haproxi config dir statedirectori name ensur audit directori exist file path audit polici dir statedirectori name ensur audit log directori exist file path audit log dir statedirectori name ensur encrypt directori exist file path encrypt config dir statedirectori name ensur kubernet manifest directori exist file path manifest dir statedirectori name copi haproxi manifest config file cluster enabl haproxi templat src path path dest path item src path dest haproxi config src path dest manifest dir path name copi keepaliv manifest config file cluster enabl keepaliv templat src path dest manifest dir path name copi kubernet manifest config file cluster templat src path path dest path item src path dest audit polici src path dest encrypt config src path dest manifest dir path src path dest manifest dir path src path dest manifest dir path name copi kubernet admin config home directori copi src admin kubeconfig dest ansibl path path remot src ye
0.0,25.0,0.0,0.0,0.0,0.0,0.0,2f3086ea429e9af0ee08d062d0190a214320aac0,0.0,1542339142.0,0.0,0.0,roles/cluster-default/defaults/cert-path.yml,0.0,6.0,25.0,5.0,0.0,0.0,0.0,0.0,0.0,0.0,0.0,0.0,0.0,0.0,0.0,0.0,0.0,0.0,0.0,0.0,0.0,0.0,1.0,0.0,0.0,0.0,0.0,0.0,0.0,0.0,0.0,0.0,0.0,0.0,0.0,0.0,25.0,0.0,0.0,0.0,0.0,0.0,0.0,0.0,0.0,0.0,0.0,0.0,1.0,98.0,0.0,0.0,0.0,0.0,roles/cluster-default/defaults/cert-path.yml,kairen/kube-ansible,4.49,config cach dir path pki dir etckubernetespki etcd pki dir pki dir etcd pki dir path key pki dir path etcd etcd pki dir path etcd key etcd pki dir path etcd cert etcd pki dir path etcd cert key etcd pki dir path kubelet pki dir path kubelet key pki dir path admin pki dir path admin key pki dir path apiserv pki dir path apiserv key pki dir path schedul pki dir path schedul key pki dir path control manag pki dir path control manag key pki dir path front pki dir path front key pki dir path front client pki dir path front client key pki dir path public key pki dir path privat key pki dir path
0.0,6.0,0.0,0.0,0.0,0.0,0.0,2f3086ea429e9af0ee08d062d0190a214320aac0,0.0,1542339142.0,0.0,0.0,roles/download/package/tasks/archive.yml,0.0,3.0,18.0,0.0,0.0,0.0,0.0,0.0,0.0,0.0,0.0,0.0,0.0,0.0,0.0,0.0,0.0,1.0,1.0,0.0,0.0,3.0,0.0,0.0,0.0,0.0,0.0,0.0,0.0,0.0,0.0,0.0,0.0,0.0,0.0,0.0,18.0,0.0,0.0,0.0,3.0,7.0,3.0,0.0,0.0,0.0,0.0,0.0,3.0,69.0,3.0,0.0,0.0,3.0,roles/commons/packages/tasks/archive-file.yml,kairen/kube-ansible,4.72,name check path archiv alreadi exist stat path cach dir path regist pkg check name download path file pkg path get url url path path dest cach dir path valid cert environ proxi env regist pkg download name extract path file unarch src cach dir path dest path copi extra opt path opt regist pkg copi
0.0,6.0,0.0,0.0,0.0,0.0,0.0,2f3086ea429e9af0ee08d062d0190a214320aac0,0.0,1542339142.0,0.0,0.0,roles/cert/tasks/create-k8s-kubelet-certs.yml,0.0,3.0,22.0,0.0,0.0,0.0,0.0,0.0,0.0,0.0,0.0,0.0,0.0,0.0,0.0,0.0,1.0,2.0,2.0,0.0,0.0,3.0,0.0,0.0,0.0,0.0,0.0,1.0,0.0,0.0,0.0,0.0,0.0,0.0,0.0,0.0,14.0,0.0,0.0,0.0,0.0,3.0,3.0,0.0,0.0,0.0,1.0,0.0,3.0,83.0,3.0,0.0,0.0,3.0,roles/cert/tasks/create-k8s-kubelet-certs.yml,kairen/kube-ansible,5.23,name check kubelet ssl certif key file stat path kubelet regist check kubelet ssl file name gener kubelet ssl certif json file check kubelet ssl path templat src path dest pki dir path regist gen kubelet json file name creat kubelet ssl certif key file check kubelet ssl path shell bin dir cfssl gencert pki dir path cakey pki dir path config config hostnam ansibl hostnam profil cert info profil pki dir path bin dir cfssljson bare pki dir kubelet regist creat kubelet ssl file
0.0,4.0,0.0,0.0,0.0,0.0,0.0,2f3086ea429e9af0ee08d062d0190a214320aac0,0.0,1542339142.0,0.0,0.0,roles/download/package/tasks/main.yml,0.0,6.0,30.0,0.0,0.0,0.0,0.0,0.0,0.0,0.0,0.0,0.0,0.0,0.0,0.0,0.0,0.0,10.0,6.0,0.0,0.0,6.0,0.0,0.0,0.0,0.0,3.0,0.0,0.0,0.0,0.0,0.0,0.0,0.0,2.0,0.0,24.0,0.0,1.0,0.0,2.0,5.0,2.0,0.0,0.0,0.0,0.0,0.0,6.0,127.0,6.0,0.0,0.0,0.0,roles/downloader/pkg/tasks/main.yml,kairen/kube-ansible,5.54,name overrid local repositori url pkg defin repo offlin set fact base base combin path url repo offlin url version base path version name creat download binari tmp directori pkg defin file path cach dir statedirectori name creat path releas directori pkg defin file path path statedirectori name includ download archiv task pkg defin unarch pkg includ task path name includ download binari task pkg defin unarch pkg includ task path name symlink path bin dir pkg defin symlink pkg pkg copi file src path item dest bin dir path state link forc ye item pkg symlink
0.0,7.0,0.0,0.0,0.0,0.0,0.0,2f3086ea429e9af0ee08d062d0190a214320aac0,0.0,1542339142.0,0.0,0.0,roles/download/image/tasks/main.yml,0.0,9.0,60.0,0.0,0.0,0.0,0.0,0.0,0.0,0.0,0.0,0.0,0.0,0.0,0.0,5.0,6.0,14.0,14.0,0.0,0.0,9.0,0.0,0.0,0.0,0.0,1.0,2.0,1.0,0.0,0.0,0.0,0.0,0.0,0.0,0.0,42.0,0.0,3.0,0.0,6.0,2.0,0.0,0.0,0.0,0.0,1.0,0.0,9.0,268.0,9.0,0.0,0.0,6.0,roles/downloader/image/tasks/main.yml,kairen/kube-ansible,5.78,name overrid registri repo img defin set fact repo path name overrid local registri repo img defin registri set fact repo registri url name check path imag alreadi exist img defin shell bin dir docker imag awk print grep repo path path run ignor error regist check imag name pull path imag img defin check path pre pulldefault command bin dir docker pull repo path path regist pull result pull result succeed retri name creat archiv tmp directori img defin archivedefault file path path statedirectori name archiv path imag archivedefault pull result succeed check path command bin dir docker save path path path cach dir path path path regist archiv imag name tag path imag pushdefault pull result succeed check path command bin dir docker tag repo path path item path path item insecur registri regist tag imag name push path imag registri tag imag pushdefault pull result succeed check path command bin dir docker push item path path item insecur registri regist push imag name remov path imag tag push imag pushdefault pull result succeed check path command bin dir docker rmi item path path item insecur registri regist remov imag
0.0,4.0,0.0,0.0,0.0,0.0,0.0,2f3086ea429e9af0ee08d062d0190a214320aac0,0.0,1542339142.0,0.0,0.0,roles/k8s-setup/tasks/config-systemd.yml,0.0,5.0,22.0,0.0,0.0,0.0,0.0,0.0,0.0,0.0,0.0,0.0,0.0,0.0,0.0,0.0,1.0,0.0,0.0,0.0,0.0,5.0,0.0,0.0,0.0,1.0,1.0,0.0,0.0,0.0,0.0,0.0,0.0,0.0,0.0,0.0,22.0,0.0,0.0,0.0,0.0,11.0,4.0,0.0,0.0,0.0,1.0,0.0,5.0,72.0,6.0,0.0,0.0,1.0,roles/k8s-setup/tasks/config-systemd.yml,kairen/kube-ansible,5.38,name creat kubelet systemd dropin directori file path systemd dropin dir path statedirectori name copi kubelet dropin file directori templat src path dest systemd dropin dir path name copi kubelet systemd servic file templat src path dest systemd servic dir path owner root group root mode name disabl swappi shell swapoff sysctl path name enabl restart kubelet engin systemd name kubelet daemon reload ye state restart enabl ye regist servic start
0.0,4.0,0.0,0.0,0.0,0.0,0.0,2f3086ea429e9af0ee08d062d0190a214320aac0,0.0,1542339142.0,0.0,0.0,roles/k8s-kubeconfig/meta/main.yml,0.0,1.0,2.0,0.0,0.0,0.0,0.0,0.0,0.0,0.0,0.0,0.0,0.0,0.0,0.0,0.0,0.0,1.0,0.0,0.0,0.0,0.0,1.0,0.0,0.0,0.0,0.0,0.0,0.0,0.0,0.0,0.0,0.0,0.0,0.0,0.0,4.0,0.0,0.0,0.0,0.0,0.0,0.0,0.0,0.0,1.0,0.0,0.0,1.0,11.0,0.0,0.0,0.0,0.0,roles/k8s-kubeconfig/meta/main.yml,kairen/kube-ansible,3.46,depend role downloadpackag node role master pkg path
0.0,20.0,0.0,0.0,0.0,0.0,0.0,2f3086ea429e9af0ee08d062d0190a214320aac0,0.0,1542339142.0,0.0,0.0,roles/cluster-default/defaults/k8s-path.yml,0.0,2.0,20.0,0.0,0.0,0.0,0.0,0.0,0.0,0.0,0.0,0.0,0.0,0.0,0.0,0.0,0.0,0.0,0.0,0.0,0.0,0.0,1.0,0.0,0.0,0.0,0.0,0.0,0.0,0.0,0.0,0.0,0.0,0.0,0.0,0.0,20.0,0.0,0.0,0.0,0.0,0.0,0.0,0.0,0.0,0.0,0.0,0.0,1.0,60.0,0.0,0.0,0.0,0.0,roles/cluster-default/defaults/k8s-path.yml,kairen/kube-ansible,4.89,etc dir etckubernet manifest dir etckubernetesmanifest addon dir etckubernetesaddon kubelet config dir varlibkubelet cni etc dir path cni bin dir optcnibin audit polici dir etckubernetesaudit audit log dir varlogkubernet encrypt config dir etckubernetesencrypt haproxi config dir etchaproxi admin kubeconfig etc dir path schedul kubeconfig etc dir path control manag kubeconfig etc dir path kubelet kubeconfig etc dir path bootstrap kubeconfig etc dir path kubelet config kubelet config dir path audit log audit log dir path audit polici audit polici dir path encrypt config encrypt config dir path haproxi config haproxi config dir path
0.0,4.0,0.0,0.0,0.0,0.0,0.0,2f3086ea429e9af0ee08d062d0190a214320aac0,0.0,1542339142.0,0.0,0.0,roles/k8s-setup/tasks/main.yml,0.0,5.0,19.0,0.0,0.0,0.0,0.0,0.0,0.0,0.0,0.0,0.0,0.0,0.0,0.0,0.0,0.0,3.0,0.0,0.0,0.0,5.0,0.0,0.0,0.0,0.0,0.0,0.0,0.0,0.0,0.0,0.0,0.0,0.0,4.0,0.0,15.0,0.0,1.0,0.0,0.0,5.0,0.0,0.0,0.0,0.0,0.0,0.0,5.0,49.0,1.0,0.0,0.0,0.0,roles/k8s-setup/tasks/main.yml,kairen/kube-ansible,4.87,node role master includ task path includ task path includ task path name wait kubernet core compon start node role master wait host port item delay connect timeout timeout item apiserv secur port secur port node role master includ task path
0.0,51.0,0.0,0.0,0.0,0.0,0.0,2f3086ea429e9af0ee08d062d0190a214320aac0,0.0,1542339142.0,0.0,0.0,roles/k8s-kubeconfig/defaults/main.yml,0.0,1.0,51.0,0.0,0.0,0.0,0.0,0.0,0.0,0.0,0.0,0.0,0.0,0.0,0.0,0.0,0.0,0.0,0.0,0.0,0.0,0.0,1.0,0.0,0.0,0.0,0.0,0.0,0.0,0.0,0.0,0.0,0.0,0.0,0.0,0.0,35.0,0.0,0.0,0.0,1.0,0.0,0.0,0.0,0.0,0.0,0.0,0.0,1.0,155.0,5.0,0.0,0.0,0.0,roles/k8s-kubeconfig/defaults/main.yml,kairen/kube-ansible,4.24,config cluster name kubernet context name kubernetesadmin context kubernetesadmin kubernet cert admin cert key admin key path admin kubeconfig name system kubecontrollermanag context system kubecontrollermanag kubernet cert control manag cert key control manag key path control manag kubeconfig name system kubeschedul context system kubeschedul kubernet cert schedul cert key schedul key path schedul kubeconfig name system node ansibl hostnam context system node ansibl hostnam kubernet cert kubelet cert key kubelet key path kubelet kubeconfig name kubeletbootstrap context default token bootstrap token path bootstrap kubeconfig copi key node key master admin admin key apiserv apiserv key schedul schedul key control manag control manag key front front key front client front client key privat key public key
0.0,3.0,0.0,0.0,0.0,0.0,0.0,2f3086ea429e9af0ee08d062d0190a214320aac0,0.0,1542339142.0,0.0,0.0,roles/cluster-default/tasks/main.yml,0.0,5.0,17.0,0.0,0.0,0.0,0.0,0.0,0.0,0.0,0.0,0.0,0.0,0.0,0.0,0.0,0.0,0.0,0.0,0.0,0.0,5.0,0.0,0.0,0.0,0.0,0.0,0.0,0.0,0.0,0.0,0.0,0.0,0.0,0.0,4.0,16.0,0.0,0.0,0.0,0.0,5.0,0.0,0.0,0.0,0.0,0.0,0.0,5.0,43.0,5.0,0.0,0.0,0.0,roles/cluster-default/tasks/main.yml,kairen/kube-ansible,4.14,name configur kubernet default var debug msg check path tag alway name includ var path includ var file path name includ var path includ var file path name includ var path includ var file path name includ var path includ var file path
0.0,135.0,0.0,0.0,0.0,0.0,0.0,2f3086ea429e9af0ee08d062d0190a214320aac0,0.0,1542339142.0,0.0,0.0,roles/k8s-addon/defaults/main.yml,0.0,1.0,135.0,0.0,0.0,0.0,0.0,0.0,0.0,0.0,0.0,0.0,0.0,0.0,0.0,0.0,0.0,0.0,0.0,0.0,0.0,0.0,1.0,0.0,0.0,0.0,0.0,0.0,0.0,0.0,0.0,0.0,0.0,0.0,0.0,0.0,42.0,0.0,0.0,0.0,0.0,0.0,0.0,0.0,0.0,0.0,0.0,0.0,1.0,149.0,8.0,0.0,0.0,0.0,roles/gen-certs/templates/kubelet-csr.json.j2,kairen/kube-ansible,6.5,addon kubeproxi name kubeproxi dir kubeproxi templat path path path path kubedn name kubedn dir kubedn templat path path path path path dashboard name kubernetesdashboard dir dashboard templat path path path path path path metric server name metricserv dir metricserv templat path path path path path ingress nginx name ingressnginx dir ingressnginx depend name ingressnginx kind file path templat path path path path path log name kubelog dir logging loggingfluentd loggingkibana templat path path path path path path path path path path monitor name prometheusmonitor dir monitoringoper monitoringalertmanat monitoringnodeexport monitoringkubestatemetr monitoringgrafana monitoringservicediscoveri monitoringprometheu monitoringservicemonitor depend name monitor kind file path name prometheusoper kind pod namespac monitor file path path path path file path path templat path path path path path path path path path path path path path path path path path path path path path path path path path path path path path path path path path path
0.0,13.0,0.0,0.0,0.0,0.0,0.0,2f3086ea429e9af0ee08d062d0190a214320aac0,0.0,1542339142.0,0.0,0.0,roles/cert/defaults/main.yml,0.0,2.0,11.0,0.0,0.0,0.0,0.0,0.0,0.0,0.0,0.0,0.0,0.0,0.0,0.0,0.0,0.0,0.0,0.0,0.0,0.0,0.0,1.0,0.0,0.0,0.0,0.0,0.0,0.0,0.0,0.0,0.0,0.0,0.0,0.0,0.0,10.0,0.0,0.0,0.0,0.0,0.0,0.0,0.0,0.0,0.0,0.0,0.0,1.0,56.0,0.0,0.0,0.0,0.0,playbooks/reset-cluster.yml,kairen/kube-ansible,5.54,etcd host host group etcd etcd ifac hostvar host ansibl etcd ifac path els hostvar host path default path endif path endif endfor etcd domain name apiserv host vip address api servic path kubernet cert key algo rsa cert key size cert info countri cert info state taipei cert info local new taipei citi cert info org uit kubernetesans cert info expiri cert info profil kubernet
0.0,8.0,0.0,0.0,0.0,0.0,0.0,2f3086ea429e9af0ee08d062d0190a214320aac0,0.0,1542339142.0,0.0,0.0,roles/k8s-cni/tasks/main.yml,0.0,2.0,18.0,0.0,0.0,0.0,0.0,0.0,0.0,0.0,0.0,0.0,0.0,0.0,0.0,1.0,1.0,0.0,0.0,0.0,0.0,2.0,0.0,0.0,0.0,0.0,0.0,0.0,0.0,0.0,0.0,0.0,0.0,0.0,0.0,0.0,16.0,0.0,0.0,0.0,0.0,2.0,2.0,0.0,0.0,0.0,0.0,0.0,2.0,61.0,2.0,0.0,0.0,2.0,roles/k8s-cni/tasks/main.yml,kairen/kube-ansible,5.13,name copi kubernet cni file templat src contain network path dest cach dir contain network path deleg group master run regist copi cni name appli kubernet cni copi cni command bin dir kubectl kubeconfig admin kubeconfig appli cach dir contain network path deleg group master run regist appli cni appli path retri delay
0.0,5.0,0.0,0.0,0.0,0.0,0.0,2f3086ea429e9af0ee08d062d0190a214320aac0,0.0,1542339142.0,0.0,0.0,roles/cert/meta/main.yml,0.0,1.0,3.0,0.0,0.0,0.0,0.0,0.0,0.0,0.0,0.0,0.0,0.0,0.0,0.0,0.0,0.0,0.0,0.0,0.0,0.0,0.0,1.0,0.0,0.0,0.0,0.0,0.0,0.0,0.0,0.0,0.0,0.0,0.0,0.0,0.0,5.0,0.0,0.0,0.0,0.0,0.0,0.0,0.0,0.0,1.0,0.0,0.0,1.0,13.0,0.0,0.0,0.0,0.0,roles/cert/meta/main.yml,kairen/kube-ansible,2.93,depend role downloadpackag pkg path role downloadpackag pkg path
0.0,5.0,0.0,0.0,0.0,0.0,0.0,2f3086ea429e9af0ee08d062d0190a214320aac0,0.0,1542339142.0,0.0,0.0,roles/k8s-setup/meta/main.yml,0.0,1.0,3.0,0.0,0.0,0.0,0.0,0.0,0.0,0.0,0.0,0.0,0.0,0.0,0.0,0.0,0.0,0.0,0.0,0.0,0.0,0.0,1.0,0.0,0.0,0.0,0.0,0.0,0.0,0.0,0.0,0.0,0.0,0.0,0.0,0.0,5.0,0.0,0.0,0.0,0.0,0.0,0.0,0.0,0.0,1.0,0.0,0.0,1.0,13.0,0.0,0.0,0.0,0.0,roles/k8s-setup/meta/main.yml,kairen/kube-ansible,2.93,depend role downloadpackag pkg path role downloadpackag pkg path
0.0,8.0,0.0,0.0,0.0,0.0,0.0,2f3086ea429e9af0ee08d062d0190a214320aac0,0.0,1542339142.0,0.0,0.0,roles/cert/tasks/create-etcd-certs.yml,0.0,7.0,54.0,0.0,0.0,0.0,0.0,0.0,0.0,0.0,0.0,0.0,0.0,0.0,0.0,0.0,2.0,3.0,4.0,0.0,0.0,7.0,0.0,0.0,0.0,0.0,1.0,3.0,0.0,0.0,0.0,0.0,0.0,0.0,0.0,0.0,50.0,0.0,2.0,0.0,0.0,5.0,5.0,0.0,0.0,0.0,2.0,0.0,7.0,218.0,7.0,0.0,0.0,6.0,roles/cert/tasks/create-etcd-certs.yml,kairen/kube-ansible,5.68,name ensur etcd pki directori alreadi exist file path etcd pki dir statedirectori name check etcd ssl certif json file stat path etcd pki dir path path item file path name etcd org etcd bare etcdca file path name etcd org etcd bare etcd deleg group master run regist check etcd json file name gener etcd ssl certif json file check etcd json file path templat src path dest etcd pki dir path item check etcd json file result deleg group master run regist gen etcd json file name check etcd ssl certif author file stat path etcd deleg group master run regist check etcd file name creat etcd ssl certif author file check etcd path shell bin dir cfssl gencert initca etcd pki dir path bin dir cfssljson bare etcd pki dir etcdca deleg group master run regist creat etcd file name check etcd ssl certif key file stat path etcd cert deleg group master run regist check etcd ssl file name creat etcd ssl certif key file check etcd ssl path shell bin dir cfssl gencert etcd cakey etcd key config config hostnam etcd host trim profil cert info profil etcd pki dir path bin dir cfssljson bare etcd pki dir etcd deleg group master run regist creat etcd ssl file
0.0,36.0,0.0,0.0,0.0,0.0,0.0,2f3086ea429e9af0ee08d062d0190a214320aac0,0.0,1542339142.0,0.0,0.0,roles/k8s-setup/defaults/main.yml,0.0,9.0,32.0,7.0,0.0,0.0,0.0,0.0,0.0,0.0,0.0,0.0,0.0,0.0,0.0,0.0,0.0,0.0,0.0,0.0,0.0,0.0,1.0,0.0,0.0,0.0,0.0,0.0,0.0,0.0,0.0,0.0,0.0,0.0,0.0,0.0,32.0,0.0,0.0,0.0,0.0,0.0,0.0,0.0,0.0,0.0,0.0,0.0,1.0,99.0,0.0,0.0,0.0,0.0,roles/k8s-setup/defaults/main.yml,kairen/kube-ansible,6.32,log level featur gate pod prioritytru kubelet featur gate pod prioriti devic plugin apiserv bind address apiserv secur port apiserv insecur port apiserv allow name frontproxycli apiserv disabl admiss persist volum label apiserv enabl admiss node restrict apiserv author mode node rbac kubelet bind address kubelet bind healthz address kubelet bind port kubelet bind read port kubelet bind healthz port keepaliv unicast peer host group master vip interfac hostvar host ansibl vip interfac path els hostvar host path default path endif path endif endfor keepaliv password koobernet keepaliv prioriti inventori hostnam group master els endif keepaliv router haproxi stat bind address haproxi stat uri haproxi stat haproxi stat user admin haproxi stat password admin cluster domain name path cluster dn cluster subnet kubeproxi bind address kubeproxi healthz bind address kubeproxi metric bind address runtim socket containerd path
0.0,3.0,0.0,0.0,0.0,0.0,0.0,2f3086ea429e9af0ee08d062d0190a214320aac0,0.0,1542339142.0,0.0,0.0,roles/etcd/meta/main.yml,0.0,1.0,2.0,0.0,0.0,0.0,0.0,0.0,0.0,0.0,0.0,0.0,0.0,0.0,0.0,0.0,0.0,0.0,0.0,0.0,0.0,0.0,1.0,0.0,0.0,0.0,0.0,0.0,0.0,0.0,0.0,0.0,0.0,0.0,0.0,0.0,3.0,0.0,0.0,0.0,0.0,0.0,0.0,0.0,0.0,1.0,0.0,0.0,1.0,7.0,0.0,0.0,0.0,0.0,roles/etcd/meta/main.yml,kairen/kube-ansible,2.81,depend role downloadpackag pkg path
