avg_play_size,avg_task_size,change_set_avg,change_set_max,code_churn,code_churn_avg,code_churn_max,commit,commits_count,committed_at,contributors,defective,filepath,highest_experience,lines_blank,lines_code,lines_comment,loc_added,loc_added_avg,loc_added_max,loc_removed,loc_removed_avg,loc_removed_max,median_hunks_count,minor_contributors,num_authorized_key,num_block_error_handling,num_blocks,num_command_calls,num_commands,num_conditions,num_decisions,num_deprecated_keywords,num_deprecated_modules,num_distinct_modules,num_external_modules,num_fact_modules,num_file_exists,num_file_mode,num_file_modules,num_filters,num_ignore_errors,num_import_playbook,num_import_role,num_import_tasks,num_include,num_include_role,num_include_tasks,num_include_vars,num_keys,num_lookups,num_loops,num_math_operations,num_names_with_vars,num_parameters,num_paths,num_plays,num_regex,num_roles,num_sh_commands,num_suspicious_comments,num_tasks,num_tokens,num_unique_names,num_uri,num_user_interaction,num_vars,path_when_added,repo,text_entropy,tokens
0.0,7.0,3.0,112.0,100.0,17.0,89.0,269036cc5028d94a0b780e281e93ce8b2c874149,6.0,1558528749.0,1.0,0.0,roles/ironic/tasks/setup-tftp.yml,100.0,11.0,88.0,0.0,147.0,24.0,89.0,47.0,8.0,37.0,2.5,0.0,0.0,0.0,2.0,0.0,0.0,2.0,0.0,0.0,0.0,10.0,2.0,0.0,0.0,4.0,3.0,0.0,0.0,0.0,0.0,0.0,0.0,0.0,0.0,0.0,83.0,0.0,1.0,0.0,1.0,31.0,9.0,0.0,0.0,0.0,0.0,0.0,12.0,258.0,13.0,0.0,0.0,0.0,roles/ironic/tasks/setup-tftp.yml,openinfradev/tacoplay,5.53,name creat iron group group name iron name creat iron user user name iron group iron name ensur tftpboot directori exist file path tftp path state directori owner iron group iron mode name edit tftp configur file templat src path dest path name ensur disabl tftp servic servic name tftp servic name state stop enabl name restart xinetd servic systemd name xinetd state restart name copi requir file tftpboot directori block name copi pxe imag file tftpboot directori copi src usrsharesyslinuxpxelinux dest tftp path remot src name copi netboot system file tftpboot directori copi src path dest tftp path remot src ansibl distribut cent red hat name copi requir file tftpboot directori block name copi pxe imag file tftpboot directori copi src usrlibpxelinuxpxelinux dest tftp path remot src name copi netboot system file tftpboot directori copi src path dest tftp path remot src name copi librari modul tftpboot directori copi src usrlibsyslinuxmodulesldlinux dest tftp path remot src ansibl distribut ubuntu debian name copi mapfil templat src path dest tftp path mapfil name creat iron imag directori file path tftp path iron imag state directori owner iron group iron mode name copi iron imag iron imag directori copi src item dest tftp path iron imag mode item playbook dir path playbook dir path playbook dir path playbook dir path playbook dir path name ensur permiss owner tftpboot directori file path tftp path state directori owner iron group iron mode recurs ye
0.0,6.0,3.0,112.0,104.0,104.0,104.0,269036cc5028d94a0b780e281e93ce8b2c874149,1.0,1558528749.0,1.0,0.0,roles/jenkins/tasks/main.yml,100.0,14.0,85.0,4.0,104.0,104.0,104.0,0.0,0.0,0.0,1.0,0.0,0.0,0.0,0.0,3.0,4.0,1.0,0.0,2.0,0.0,14.0,1.0,0.0,0.0,0.0,1.0,5.0,0.0,0.0,0.0,0.0,0.0,0.0,0.0,0.0,88.0,0.0,5.0,0.0,3.0,16.0,8.0,0.0,0.0,0.0,1.0,0.0,15.0,317.0,21.0,0.0,0.0,2.0,roles/jenkins/tasks/main.yml,openinfradev/tacoplay,6.58,name jenkin check plugin filenam exist stat path playbook dir file plugin filenam regist stat result name jenkin fail plugin filenam exist fail msg fail find plugin filenam stat path name copi path file home directori copi src playbook dir path dest path becom name jenkin clone ciinfratool git repo infra url dest tmpcheckoutciinfratool version master becom name label node cicdservic key command kubectl label node item cicdservicesen overwrit item group cicdservic name label node buildslav key command kubectl label node item buildslaveen overwrit item group cicdservic arg creat path done name ensur tmpmanifest dir exist file path item statedirectori item tmpmanifestsciinfra tmpmanifestsciinfrainit tmpmanifestsciinfrajenkin name overrid storageclass var set fact rbd provision storag class rbdretain rbd provision reclaim polici retain name jenkin get storageclass manifest templat src playbook dir rolesrbd path dest path name jenkin templat list set fact infra manifest name nsciinfra file path type name clusterrolebindingciinfra file path type clusterrolebind name statefulsetjenkin file path type statefulset name servicejenkin file path type servic storageclass manifest name scrbdretainprovision file path type name jenkin merg manifest list set fact manifest infra manifest storageclass manifest name jenkin copi ciinfra manifest manifest dir copi src tmpcheckoutciinfratool path dest tmpmanifestsciinfra path item infra manifest name jenkin appli ciinfra manifest kube name path namespac infra namespac kubectl bin dir kubectl resourc path filenam tmpmanifestsciinfra path state latest item manifest run becom name wait jenkin pod run shell bin dir kubectl get ciinfra grep jenkin awk print retri delay regist jenkin statu jenkin path run becom deleg group adminnod first name jenkin copi plugin data jenkin pod command kubectl playbook dir file plugin filenam ciinfrajenkinstest varjenkin home arg creat path copi done
0.0,4.0,3.0,112.0,48.0,6.0,69.0,269036cc5028d94a0b780e281e93ce8b2c874149,8.0,1558528749.0,3.0,0.0,roles/openstack/openstack-defaults/tasks/main.yml,57.14,8.0,39.0,0.0,122.0,15.0,69.0,74.0,9.0,36.0,1.5,0.0,0.0,0.0,0.0,0.0,2.0,20.0,14.0,0.0,0.0,9.0,0.0,0.0,0.0,0.0,0.0,3.0,0.0,0.0,0.0,0.0,0.0,0.0,0.0,0.0,36.0,0.0,0.0,0.0,2.0,7.0,0.0,0.0,0.0,0.0,2.0,0.0,9.0,212.0,5.0,0.0,0.0,2.0,roles/openstack/preinstall/tasks/main.yml,openinfradev/tacoplay,5.83,name configur open stack default debug msg check path tag alway name fetch mon host cluster path shell grep mon host etcceph cluster path awk print regist mon taco storag ceph ceph monitorslength name set fact mon host path set fact mon host path taco storag ceph path path name set fact mon host path set fact mon host ceph monitor taco storag ceph ceph monitorslength name fail get ceph mon host fail msg fail get ceph mon host neither var cluster path taco storag ceph mon hostlength name fetch admin keyr cluster path shell grep key etcceph cluster path awk print xarg echo regist keyr taco storag ceph ceph admin keyringlength name set fact ceph admin keyr path set fact admin keyr path taco storag ceph path path name set fact ceph admin keyr path set fact admin keyr ceph admin keyr taco storag ceph ceph admin keyringlength name fail get ceph admin keyr fail msg fail get admin keyr neither var etcceph admin keyringlength taco storag ceph
0.0,4.0,3.0,112.0,50.0,6.0,30.0,269036cc5028d94a0b780e281e93ce8b2c874149,8.0,1558528749.0,1.0,0.0,roles/ironic/tasks/pre-install.yml,100.0,9.0,40.0,0.0,77.0,10.0,30.0,27.0,3.0,15.0,3.0,0.0,0.0,0.0,0.0,0.0,3.0,0.0,0.0,3.0,0.0,9.0,1.0,0.0,0.0,0.0,0.0,0.0,0.0,0.0,0.0,0.0,0.0,0.0,0.0,1.0,38.0,0.0,2.0,0.0,0.0,10.0,1.0,0.0,0.0,0.0,3.0,0.0,10.0,128.0,13.0,0.0,0.0,0.0,inventory/preparation/armada-manifest.yaml,openinfradev/tacoplay,5.73,name includ famili specif default includ var item first found path default ansibl famili path path name instal depend packag action ansibl pkg mgr name item statepres item requir packag name disabl selinux selinux state disabl name add docker repo get url url http path dest path name instal docker packag name dockerc state latest name start docker servic servic name docker state start enabl ye name load ironicbas imag file shell docker load iron base contain file arg chdir playbook dir ironicimag name load ironicapi imag file shell docker load iron api contain file arg chdir playbook dir ironicimag name load ironicconductor imag file shell docker load iron conductor contain file arg chdir playbook dir ironicimag name add iscsi tcp modul modprob name iscsi tcp state present
0.0,5.0,3.0,112.0,31.0,6.0,32.0,269036cc5028d94a0b780e281e93ce8b2c874149,5.0,1558528749.0,1.0,0.0,roles/ironic/tasks/install-dhcp.yml,100.0,5.0,25.0,0.0,78.0,16.0,32.0,47.0,9.0,42.0,3.0,0.0,0.0,0.0,0.0,0.0,0.0,2.0,0.0,0.0,0.0,5.0,0.0,0.0,0.0,0.0,0.0,0.0,0.0,0.0,0.0,0.0,0.0,0.0,0.0,0.0,25.0,0.0,0.0,0.0,2.0,11.0,6.0,0.0,0.0,0.0,0.0,0.0,5.0,75.0,5.0,0.0,0.0,0.0,roles/ironic/tasks/install-dhcp.yml,openinfradev/tacoplay,5.13,name copi iscdhcpserv file debian famili templat src path dest etcdefaultiscdhcpserv ansibl distribut ubuntu debian name copi dhcpd systemd file templat src path dest path ansibl distribut cent red hat name ensur reload servic dhcp systemd name dhcp servic name daemon reload ye enabl ye name edit dhcpd conf file redhat famili templat src path dest path notifi restart dhcp servic tag dhcp name ensur start servic dhcp systemd state start name dhcp servic name
0.0,7.0,3.0,112.0,24.0,6.0,39.0,269036cc5028d94a0b780e281e93ce8b2c874149,4.0,1558528749.0,1.0,0.0,roles/ironic/tasks/install-rabbitmq.yml,100.0,3.0,20.0,0.0,40.0,10.0,39.0,16.0,4.0,14.0,1.0,0.0,0.0,0.0,0.0,0.0,0.0,1.0,0.0,0.0,0.0,3.0,0.0,0.0,0.0,0.0,0.0,0.0,0.0,0.0,0.0,0.0,0.0,0.0,0.0,0.0,20.0,0.0,0.0,0.0,0.0,11.0,0.0,0.0,0.0,0.0,0.0,0.0,3.0,50.0,4.0,0.0,0.0,1.0,roles/ironic/tasks/install-rabbitmq.yml,openinfradev/tacoplay,5.05,name ensur start rabbitmq servic systemd name rabbitmqserv state start enabl ye regist check instal rabbitmq name wait rabbitmq wait port delay check instal path bool name creat openstack user rabbitmq rabbitmq user user openstack password password state present configur priv write priv read priv log
0.0,2.0,3.0,112.0,4.0,4.0,4.0,269036cc5028d94a0b780e281e93ce8b2c874149,1.0,1558528749.0,1.0,0.0,roles/openstack/pre-install/defaults/main.yml,100.0,1.0,2.0,0.0,4.0,4.0,4.0,0.0,0.0,0.0,1.0,0.0,0.0,0.0,0.0,0.0,0.0,0.0,0.0,0.0,0.0,0.0,1.0,0.0,0.0,0.0,0.0,0.0,0.0,0.0,0.0,0.0,0.0,0.0,0.0,0.0,2.0,0.0,0.0,0.0,0.0,0.0,0.0,0.0,0.0,0.0,0.0,0.0,1.0,4.0,0.0,0.0,0.0,0.0,roles/openstack/pre-install/defaults/main.yml,openinfradev/tacoplay,2.0,bin dir usrlocalbin openstack namespac openstack
0.0,7.0,3.0,112.0,100.0,8.0,67.0,269036cc5028d94a0b780e281e93ce8b2c874149,12.0,1558528749.0,1.0,0.0,roles/ironic/tasks/install-ironic.yml,100.0,13.0,86.0,0.0,227.0,19.0,67.0,127.0,11.0,95.0,2.0,0.0,0.0,0.0,0.0,1.0,1.0,2.0,0.0,0.0,0.0,13.0,0.0,0.0,0.0,1.0,3.0,0.0,0.0,0.0,0.0,0.0,0.0,0.0,0.0,0.0,73.0,0.0,2.0,0.0,0.0,38.0,7.0,0.0,0.0,0.0,0.0,0.0,13.0,227.0,16.0,0.0,0.0,2.0,roles/ironic/tasks/install-ironic.yml,openinfradev/tacoplay,6.31,name ensur etciron directori exist file pathetciron statedirectori name ensur rootwrap directori exist file path statedirectori name edit iron configur file templat src path dest path name copi path path file copi src item dest etciron item path path name copi iron filter file copi src item dest path item path path path name ensur permiss owner etciron file path etciron state directori owner iron group iron mode recurs ye name creat iron databas mysql name iron state present login user iron login password password regist check creat name ensur iron dbsync contain remov docker contain name ironicdbsync state absent name creat iron schema docker contain name ironicdbsync imag iron base contain imag command ironicdbsync configfil path creat schema volum etciron etciron check creat path bool name upgrad iron schema docker contain name ironicdbsync imag iron base contain imag command ironicdbsync configfil path upgrad volum etciron etciron check creat path bool name wait ironicdbsync finish command docker inspect format raw path endraw ironicdbsync retri delay regist statu path exit name run ironicapi contain docker contain name ironicapi imag iron api contain imag publish port command ironicapi configfil path volum etciron etciron name run ironicconductor contain docker contain name ironicconductor imag iron conductor contain imag ipc mode host network mode host privileg ye command ironicconductor configfil path volum etciron etciron varlibtftpboot varlibtftpboot etciscsi etciscsi dev dev
0.0,2.0,3.0,112.0,4.0,2.0,4.0,269036cc5028d94a0b780e281e93ce8b2c874149,2.0,1558528749.0,2.0,0.0,roles/openstack/setup-os/defaults/main.yml,66.67,1.0,2.0,0.0,5.0,2.0,4.0,1.0,0.0,1.0,1.0,0.0,0.0,0.0,0.0,0.0,0.0,0.0,0.0,0.0,0.0,0.0,1.0,0.0,0.0,0.0,0.0,0.0,0.0,0.0,0.0,0.0,0.0,0.0,0.0,0.0,2.0,0.0,0.0,0.0,0.0,0.0,0.0,0.0,0.0,0.0,0.0,0.0,1.0,2.0,0.0,0.0,0.0,0.0,roles/openstack/setup-os/defaults/main.yml,openinfradev/tacoplay,1.0,vfat config drive enabl pci passthrough enabl
0.0,7.0,3.0,112.0,-31.0,-4.0,29.0,269036cc5028d94a0b780e281e93ce8b2c874149,8.0,1558528749.0,3.0,0.0,roles/setup-os/tasks/main.yml,49.7,6.0,44.0,0.0,67.0,8.0,30.0,98.0,12.0,71.0,2.0,1.0,0.0,0.0,0.0,0.0,1.0,3.0,7.0,1.0,0.0,6.0,0.0,0.0,0.0,0.0,0.0,0.0,1.0,0.0,0.0,2.0,0.0,0.0,0.0,0.0,24.0,0.0,1.0,0.0,0.0,6.0,6.0,0.0,0.0,0.0,1.0,0.0,6.0,89.0,4.0,0.0,0.0,0.0,roles/setup-os/tasks/main.yml,openinfradev/tacoplay,5.47,import task path name disabl default cento base epel repo arg chdir path shell item item path item cent path cent path cent path cent path cent path cent path cent path path path ceph path path localrepo enabl replac repo file ansibl distribut cent red hat ignor error ye name add local cento base repo templat src path dest path localrepo enabl replac repo file ansibl distribut cent red hat name add epel repo templat src path dest path localrepo enabl replac repo file ansibl distribut cent red hat name add local pypi repo templat src path dest path localrepo enabl replac repo file import task path
0.0,36.0,3.0,112.0,0.0,0.0,0.0,269036cc5028d94a0b780e281e93ce8b2c874149,0.0,1558528749.0,0.0,0.0,roles/docker/vars/ubuntu-arm64.yml,0.0,5.0,38.0,1.0,0.0,0.0,0.0,0.0,0.0,0.0,0.0,0.0,0.0,0.0,0.0,0.0,0.0,0.0,0.0,0.0,0.0,0.0,1.0,0.0,0.0,0.0,0.0,5.0,0.0,0.0,0.0,0.0,0.0,0.0,0.0,0.0,28.0,0.0,0.0,0.0,1.0,0.0,0.0,0.0,0.0,0.0,0.0,0.0,1.0,75.0,1.0,0.0,0.0,0.0,roles/docker/vars/ubuntu-arm64.yml,openinfradev/tacoplay,5.25,docker kernel min version docker version docker version pkg latest dockerc dockerceceubuntu dockerceceubuntu ansibl distribut releaselow dockerceceubuntu stabl dockerceceubuntu edg dockerceceubuntu docker packag info pkg mgr apt pkg name docker version pkg docker version string forc ye docker repo key info pkg key apt key url docker ubuntu repo gpgkey repo key dcfcddaeddcebfcd docker repo info pkg repo apt repositori repo deb docker ubuntu repo base url ansibl distribut releaselow stabl dockerproject repo key info pkg key apt key url dockerproject apt repo gpgkey repo key efacadbfcd dockerproject repo info pkg repo apt repositori repo deb dockerproject apt repo base url ansibl distributionlow ansibl distribut releaselow main
0.0,6.0,3.0,112.0,54.0,11.0,49.0,269036cc5028d94a0b780e281e93ce8b2c874149,5.0,1558528749.0,1.0,0.0,roles/ironic/tasks/install-mariadb.yml,100.0,7.0,44.0,0.0,84.0,17.0,49.0,30.0,6.0,20.0,1.0,0.0,0.0,0.0,0.0,0.0,0.0,5.0,0.0,0.0,0.0,7.0,0.0,0.0,0.0,0.0,2.0,0.0,0.0,0.0,0.0,0.0,0.0,0.0,0.0,0.0,35.0,0.0,1.0,0.0,1.0,14.0,4.0,0.0,0.0,0.0,0.0,0.0,7.0,115.0,7.0,0.0,0.0,1.0,roles/ironic/tasks/install-mariadb.yml,openinfradev/tacoplay,5.77,name ensur path directori exist file path statedirectori ansibl distribut cent red hat name ensur path directori exist file path statedirectori ansibl distribut ubuntu debian name copi mariadb configur file templat src mariadb path dest path ansibl distribut cent red hat name copi mariadb configur file templat src mariadb path dest path ansibl distribut ubuntu debian name ensur start mariadb servic systemd name mysql servic name state start enabl ye regist check instal mariadb name wait mariadb wait port delay check instal mariadb bool true name ensur iron user present host mysql user name iron host item password password priv grant state present item localhost ansibl hostnam iron server
0.0,27.0,3.0,112.0,0.0,0.0,0.0,269036cc5028d94a0b780e281e93ce8b2c874149,0.0,1558528749.0,0.0,0.0,roles/docker/defaults/main.yml,0.0,11.0,27.0,6.0,0.0,0.0,0.0,0.0,0.0,0.0,0.0,0.0,0.0,0.0,0.0,0.0,0.0,0.0,0.0,0.0,0.0,0.0,1.0,0.0,0.0,0.0,0.0,0.0,0.0,0.0,0.0,0.0,0.0,0.0,0.0,0.0,27.0,0.0,0.0,0.0,0.0,0.0,0.0,0.0,0.0,0.0,0.0,0.0,1.0,43.0,0.0,0.0,0.0,0.0,roles/docker/defaults/main.yml,openinfradev/tacoplay,5.33,docker version docker selinux version docker bin dir usrbin docker iptabl enabl yum conf path yum repo dir path docker yum conf etcyum path docker repo base url http path basearchst docker repo gpgkey http path docker ubuntu repo base url http path docker ubuntu repo gpgkey http path docker debian repo base url http path docker debian repo gpgkey http path dockerproject repo base url http path dockerproject repo gpgkey http path dockerproject apt repo base url http path dockerproject apt repo gpgkey http path docker packag info pkg docker repo key info repo key docker repo info repo dockerproject repo key info repo key dockerproject repo info repo
0.0,16.0,3.0,112.0,0.0,0.0,0.0,269036cc5028d94a0b780e281e93ce8b2c874149,0.0,1558528749.0,0.0,0.0,roles/docker/vars/redhat-aarch64.yml,0.0,6.0,16.0,5.0,0.0,0.0,0.0,0.0,0.0,0.0,0.0,0.0,0.0,0.0,0.0,0.0,0.0,0.0,0.0,0.0,0.0,0.0,1.0,0.0,0.0,0.0,0.0,1.0,0.0,0.0,0.0,0.0,0.0,0.0,0.0,0.0,16.0,0.0,0.0,0.0,1.0,0.0,0.0,0.0,0.0,0.0,0.0,0.0,1.0,27.0,1.0,0.0,0.0,0.0,roles/docker/vars/redhat-aarch64.yml,openinfradev/tacoplay,4.68,docker kernel min version docker version docker version pkg latest docker path path docker packag info pkg mgr yum pkg name docker version pkg docker version string docker repo key info pkg key repo key docker repo info pkg repo repo
6.0,6.0,3.0,112.0,8.0,4.0,17.0,269036cc5028d94a0b780e281e93ce8b2c874149,2.0,1558528749.0,1.0,0.0,baremetal.yml,100.0,1.0,6.0,1.0,17.0,8.0,17.0,9.0,4.0,9.0,1.0,0.0,0.0,0.0,0.0,0.0,0.0,0.0,0.0,0.0,0.0,0.0,1.0,0.0,0.0,0.0,0.0,1.0,0.0,0.0,0.0,0.0,0.0,0.0,0.0,0.0,6.0,0.0,0.0,0.0,0.0,0.0,0.0,1.0,0.0,1.0,0.0,0.0,1.0,15.0,0.0,0.0,0.0,0.0,baremetal.yml,openinfradev/tacoplay,3.64,host localhost error fatal error fatal default becom ye role role iron tag iron
0.0,2.0,3.0,112.0,0.0,0.0,1.0,269036cc5028d94a0b780e281e93ce8b2c874149,2.0,1558528749.0,1.0,0.0,roles/admin-node/defaults/main.yml,100.0,0.0,2.0,0.0,1.0,0.0,1.0,1.0,0.0,1.0,1.0,0.0,0.0,0.0,0.0,0.0,0.0,0.0,0.0,0.0,0.0,0.0,1.0,0.0,0.0,0.0,0.0,0.0,0.0,0.0,0.0,0.0,0.0,0.0,0.0,0.0,2.0,0.0,0.0,0.0,0.0,0.0,0.0,0.0,0.0,0.0,0.0,0.0,1.0,6.0,0.0,0.0,0.0,0.0,roles/admin-node/defaults/main.yml,openinfradev/tacoplay,2.58,bin dir usrlocalbin artifact dir inventori dir artifact
0.0,5.0,3.0,112.0,65.0,6.0,54.0,269036cc5028d94a0b780e281e93ce8b2c874149,11.0,1558528749.0,5.0,1.0,roles/armada/apply/tasks/main.yml,60.0,8.0,56.0,0.0,145.0,13.0,54.0,80.0,7.0,40.0,1.0,2.0,0.0,0.0,0.0,0.0,6.0,2.0,1.0,0.0,0.0,9.0,0.0,0.0,0.0,0.0,0.0,6.0,2.0,0.0,0.0,0.0,1.0,0.0,0.0,0.0,36.0,1.0,2.0,0.0,0.0,3.0,1.0,0.0,0.0,0.0,6.0,0.0,9.0,214.0,8.0,0.0,0.0,2.0,roles/armada/apply/tasks/main.yml,openinfradev/tacoplay,6.21,includ prepar path name delet test pod openstack namespac shell bin dir kubectl get pod openstack grep test awk print xarg bin dir kubectl delet pod openstack ignor error ye name check host tiller run shell bin dir kubectl get pod kubesystem json path select path tiller path regist tiller host becom name delet armada lock shell bin dir kubectl delet lock kubesystem becom ignor error ye name get exist armada process shell grep grep grep armada appli awk print regist armada process becom name kill exist armada process shell kill item item armada path line becom name wait exist armada process kill wait path proc item statu state absent item armada path line name run armada appli background shell path workon armada armada appli tillerhost tiller path tillerport tiller port timeout armada manifest lookup env home path async poll auto releas enableddefault tiller path becom run ye name show armada appli usag next tri debug msg path workon armada armada appli tillerhost tiller path tillerport tiller port timeout inventori dir path tiller path
0.0,13.0,3.0,112.0,0.0,0.0,0.0,269036cc5028d94a0b780e281e93ce8b2c874149,2.0,1558528749.0,1.0,0.0,roles/docker-registry/defaults/main.yml,100.0,2.0,13.0,0.0,3.0,2.0,2.0,3.0,2.0,2.0,1.5,0.0,0.0,0.0,0.0,0.0,0.0,0.0,0.0,0.0,0.0,0.0,1.0,0.0,0.0,0.0,0.0,0.0,0.0,0.0,0.0,0.0,0.0,0.0,0.0,0.0,11.0,0.0,0.0,0.0,0.0,0.0,0.0,0.0,0.0,0.0,0.0,0.0,1.0,25.0,0.0,0.0,0.0,0.0,roles/docker-registry/defaults/main.yml,openinfradev/tacoplay,4.37,registri name tacoregistri docker registri imag registri docker registri name registri name docker registri env docker registri command docker registri expos docker registri port registri volum archiv docker registri volum datadock registri docker registri volum archiv inventori dir docker path docker registri volum dir playbook dir docker registri
0.0,44.0,3.0,112.0,66.0,13.0,59.0,269036cc5028d94a0b780e281e93ce8b2c874149,5.0,1558528749.0,2.0,0.0,roles/openstack/openstack-defaults/defaults/main.yml,93.75,10.0,44.0,11.0,73.0,15.0,59.0,7.0,1.0,5.0,1.0,0.0,0.0,0.0,0.0,0.0,0.0,0.0,0.0,0.0,0.0,0.0,1.0,0.0,0.0,0.0,0.0,0.0,0.0,0.0,0.0,0.0,0.0,0.0,0.0,0.0,44.0,0.0,0.0,0.0,0.0,0.0,0.0,0.0,0.0,0.0,0.0,1.0,1.0,90.0,0.0,0.0,0.0,0.0,roles/openstack/openstack-defaults/defaults/main.yml,openinfradev/tacoplay,4.79,mon host admin keyr cinder keyr aqaint ucfg aatb ygt wshshebgmr osh path playbook dir chartsopenstackhelm helm chart path playbook dir chartshelm libvirt ceph cinder secret uuid ffacaeaedeccafc root user root root password password keyston password password glanc password password cinder password password neutron password password nova password password grafana password password grafana session password password heat password password horizon password password root user admin root password password keyston password password glanc password password cinder password password neutron password password nova password password heat password password iron password password export password password test password password placement password password root user rabbitmq root password password keyston password password glanc password password cinder password password neutron password password nova password password heat password password grafana admin user admin grafana admin password password ldap taco user taco ldap taco ssha ssha losa uabg wfd uakvnhxoh exur sdkio ldap taco password password retent disk maxsiz
0.0,42.0,3.0,112.0,0.0,0.0,0.0,269036cc5028d94a0b780e281e93ce8b2c874149,0.0,1558528749.0,0.0,0.0,roles/docker/vars/redhat.yml,0.0,7.0,43.0,4.0,0.0,0.0,0.0,0.0,0.0,0.0,0.0,0.0,0.0,0.0,0.0,0.0,0.0,0.0,0.0,0.0,0.0,0.0,1.0,0.0,0.0,0.0,0.0,3.0,0.0,0.0,0.0,0.0,0.0,0.0,0.0,0.0,38.0,0.0,0.0,0.0,3.0,0.0,0.0,0.0,0.0,0.0,0.0,0.0,1.0,101.0,1.0,0.0,0.0,0.0,roles/docker/vars/redhat.yml,openinfradev/tacoplay,5.6,docker kernel min version docker version pkg latest dockerc path path path path path path path path stabl path edg path docker selinux version pkg latest dockerceselinux path path path path stabl path edg path docker pkg use docker name docker selinux version pkg docker selinux version string yum conf docker yum conf name docker version pkg docker version string yum conf docker yum conf docker pkg name docker version pkg docker version string yum conf docker yum conf docker packag info pkg mgr yum pkg docker version version docker pkg use docker els docker pkg endif docker repo key info pkg key repo key docker repo info pkg repo repo
0.0,9.0,3.0,112.0,102.0,13.0,37.0,269036cc5028d94a0b780e281e93ce8b2c874149,8.0,1558528749.0,6.0,0.0,roles/openstack/client/tasks/main.yml,58.77,10.0,91.0,3.0,108.0,14.0,37.0,6.0,1.0,4.0,1.0,3.0,0.0,0.0,0.0,0.0,2.0,4.0,3.0,0.0,0.0,10.0,0.0,0.0,0.0,0.0,0.0,5.0,0.0,0.0,0.0,0.0,0.0,0.0,0.0,0.0,70.0,1.0,2.0,0.0,2.0,19.0,3.0,0.0,0.0,0.0,2.0,0.0,10.0,312.0,17.0,0.0,0.0,2.0,roles/openstack/client/tasks/main.yml,openinfradev/tacoplay,6.49,name instal packag requir openstack client packag yum name item state present loop gcc pythondevel epelreleas pythonpip ansibl distribut cent red hat name instal pythonopenstackcli pip name path version path state present loop name pbr version name pythonopenstackcli version name pythoncindercli version name pythonglancecli version name pythonkeystonecli version name pythonnovacli version name updat bashrc openstack client config blockinfil path lookup env home path block export auth url auth url export ident api version export imag api version export project domain name project domain export user domain name user domain export project name project name export usernam user name export password password marker becom name check host ingress control run shell bin dir kubectl get openstack wide grep ingress error awk print retri delay regist ingress host ingress path becom deleg group adminnod first auto releas enableddefault fail msg ingress control run auto releas enableddefault ingress path name get ingress configmap shell bin dir kubectl get ingressconf openstack json retri delay regist configmap raw becom deleg group adminnod first configmap path name extract configmap result set fact result configmap path json name set fact bindaddress set fact bind address result data bindaddress name updat host file openstack servic ingress node blockinfil path etchost block ingress path path ingress path path ingress path path ingress path path ingress path path state present marker auto releas enableddefault bind address name updat host file openstack servic ingress vip blockinfil path etchost block bind address path bind address path bind address path bind address path bind address path state present marker auto releas enableddefault bind address
