0.0,4.0,1.0,3.0,0.0,0.0,0.0,c32a236ec78c9c770c67314d7bd7ed629f1af363,0.0,1510158796.0,0.0,no,tasks/main.yml,0.0,4.0,21.0,0.0,0.0,0.0,0.0,0.0,0.0,0.0,0.0,0.0,0.0,0.0,0.0,5.0,0.0,0.0,0.0,5.0,0.0,0.0,0.0,0.0,0.0,0.0,5.0,0.0,0.0,0.0,0.0,20.0,0.0,0.0,0.0,0.0,0.0,0.0,0.0,0.0,5.0,58.0,0.0,0.0,0.0,tasks/main.yml,stackbuilders/sb-debian-base,4.17,import task path remot user root prebootstrap defin import task path remot user debian base admin user becom ye bootstrap defin import task path remot user debian base admin user becom ye instal haskel depend defin import task path remot user debian base admin user becom ye instal haskel stack defin import task path remot user debian base admin user becom ye add remov key defin tag addremovekey,0.0,0.0,0.0,0.0,0.0,0.0,0.0,0.0,0.0,0.0,0.0,0.0,0.0,0.0,0.0,0.0,0.0,0.0,0.0,0.0,0.0,0.0,0.0,0.0,0.0,0.0,0.0,0.0,0.0,0.0,0.0,0.0,0.0,0.0,0.0,0.0,0.0,0.0,0.0
0.0,6.0,1.0,3.0,0.0,0.0,0.0,c32a236ec78c9c770c67314d7bd7ed629f1af363,0.0,1510158796.0,0.0,no,tasks/set-authorized-keys-user.yml,0.0,0.0,5.0,0.0,0.0,0.0,0.0,0.0,0.0,0.0,0.0,0.0,0.0,0.0,0.0,0.0,0.0,0.0,0.0,1.0,0.0,0.0,0.0,0.0,0.0,0.0,0.0,0.0,0.0,0.0,0.0,5.0,0.0,0.0,0.0,0.0,0.0,0.0,0.0,0.0,1.0,23.0,1.0,0.0,0.0,tests/keys/deploy_users,stackbuilders/sb-debian-base,4.26,name set author key file deploy user author key user debian base deploy user key debian base deploy user author key join exclus ye,0.0,0.0,0.0,0.0,0.0,0.0,0.0,0.0,0.0,0.0,0.0,0.0,0.0,0.0,0.0,0.0,0.0,0.0,0.0,0.0,0.0,0.0,0.0,0.0,0.0,0.0,0.0,0.0,0.0,0.0,0.0,0.0,0.0,0.0,0.0,0.0,0.0,0.0,0.0
0.0,2.0,1.0,3.0,0.0,0.0,0.0,c32a236ec78c9c770c67314d7bd7ed629f1af363,0.0,1510158796.0,0.0,no,tasks/set-authorized-keys.yml,0.0,1.0,3.0,0.0,0.0,0.0,0.0,0.0,0.0,0.0,0.0,0.0,0.0,0.0,0.0,1.0,0.0,0.0,0.0,2.0,0.0,0.0,0.0,0.0,0.0,0.0,2.0,0.0,0.0,0.0,0.0,3.0,0.0,0.0,0.0,0.0,0.0,0.0,0.0,0.0,2.0,8.0,0.0,0.0,0.0,tasks/extra-tasks.yml,stackbuilders/sb-debian-base,2.75,import task path import task path debian base deploy user defin,0.0,0.0,0.0,0.0,0.0,0.0,0.0,0.0,0.0,0.0,0.0,0.0,0.0,0.0,0.0,0.0,0.0,0.0,0.0,0.0,0.0,0.0,0.0,0.0,0.0,0.0,0.0,0.0,0.0,0.0,0.0,0.0,0.0,0.0,0.0,0.0,0.0,0.0,0.0
0.0,4.0,2.0,2.0,7.0,7.0,7.0,7eebd09b433be8b45cebbf1137a383ed65d04aa7,1.0,1510776835.0,1.0,no,tasks/bootstrap.yml,100.0,11.0,48.0,0.0,8.0,8.0,8.0,1.0,1.0,1.0,2.0,0.0,0.0,0.0,1.0,2.0,0.0,0.0,0.0,12.0,0.0,0.0,1.0,0.0,0.0,0.0,3.0,0.0,0.0,0.0,0.0,47.0,0.0,1.0,0.0,3.0,0.0,0.0,0.0,0.0,12.0,131.0,14.0,0.0,0.0,tasks/bootstrap-tasks.yml,stackbuilders/sb-debian-base,5.9,import task path name disallow ssh password authent lineinfil dest etcsshsshd config regexp password authent line password authent state present name disallow root ssh access lineinfil dest etcsshsshd config regexp permit root login line permit root login state present name restart ssh servic servic name ssh state restart name make sure dbu instal apt name dbu state instal updat cach ye cach valid time name set hostnam hostspecif variabl hostnam name hostnam hostnam defin tag sethostnam name set time zone timezon name debian base ntp timezon name enabl ntp command timedatectl setntp name updat packag cach upgrad packag apt upgrad dist updat cach ye cach valid time name instal extra packag apt name item state latest item debian base extra packag union debian base supplementari packag import task path debian base firewal import task path debian base deploy user defin,0.0,0.0,1.0,6.0,0.0,0.0,0.0,0.0,0.0,0.0,0.0,0.0,1.0,0.0,0.0,0.0,0.0,0.0,0.0,0.0,0.0,0.0,0.0,0.0,6.0,0.0,0.0,0.0,0.0,0.0,0.0,0.0,0.0,1.0,16.0,2.0,0.0,0.0,0.07
0.0,5.0,2.0,2.0,0.0,0.0,0.0,7eebd09b433be8b45cebbf1137a383ed65d04aa7,0.0,1510776835.0,0.0,no,tasks/prebootstrap.yml,0.0,3.0,20.0,0.0,0.0,0.0,0.0,0.0,0.0,0.0,0.0,0.0,0.0,0.0,0.0,0.0,0.0,0.0,0.0,4.0,0.0,0.0,0.0,0.0,0.0,0.0,1.0,0.0,0.0,0.0,0.0,20.0,0.0,0.0,0.0,1.0,0.0,0.0,0.0,0.0,4.0,55.0,5.0,0.0,0.0,tasks/prebootstrap-tasks.yml,stackbuilders/sb-debian-base,5.23,name add privileg admin user user name debian base admin user comment privileg admin user shell binbash group sudo append ye name instal sudo packag apt name sudo state latest updat cach ye name use sudo without password lineinfil dest etcsudo state present regexp sudo line sudo nopasswd valid visudo import task path,0.0,0.0,0.0,0.0,0.0,0.0,0.0,0.0,0.0,0.0,0.0,0.0,0.0,0.0,0.0,0.0,0.0,0.0,0.0,0.0,0.0,0.0,0.0,0.0,0.0,0.0,0.0,0.0,0.0,0.0,0.0,0.0,0.0,0.0,0.0,0.0,0.0,0.0,0.0
0.0,38.0,2.0,2.0,0.0,0.0,0.0,7eebd09b433be8b45cebbf1137a383ed65d04aa7,0.0,1510776835.0,0.0,no,meta/main.yml,0.0,4.0,38.0,4.0,0.0,0.0,0.0,0.0,0.0,0.0,0.0,0.0,0.0,0.0,0.0,3.0,0.0,0.0,0.0,0.0,1.0,0.0,0.0,0.0,0.0,0.0,0.0,0.0,0.0,0.0,0.0,28.0,0.0,0.0,0.0,0.0,0.0,0.0,0.0,0.0,1.0,75.0,2.0,0.0,0.0,meta/main.yml,stackbuilders/sb-debian-base,5.61,galaxi info author justin leitgeb descript base imag common role compani stack builder licens mit min ansibl version platform name debian version jessi stretch name ubuntu version trusti xenial galaxi tag debian develop product secur system bootstrap ubuntu depend src path version swapfil size debian base swap file size becom ye bootstrap defin src path version unattend mail debian base email alert unattend automat reboot becom ye bootstrap defin src path version becom ye bootstrap defin,0.0,0.0,0.0,0.0,0.0,0.0,0.0,0.0,0.0,0.0,0.0,0.0,0.0,0.0,0.0,0.0,0.0,0.0,0.0,0.0,0.0,0.0,0.0,0.0,0.0,0.0,0.0,0.0,0.0,0.0,0.0,0.0,0.0,0.0,0.0,0.0,0.0,0.0,0.0
0.0,6.0,2.0,2.0,0.0,0.0,0.0,7eebd09b433be8b45cebbf1137a383ed65d04aa7,0.0,1510776835.0,0.0,no,tasks/bootstrap-deploy-user.yml,0.0,5.0,37.0,0.0,0.0,0.0,0.0,0.0,0.0,0.0,0.0,0.0,0.0,0.0,0.0,0.0,0.0,0.0,0.0,6.0,0.0,0.0,0.0,0.0,0.0,0.0,1.0,0.0,0.0,0.0,0.0,36.0,0.0,1.0,0.0,2.0,0.0,0.0,0.0,0.0,6.0,124.0,7.0,0.0,0.0,tasks/deploy-username-tasks.yml,stackbuilders/sb-debian-base,5.09,name creat deploy user group group name debian base deploy user group state present name creat deploy user user name debian base deploy user comment unprivileg debian base deploy user user group debian base deploy user group shell binbash name creat applic deploy directori file path debian base app path state directori owner debian base deploy user group debian base deploy user group mode tag createappdirectori import task path name add deploy user ssh privat key copi dest debian base deploy user dir path rsa content debian base deploy user privat key owner debian base deploy user group debian base deploy user group mode name add upstream repositori ssh know host file lineinfil dest home debian base deploy user path host creat ye state present line path regexp path group debian base deploy user group owner debian base deploy user item debian base known host,0.0,0.0,0.0,0.0,0.0,0.0,0.0,0.0,0.0,0.0,0.0,0.0,0.0,0.0,0.0,0.0,0.0,0.0,0.0,0.0,0.0,0.0,0.0,0.0,0.0,0.0,0.0,0.0,0.0,0.0,0.0,0.0,0.0,0.0,0.0,0.0,0.0,0.0,0.0
0.0,8.0,2.0,2.0,0.0,0.0,0.0,7eebd09b433be8b45cebbf1137a383ed65d04aa7,0.0,1510776835.0,0.0,no,tasks/haskell-dependencies.yml,0.0,0.0,8.0,0.0,0.0,0.0,0.0,0.0,0.0,0.0,0.0,0.0,0.0,0.0,0.0,0.0,0.0,0.0,0.0,1.0,0.0,0.0,0.0,0.0,0.0,0.0,0.0,0.0,0.0,0.0,0.0,5.0,0.0,1.0,0.0,1.0,0.0,0.0,0.0,0.0,1.0,17.0,2.0,0.0,0.0,tasks/aws-prebootstrap-task.yml,stackbuilders/sb-debian-base,3.97,name instal common haskel build depend apt name item state latest item libpcredev libsqlitedev libpqdev,0.0,0.0,0.0,0.0,0.0,0.0,0.0,0.0,0.0,0.0,0.0,0.0,0.0,0.0,0.0,0.0,0.0,0.0,0.0,0.0,0.0,0.0,0.0,0.0,0.0,0.0,0.0,0.0,0.0,0.0,0.0,0.0,0.0,0.0,0.0,0.0,0.0,0.0,0.0
0.0,6.0,2.0,2.0,0.0,0.0,0.0,7eebd09b433be8b45cebbf1137a383ed65d04aa7,0.0,1510776835.0,0.0,no,tasks/bootstrap-firewall.yml,0.0,2.0,18.0,0.0,0.0,0.0,0.0,0.0,0.0,0.0,0.0,0.0,0.0,0.0,0.0,0.0,0.0,0.0,0.0,3.0,0.0,0.0,2.0,0.0,0.0,0.0,0.0,0.0,0.0,0.0,0.0,17.0,0.0,2.0,0.0,0.0,0.0,0.0,0.0,0.0,3.0,51.0,3.0,0.0,0.0,tasks/firewall.yml,stackbuilders/sb-debian-base,4.66,name enabl ufw ufw state enabl polici deni name open gener port ufw rule allow port item proto tcp item port default name open port ufw rule allow src path port path proto tcp dict port ip default,0.0,0.0,0.0,0.0,0.0,0.0,0.0,0.0,0.0,0.0,0.0,0.0,0.0,0.0,0.0,0.0,0.0,0.0,0.0,0.0,0.0,0.0,0.0,0.0,0.0,0.0,0.0,0.0,0.0,0.0,0.0,0.0,0.0,0.0,0.0,0.0,0.0,0.0,0.0
0.0,6.0,2.0,2.0,0.0,0.0,0.0,7eebd09b433be8b45cebbf1137a383ed65d04aa7,0.0,1510776835.0,0.0,no,tasks/haskell-stack.yml,0.0,3.0,20.0,1.0,0.0,0.0,0.0,0.0,0.0,0.0,0.0,0.0,0.0,0.0,0.0,2.0,0.0,0.0,0.0,4.0,0.0,0.0,1.0,0.0,0.0,0.0,0.0,0.0,0.0,0.0,0.0,20.0,0.0,0.0,0.0,0.0,0.0,0.0,0.0,0.0,4.0,66.0,5.0,0.0,0.0,tasks/haskell-stack-tasks.yml,stackbuilders/sb-debian-base,5.16,name add fpco pgp public key apt key url http path ansibl distribut lower path state present name add fpco deb repositori debian apt repositori repo deb http path stabl main state present ansibl distribut debian name add fpco deb repositori ubuntu apt repositori repo deb http path ansibl distribut releas main state present ansibl distribut ubuntu name instal stack packag apt name stack state latest updat cach ye cach valid time,0.0,0.0,0.0,0.0,0.0,0.0,0.0,0.0,0.0,0.0,0.0,0.0,0.0,0.0,0.0,0.0,0.0,0.0,0.0,0.0,0.0,0.0,0.0,0.0,0.0,0.0,0.0,0.0,0.0,0.0,0.0,0.0,0.0,0.0,0.0,0.0,0.0,0.0,0.0
0.0,6.0,2.0,2.0,0.0,0.0,0.0,7eebd09b433be8b45cebbf1137a383ed65d04aa7,0.0,1510776835.0,0.0,no,tasks/set-authorized-keys-admin.yml,0.0,0.0,5.0,0.0,0.0,0.0,0.0,0.0,0.0,0.0,0.0,0.0,0.0,0.0,0.0,0.0,0.0,0.0,0.0,1.0,0.0,0.0,0.0,0.0,0.0,0.0,0.0,0.0,0.0,0.0,0.0,5.0,0.0,0.0,0.0,0.0,0.0,0.0,0.0,0.0,1.0,23.0,1.0,0.0,0.0,tasks/set-authorized-keys-admin.yml,stackbuilders/sb-debian-base,4.26,name set author key file admin user author key user debian base admin user key debian base admin user author key join exclus ye,0.0,0.0,0.0,0.0,0.0,0.0,0.0,0.0,0.0,0.0,0.0,0.0,0.0,0.0,0.0,0.0,0.0,0.0,0.0,0.0,0.0,0.0,0.0,0.0,0.0,0.0,0.0,0.0,0.0,0.0,0.0,0.0,0.0,0.0,0.0,0.0,0.0,0.0,0.0
0.0,4.0,2.0,2.0,0.0,0.0,0.0,7eebd09b433be8b45cebbf1137a383ed65d04aa7,0.0,1510776835.0,0.0,no,tasks/main.yml,0.0,4.0,21.0,0.0,0.0,0.0,0.0,0.0,0.0,0.0,0.0,0.0,0.0,0.0,0.0,5.0,0.0,0.0,0.0,5.0,0.0,0.0,0.0,0.0,0.0,0.0,5.0,0.0,0.0,0.0,0.0,20.0,0.0,0.0,0.0,0.0,0.0,0.0,0.0,0.0,5.0,58.0,0.0,0.0,0.0,tasks/main.yml,stackbuilders/sb-debian-base,4.17,import task path remot user root prebootstrap defin import task path remot user debian base admin user becom ye bootstrap defin import task path remot user debian base admin user becom ye instal haskel depend defin import task path remot user debian base admin user becom ye instal haskel stack defin import task path remot user debian base admin user becom ye add remov key defin tag addremovekey,0.0,0.0,0.0,0.0,0.0,0.0,0.0,0.0,0.0,0.0,0.0,0.0,0.0,0.0,0.0,0.0,0.0,0.0,0.0,0.0,0.0,0.0,0.0,0.0,0.0,0.0,0.0,0.0,0.0,0.0,0.0,0.0,0.0,0.0,0.0,0.0,0.0,0.0,0.0
0.0,6.0,2.0,2.0,0.0,0.0,0.0,7eebd09b433be8b45cebbf1137a383ed65d04aa7,0.0,1510776835.0,0.0,no,tasks/set-authorized-keys-user.yml,0.0,0.0,5.0,0.0,0.0,0.0,0.0,0.0,0.0,0.0,0.0,0.0,0.0,0.0,0.0,0.0,0.0,0.0,0.0,1.0,0.0,0.0,0.0,0.0,0.0,0.0,0.0,0.0,0.0,0.0,0.0,5.0,0.0,0.0,0.0,0.0,0.0,0.0,0.0,0.0,1.0,23.0,1.0,0.0,0.0,tests/keys/deploy_users,stackbuilders/sb-debian-base,4.26,name set author key file deploy user author key user debian base deploy user key debian base deploy user author key join exclus ye,0.0,0.0,0.0,0.0,0.0,0.0,0.0,0.0,0.0,0.0,0.0,0.0,0.0,0.0,0.0,0.0,0.0,0.0,0.0,0.0,0.0,0.0,0.0,0.0,0.0,0.0,0.0,0.0,0.0,0.0,0.0,0.0,0.0,0.0,0.0,0.0,0.0,0.0,0.0
0.0,2.0,2.0,2.0,0.0,0.0,0.0,7eebd09b433be8b45cebbf1137a383ed65d04aa7,0.0,1510776835.0,0.0,no,tasks/set-authorized-keys.yml,0.0,1.0,3.0,0.0,0.0,0.0,0.0,0.0,0.0,0.0,0.0,0.0,0.0,0.0,0.0,1.0,0.0,0.0,0.0,2.0,0.0,0.0,0.0,0.0,0.0,0.0,2.0,0.0,0.0,0.0,0.0,3.0,0.0,0.0,0.0,0.0,0.0,0.0,0.0,0.0,2.0,8.0,0.0,0.0,0.0,tasks/extra-tasks.yml,stackbuilders/sb-debian-base,2.75,import task path import task path debian base deploy user defin,0.0,0.0,0.0,0.0,0.0,0.0,0.0,0.0,0.0,0.0,0.0,0.0,0.0,0.0,0.0,0.0,0.0,0.0,0.0,0.0,0.0,0.0,0.0,0.0,0.0,0.0,0.0,0.0,0.0,0.0,0.0,0.0,0.0,0.0,0.0,0.0,0.0,0.0,0.0
0.0,1.0,3.0,7.0,-46.0,-46.0,-46.0,764c0811aed0bb8a97ad34927ec01ee9e3660b20,1.0,1510933111.0,1.0,no,tasks/bootstrap.yml,100.0,5.0,8.0,0.0,4.0,4.0,4.0,50.0,50.0,50.0,2.0,0.0,0.0,0.0,0.0,1.0,0.0,0.0,0.0,6.0,0.0,0.0,0.0,0.0,0.0,0.0,6.0,0.0,0.0,0.0,0.0,8.0,0.0,0.0,0.0,0.0,0.0,0.0,0.0,0.0,6.0,18.0,0.0,0.0,0.0,tasks/bootstrap-tasks.yml,stackbuilders/sb-debian-base,3.2,import task path import task path import task path import task path import task path debian base firewal import task path debian base deploy user defin,0.0,-3.0,-6.0,-40.0,0.0,0.0,0.0,-1.0,-1.0,0.0,0.0,0.0,-6.0,0.0,0.0,-1.0,0.0,0.0,0.0,3.0,0.0,0.0,0.0,0.0,-39.0,0.0,-1.0,0.0,-3.0,0.0,0.0,0.0,0.0,-6.0,-113.0,-14.0,0.0,0.0,-2.7
0.0,5.0,3.0,7.0,0.0,0.0,0.0,764c0811aed0bb8a97ad34927ec01ee9e3660b20,0.0,1510933111.0,0.0,no,tasks/prebootstrap.yml,0.0,3.0,20.0,0.0,0.0,0.0,0.0,0.0,0.0,0.0,0.0,0.0,0.0,0.0,0.0,0.0,0.0,0.0,0.0,4.0,0.0,0.0,0.0,0.0,0.0,0.0,1.0,0.0,0.0,0.0,0.0,20.0,0.0,0.0,0.0,1.0,0.0,0.0,0.0,0.0,4.0,55.0,5.0,0.0,0.0,tasks/prebootstrap-tasks.yml,stackbuilders/sb-debian-base,5.23,name add privileg admin user user name debian base admin user comment privileg admin user shell binbash group sudo append ye name instal sudo packag apt name sudo state latest updat cach ye name use sudo without password lineinfil dest etcsudo state present regexp sudo line sudo nopasswd valid visudo import task path,0.0,0.0,0.0,0.0,0.0,0.0,0.0,0.0,0.0,0.0,0.0,0.0,0.0,0.0,0.0,0.0,0.0,0.0,0.0,0.0,0.0,0.0,0.0,0.0,0.0,0.0,0.0,0.0,0.0,0.0,0.0,0.0,0.0,0.0,0.0,0.0,0.0,0.0,0.0
0.0,6.0,3.0,7.0,12.0,12.0,12.0,764c0811aed0bb8a97ad34927ec01ee9e3660b20,1.0,1510933111.0,1.0,no,tasks/bootstrap-packages.yml,100.0,1.0,10.0,0.0,12.0,12.0,12.0,0.0,0.0,0.0,1.0,0.0,0.0,0.0,0.0,0.0,0.0,0.0,0.0,2.0,0.0,0.0,1.0,0.0,0.0,0.0,0.0,0.0,0.0,0.0,0.0,10.0,0.0,1.0,0.0,1.0,0.0,0.0,0.0,0.0,2.0,31.0,3.0,0.0,0.0,handlers/main.yml,stackbuilders/sb-debian-base,4.48,name updat packag cach upgrad packag apt upgrad dist updat cach ye cach valid time name instal extra packag apt name item state latest item debian base extra packag union debian base supplementari packag,0.0,2.0,1.0,6.0,0.0,0.0,0.0,0.0,0.0,0.0,0.0,0.0,1.0,0.0,0.0,1.0,0.0,0.0,0.0,0.0,0.0,0.0,0.0,0.0,6.0,0.0,1.0,0.0,1.0,0.0,0.0,0.0,0.0,1.0,23.0,1.0,0.0,0.0,1.98
0.0,38.0,3.0,7.0,0.0,0.0,0.0,764c0811aed0bb8a97ad34927ec01ee9e3660b20,0.0,1510933111.0,0.0,no,meta/main.yml,0.0,4.0,38.0,4.0,0.0,0.0,0.0,0.0,0.0,0.0,0.0,0.0,0.0,0.0,0.0,3.0,0.0,0.0,0.0,0.0,1.0,0.0,0.0,0.0,0.0,0.0,0.0,0.0,0.0,0.0,0.0,28.0,0.0,0.0,0.0,0.0,0.0,0.0,0.0,0.0,1.0,75.0,2.0,0.0,0.0,meta/main.yml,stackbuilders/sb-debian-base,5.61,galaxi info author justin leitgeb descript base imag common role compani stack builder licens mit min ansibl version platform name debian version jessi stretch name ubuntu version trusti xenial galaxi tag debian develop product secur system bootstrap ubuntu depend src path version swapfil size debian base swap file size becom ye bootstrap defin src path version unattend mail debian base email alert unattend automat reboot becom ye bootstrap defin src path version becom ye bootstrap defin,0.0,0.0,0.0,0.0,0.0,0.0,0.0,0.0,0.0,0.0,0.0,0.0,0.0,0.0,0.0,0.0,0.0,0.0,0.0,0.0,0.0,0.0,0.0,0.0,0.0,0.0,0.0,0.0,0.0,0.0,0.0,0.0,0.0,0.0,0.0,0.0,0.0,0.0,0.0
0.0,6.0,3.0,7.0,0.0,0.0,0.0,764c0811aed0bb8a97ad34927ec01ee9e3660b20,0.0,1510933111.0,0.0,no,tasks/bootstrap-deploy-user.yml,0.0,5.0,37.0,0.0,0.0,0.0,0.0,0.0,0.0,0.0,0.0,0.0,0.0,0.0,0.0,0.0,0.0,0.0,0.0,6.0,0.0,0.0,0.0,0.0,0.0,0.0,1.0,0.0,0.0,0.0,0.0,36.0,0.0,1.0,0.0,2.0,0.0,0.0,0.0,0.0,6.0,124.0,7.0,0.0,0.0,tasks/deploy-username-tasks.yml,stackbuilders/sb-debian-base,5.09,name creat deploy user group group name debian base deploy user group state present name creat deploy user user name debian base deploy user comment unprivileg debian base deploy user user group debian base deploy user group shell binbash name creat applic deploy directori file path debian base app path state directori owner debian base deploy user group debian base deploy user group mode tag createappdirectori import task path name add deploy user ssh privat key copi dest debian base deploy user dir path rsa content debian base deploy user privat key owner debian base deploy user group debian base deploy user group mode name add upstream repositori ssh know host file lineinfil dest home debian base deploy user path host creat ye state present line path regexp path group debian base deploy user group owner debian base deploy user item debian base known host,0.0,0.0,0.0,0.0,0.0,0.0,0.0,0.0,0.0,0.0,0.0,0.0,0.0,0.0,0.0,0.0,0.0,0.0,0.0,0.0,0.0,0.0,0.0,0.0,0.0,0.0,0.0,0.0,0.0,0.0,0.0,0.0,0.0,0.0,0.0,0.0,0.0,0.0,0.0
0.0,8.0,3.0,7.0,0.0,0.0,0.0,764c0811aed0bb8a97ad34927ec01ee9e3660b20,0.0,1510933111.0,0.0,no,tasks/haskell-dependencies.yml,0.0,0.0,8.0,0.0,0.0,0.0,0.0,0.0,0.0,0.0,0.0,0.0,0.0,0.0,0.0,0.0,0.0,0.0,0.0,1.0,0.0,0.0,0.0,0.0,0.0,0.0,0.0,0.0,0.0,0.0,0.0,5.0,0.0,1.0,0.0,1.0,0.0,0.0,0.0,0.0,1.0,17.0,2.0,0.0,0.0,tasks/aws-prebootstrap-task.yml,stackbuilders/sb-debian-base,3.97,name instal common haskel build depend apt name item state latest item libpcredev libsqlitedev libpqdev,0.0,0.0,0.0,0.0,0.0,0.0,0.0,0.0,0.0,0.0,0.0,0.0,0.0,0.0,0.0,0.0,0.0,0.0,0.0,0.0,0.0,0.0,0.0,0.0,0.0,0.0,0.0,0.0,0.0,0.0,0.0,0.0,0.0,0.0,0.0,0.0,0.0,0.0,0.0
0.0,6.0,3.0,7.0,0.0,0.0,0.0,764c0811aed0bb8a97ad34927ec01ee9e3660b20,0.0,1510933111.0,0.0,no,tasks/bootstrap-firewall.yml,0.0,2.0,18.0,0.0,0.0,0.0,0.0,0.0,0.0,0.0,0.0,0.0,0.0,0.0,0.0,0.0,0.0,0.0,0.0,3.0,0.0,0.0,2.0,0.0,0.0,0.0,0.0,0.0,0.0,0.0,0.0,17.0,0.0,2.0,0.0,0.0,0.0,0.0,0.0,0.0,3.0,51.0,3.0,0.0,0.0,tasks/firewall.yml,stackbuilders/sb-debian-base,4.66,name enabl ufw ufw state enabl polici deni name open gener port ufw rule allow port item proto tcp item port default name open port ufw rule allow src path port path proto tcp dict port ip default,0.0,0.0,0.0,0.0,0.0,0.0,0.0,0.0,0.0,0.0,0.0,0.0,0.0,0.0,0.0,0.0,0.0,0.0,0.0,0.0,0.0,0.0,0.0,0.0,0.0,0.0,0.0,0.0,0.0,0.0,0.0,0.0,0.0,0.0,0.0,0.0,0.0,0.0,0.0
0.0,5.0,3.0,7.0,29.0,14.0,21.0,764c0811aed0bb8a97ad34927ec01ee9e3660b20,2.0,1510933111.0,1.0,no,tasks/bootstrap-services-and-os-settings.yml,100.0,4.0,24.0,1.0,29.0,14.0,21.0,0.0,0.0,0.0,1.0,0.0,0.0,0.0,1.0,2.0,0.0,0.0,0.0,5.0,0.0,0.0,0.0,0.0,0.0,0.0,0.0,0.0,0.0,0.0,0.0,23.0,0.0,0.0,0.0,2.0,0.0,0.0,0.0,0.0,5.0,67.0,8.0,0.0,0.0,tasks/bootstrap-services-and-os-settings.yml,stackbuilders/sb-debian-base,5.38,name make sure dbu instal apt name dbu state instal updat cach ye cach valid time name set hostnam hostspecif variabl hostnam name hostnam hostnam defin tag sethostnam name set time zone timezon name debian base ntp timezon name enabl ntp command timedatectl setntp name store journald data persist lineinfil dest path regexp line storagepersist state present ansibl distribut releas trusti,,,,,,,,,,,,,,,,,,,,,,,,,,,,,,,,,,,,,,,
0.0,6.0,3.0,7.0,0.0,0.0,0.0,764c0811aed0bb8a97ad34927ec01ee9e3660b20,1.0,1510933111.0,1.0,no,tasks/haskell-stack.yml,100.0,3.0,20.0,1.0,3.0,3.0,3.0,3.0,3.0,3.0,3.0,0.0,0.0,0.0,0.0,2.0,0.0,0.0,0.0,4.0,0.0,0.0,1.0,0.0,0.0,0.0,0.0,0.0,0.0,0.0,0.0,20.0,0.0,0.0,0.0,0.0,0.0,0.0,0.0,0.0,4.0,66.0,5.0,0.0,0.0,tasks/haskell-stack-tasks.yml,stackbuilders/sb-debian-base,5.16,name add fpco pgp public key apt key url http path ansibl distribut lower path state present name add fpco deb repositori debian apt repositori repo deb http path stabl main state present ansibl distribut debian name add fpco deb repositori ubuntu apt repositori repo deb http path ansibl distribut releas main state present ansibl distribut ubuntu name instal stack packag apt name stack state latest updat cach ye cach valid time,0.0,0.0,0.0,0.0,0.0,0.0,0.0,0.0,0.0,0.0,0.0,0.0,0.0,0.0,0.0,0.0,0.0,0.0,0.0,0.0,0.0,0.0,0.0,0.0,0.0,0.0,0.0,0.0,0.0,0.0,0.0,0.0,0.0,0.0,0.0,0.0,0.0,0.0,0.0
0.0,6.0,3.0,7.0,0.0,0.0,0.0,764c0811aed0bb8a97ad34927ec01ee9e3660b20,0.0,1510933111.0,0.0,no,tasks/set-authorized-keys-admin.yml,0.0,0.0,5.0,0.0,0.0,0.0,0.0,0.0,0.0,0.0,0.0,0.0,0.0,0.0,0.0,0.0,0.0,0.0,0.0,1.0,0.0,0.0,0.0,0.0,0.0,0.0,0.0,0.0,0.0,0.0,0.0,5.0,0.0,0.0,0.0,0.0,0.0,0.0,0.0,0.0,1.0,23.0,1.0,0.0,0.0,tasks/set-authorized-keys-admin.yml,stackbuilders/sb-debian-base,4.26,name set author key file admin user author key user debian base admin user key debian base admin user author key join exclus ye,0.0,0.0,0.0,0.0,0.0,0.0,0.0,0.0,0.0,0.0,0.0,0.0,0.0,0.0,0.0,0.0,0.0,0.0,0.0,0.0,0.0,0.0,0.0,0.0,0.0,0.0,0.0,0.0,0.0,0.0,0.0,0.0,0.0,0.0,0.0,0.0,0.0,0.0,0.0
0.0,5.0,3.0,7.0,20.0,20.0,20.0,764c0811aed0bb8a97ad34927ec01ee9e3660b20,1.0,1510933111.0,1.0,no,tasks/bootstrap-ssh.yml,100.0,2.0,16.0,1.0,20.0,20.0,20.0,0.0,0.0,0.0,1.0,0.0,0.0,0.0,0.0,0.0,0.0,0.0,0.0,3.0,0.0,0.0,0.0,0.0,0.0,0.0,0.0,0.0,0.0,0.0,0.0,16.0,0.0,0.0,0.0,0.0,0.0,0.0,0.0,0.0,3.0,39.0,4.0,0.0,0.0,tasks/bootstrap-ssh.yml,stackbuilders/sb-debian-base,4.37,name disallow ssh password authent lineinfil dest etcsshsshd config regexp password authent line password authent state present name disallow root ssh access lineinfil dest etcsshsshd config regexp permit root login line permit root login state present name restart ssh servic servic name ssh state restart,,,,,,,,,,,,,,,,,,,,,,,,,,,,,,,,,,,,,,,
0.0,4.0,3.0,7.0,0.0,0.0,0.0,764c0811aed0bb8a97ad34927ec01ee9e3660b20,0.0,1510933111.0,0.0,no,tasks/main.yml,0.0,4.0,21.0,0.0,0.0,0.0,0.0,0.0,0.0,0.0,0.0,0.0,0.0,0.0,0.0,5.0,0.0,0.0,0.0,5.0,0.0,0.0,0.0,0.0,0.0,0.0,5.0,0.0,0.0,0.0,0.0,20.0,0.0,0.0,0.0,0.0,0.0,0.0,0.0,0.0,5.0,58.0,0.0,0.0,0.0,tasks/main.yml,stackbuilders/sb-debian-base,4.17,import task path remot user root prebootstrap defin import task path remot user debian base admin user becom ye bootstrap defin import task path remot user debian base admin user becom ye instal haskel depend defin import task path remot user debian base admin user becom ye instal haskel stack defin import task path remot user debian base admin user becom ye add remov key defin tag addremovekey,0.0,0.0,0.0,0.0,0.0,0.0,0.0,0.0,0.0,0.0,0.0,0.0,0.0,0.0,0.0,0.0,0.0,0.0,0.0,0.0,0.0,0.0,0.0,0.0,0.0,0.0,0.0,0.0,0.0,0.0,0.0,0.0,0.0,0.0,0.0,0.0,0.0,0.0,0.0
0.0,6.0,3.0,7.0,0.0,0.0,0.0,764c0811aed0bb8a97ad34927ec01ee9e3660b20,0.0,1510933111.0,0.0,no,tasks/set-authorized-keys-user.yml,0.0,0.0,5.0,0.0,0.0,0.0,0.0,0.0,0.0,0.0,0.0,0.0,0.0,0.0,0.0,0.0,0.0,0.0,0.0,1.0,0.0,0.0,0.0,0.0,0.0,0.0,0.0,0.0,0.0,0.0,0.0,5.0,0.0,0.0,0.0,0.0,0.0,0.0,0.0,0.0,1.0,23.0,1.0,0.0,0.0,tests/keys/deploy_users,stackbuilders/sb-debian-base,4.26,name set author key file deploy user author key user debian base deploy user key debian base deploy user author key join exclus ye,0.0,0.0,0.0,0.0,0.0,0.0,0.0,0.0,0.0,0.0,0.0,0.0,0.0,0.0,0.0,0.0,0.0,0.0,0.0,0.0,0.0,0.0,0.0,0.0,0.0,0.0,0.0,0.0,0.0,0.0,0.0,0.0,0.0,0.0,0.0,0.0,0.0,0.0,0.0
0.0,2.0,3.0,7.0,0.0,0.0,0.0,764c0811aed0bb8a97ad34927ec01ee9e3660b20,0.0,1510933111.0,0.0,no,tasks/set-authorized-keys.yml,0.0,1.0,3.0,0.0,0.0,0.0,0.0,0.0,0.0,0.0,0.0,0.0,0.0,0.0,0.0,1.0,0.0,0.0,0.0,2.0,0.0,0.0,0.0,0.0,0.0,0.0,2.0,0.0,0.0,0.0,0.0,3.0,0.0,0.0,0.0,0.0,0.0,0.0,0.0,0.0,2.0,8.0,0.0,0.0,0.0,tasks/extra-tasks.yml,stackbuilders/sb-debian-base,2.75,import task path import task path debian base deploy user defin,0.0,0.0,0.0,0.0,0.0,0.0,0.0,0.0,0.0,0.0,0.0,0.0,0.0,0.0,0.0,0.0,0.0,0.0,0.0,0.0,0.0,0.0,0.0,0.0,0.0,0.0,0.0,0.0,0.0,0.0,0.0,0.0,0.0,0.0,0.0,0.0,0.0,0.0,0.0
0.0,1.0,2.0,3.0,0.0,0.0,0.0,907ee792986d06066726a186f0f2534e099f6a2c,0.0,1512487789.0,0.0,no,tasks/bootstrap.yml,0.0,5.0,8.0,0.0,0.0,0.0,0.0,0.0,0.0,0.0,0.0,0.0,0.0,0.0,0.0,1.0,0.0,0.0,0.0,6.0,0.0,0.0,0.0,0.0,0.0,0.0,6.0,0.0,0.0,0.0,0.0,8.0,0.0,0.0,0.0,0.0,0.0,0.0,0.0,0.0,6.0,18.0,0.0,0.0,0.0,tasks/bootstrap-tasks.yml,stackbuilders/sb-debian-base,3.2,import task path import task path import task path import task path import task path debian base firewal import task path debian base deploy user defin,0.0,0.0,0.0,0.0,0.0,0.0,0.0,0.0,0.0,0.0,0.0,0.0,0.0,0.0,0.0,0.0,0.0,0.0,0.0,0.0,0.0,0.0,0.0,0.0,0.0,0.0,0.0,0.0,0.0,0.0,0.0,0.0,0.0,0.0,0.0,0.0,0.0,0.0,0.0
0.0,5.0,2.0,3.0,0.0,0.0,0.0,907ee792986d06066726a186f0f2534e099f6a2c,0.0,1512487789.0,0.0,no,tasks/prebootstrap.yml,0.0,3.0,20.0,0.0,0.0,0.0,0.0,0.0,0.0,0.0,0.0,0.0,0.0,0.0,0.0,0.0,0.0,0.0,0.0,4.0,0.0,0.0,0.0,0.0,0.0,0.0,1.0,0.0,0.0,0.0,0.0,20.0,0.0,0.0,0.0,1.0,0.0,0.0,0.0,0.0,4.0,55.0,5.0,0.0,0.0,tasks/prebootstrap-tasks.yml,stackbuilders/sb-debian-base,5.23,name add privileg admin user user name debian base admin user comment privileg admin user shell binbash group sudo append ye name instal sudo packag apt name sudo state latest updat cach ye name use sudo without password lineinfil dest etcsudo state present regexp sudo line sudo nopasswd valid visudo import task path,0.0,0.0,0.0,0.0,0.0,0.0,0.0,0.0,0.0,0.0,0.0,0.0,0.0,0.0,0.0,0.0,0.0,0.0,0.0,0.0,0.0,0.0,0.0,0.0,0.0,0.0,0.0,0.0,0.0,0.0,0.0,0.0,0.0,0.0,0.0,0.0,0.0,0.0,0.0
0.0,6.0,2.0,3.0,0.0,0.0,0.0,907ee792986d06066726a186f0f2534e099f6a2c,0.0,1512487789.0,0.0,no,tasks/bootstrap-packages.yml,0.0,1.0,10.0,0.0,0.0,0.0,0.0,0.0,0.0,0.0,0.0,0.0,0.0,0.0,0.0,0.0,0.0,0.0,0.0,2.0,0.0,0.0,1.0,0.0,0.0,0.0,0.0,0.0,0.0,0.0,0.0,10.0,0.0,1.0,0.0,1.0,0.0,0.0,0.0,0.0,2.0,31.0,3.0,0.0,0.0,handlers/main.yml,stackbuilders/sb-debian-base,4.48,name updat packag cach upgrad packag apt upgrad dist updat cach ye cach valid time name instal extra packag apt name item state latest item debian base extra packag union debian base supplementari packag,0.0,0.0,0.0,0.0,0.0,0.0,0.0,0.0,0.0,0.0,0.0,0.0,0.0,0.0,0.0,0.0,0.0,0.0,0.0,0.0,0.0,0.0,0.0,0.0,0.0,0.0,0.0,0.0,0.0,0.0,0.0,0.0,0.0,0.0,0.0,0.0,0.0,0.0,0.0
