0.0,5.0,1.0,1.0,0.0,0.0,0.0,d638d06f11a97f15604c572dc75395b7ce91afaf,0.0,1449574589.0,0.0,no,roles/rabbitmq/tasks/main.yml,0.0,5.0,28.0,0.0,0.0,0.0,0.0,0.0,0.0,0.0,0.0,0.0,0.0,0.0,0.0,0.0,0.0,0.0,0.0,6.0,0.0,0.0,0.0,0.0,0.0,0.0,0.0,0.0,0.0,0.0,0.0,26.0,0.0,1.0,0.0,1.0,0.0,0.0,0.0,0.0,6.0,63.0,6.0,0.0,0.0,roles/rabbitmq/tasks/main.yml,StackStorm/ansible-st2,4.97,name ensur rabbitmq repo sudo apt repositori repo deb http path test main name ensur rabbitmq repo key sudo apt key url http path name instal rabbitmq packag sudo apt name item updat cach item rabbitmqserv name enabl rabbitmq manag plugin sudo rabbitmq plugin name rabbitmq manag notifi restart rabbitmq meta flush handler name instal rabbitmqadmin sudo get url url http clirabbitmqadmin dest usrbinrabbitmqadmin mode,0.0,0.0,0.0,0.0,0.0,0.0,0.0,0.0,0.0,0.0,0.0,0.0,0.0,0.0,0.0,0.0,0.0,0.0,0.0,0.0,0.0,0.0,0.0,0.0,0.0,0.0,0.0,0.0,0.0,0.0,0.0,0.0,0.0,0.0,0.0,0.0,0.0,0.0,0.0
0.0,18.0,1.0,1.0,0.0,0.0,0.0,d638d06f11a97f15604c572dc75395b7ce91afaf,0.0,1449574589.0,0.0,no,roles/st2/defaults/main.yml,0.0,7.0,18.0,7.0,0.0,0.0,0.0,0.0,0.0,0.0,0.0,0.0,0.0,0.0,0.0,0.0,0.0,0.0,0.0,0.0,1.0,0.0,1.0,0.0,0.0,0.0,0.0,0.0,0.0,0.0,0.0,11.0,0.0,0.0,0.0,0.0,0.0,0.0,0.0,0.0,1.0,37.0,0.0,0.0,0.0,roles/st2packages/defaults/main.yml,StackStorm/ansible-st2,5.08,requir memori requir space version stabl revis current system user stanley ssh key file home system user path system user rsa packag stcommon staction stapi stauth stclient stdebug streactor action runner ansibl processor vcpu max auth usernam testu auth password testp system user sudoer ye,0.0,0.0,0.0,0.0,0.0,0.0,0.0,0.0,0.0,0.0,0.0,0.0,0.0,0.0,0.0,0.0,0.0,0.0,0.0,0.0,0.0,0.0,0.0,0.0,0.0,0.0,0.0,0.0,0.0,0.0,0.0,0.0,0.0,0.0,0.0,0.0,0.0,0.0,0.0
0.0,9.0,1.0,1.0,0.0,0.0,0.0,d638d06f11a97f15604c572dc75395b7ce91afaf,0.0,1449574589.0,0.0,no,roles/mongodb/tasks/main.yml,0.0,0.0,9.0,0.0,0.0,0.0,0.0,0.0,0.0,0.0,0.0,0.0,0.0,0.0,0.0,0.0,0.0,0.0,0.0,1.0,0.0,0.0,0.0,0.0,0.0,0.0,0.0,0.0,0.0,0.0,0.0,7.0,0.0,1.0,0.0,1.0,0.0,0.0,0.0,0.0,1.0,17.0,2.0,0.0,0.0,roles/mongodb/tasks/main.yml,StackStorm/ansible-st2,3.85,name instal depend sudo apt name item updat cach ye state present item mongodb mongodbserv,0.0,0.0,0.0,0.0,0.0,0.0,0.0,0.0,0.0,0.0,0.0,0.0,0.0,0.0,0.0,0.0,0.0,0.0,0.0,0.0,0.0,0.0,0.0,0.0,0.0,0.0,0.0,0.0,0.0,0.0,0.0,0.0,0.0,0.0,0.0,0.0,0.0,0.0,0.0
0.0,1.0,1.0,1.0,0.0,0.0,0.0,d638d06f11a97f15604c572dc75395b7ce91afaf,0.0,1449574589.0,0.0,no,roles/st2/tasks/main.yml,0.0,0.0,11.0,0.0,0.0,0.0,0.0,0.0,0.0,0.0,0.0,0.0,0.0,0.0,0.0,1.0,0.0,0.0,0.0,8.0,0.0,0.0,0.0,0.0,0.0,0.0,0.0,7.0,0.0,0.0,0.0,10.0,0.0,0.0,0.0,0.0,0.0,0.0,1.0,0.0,8.0,28.0,1.0,0.0,0.0,roles/st2packages/tasks/main.yml,StackStorm/ansible-st2,4.11,includ path includ path includ path includ path includ path includ path includ config path stauth packag name regist content shell python usrlibpythondistpackagesstcommonbinstregistercont configfil path registeral,0.0,0.0,0.0,0.0,0.0,0.0,0.0,0.0,0.0,0.0,0.0,0.0,0.0,0.0,0.0,0.0,0.0,0.0,0.0,0.0,0.0,0.0,0.0,0.0,0.0,0.0,0.0,0.0,0.0,0.0,0.0,0.0,0.0,0.0,0.0,0.0,0.0,0.0,0.0
0.0,14.0,1.0,1.0,0.0,0.0,0.0,d638d06f11a97f15604c572dc75395b7ce91afaf,0.0,1449574589.0,0.0,no,roles/st2/meta/main.yml,0.0,0.0,14.0,0.0,0.0,0.0,0.0,0.0,0.0,0.0,0.0,0.0,0.0,0.0,0.0,0.0,0.0,0.0,0.0,0.0,1.0,0.0,0.0,0.0,0.0,0.0,0.0,0.0,0.0,0.0,0.0,11.0,0.0,0.0,0.0,0.0,0.0,0.0,0.0,0.0,1.0,25.0,1.0,0.0,0.0,roles/st2version/meta/main.yml,StackStorm/ansible-st2,4.56,galaxi info descript instal stack storm compon author armab compani stack storm licens apach min ansibl version platform name ubuntu version trusti precis categori system depend,0.0,0.0,0.0,0.0,0.0,0.0,0.0,0.0,0.0,0.0,0.0,0.0,0.0,0.0,0.0,0.0,0.0,0.0,0.0,0.0,0.0,0.0,0.0,0.0,0.0,0.0,0.0,0.0,0.0,0.0,0.0,0.0,0.0,0.0,0.0,0.0,0.0,0.0,0.0
0.0,8.0,1.0,1.0,0.0,0.0,0.0,d638d06f11a97f15604c572dc75395b7ce91afaf,0.0,1449574589.0,0.0,no,roles/st2/tasks/2.version.yml,0.0,7.0,44.0,2.0,0.0,0.0,0.0,0.0,0.0,0.0,0.0,0.0,0.0,0.0,1.0,3.0,1.0,0.0,0.0,7.0,0.0,0.0,8.0,1.0,0.0,0.0,0.0,0.0,0.0,0.0,0.0,38.0,0.0,1.0,0.0,0.0,0.0,0.0,1.0,1.0,7.0,176.0,7.0,0.0,2.0,roles/st2version/tasks/main.yml,StackStorm/ansible-st2,5.88,name version lookup liter version shell curl http path version mainsstapi grep path sed path stapi path path sort versionsort uniq head version stabl version unstabl regist version deleg chang tag version name version save version number instal set fact version path default version tag version name version check specifi version avail uri url http path version statu code version version deleg tag version name version lookup stack storm revis instal set fact revis item url http path version deb revis path tag version name version gather stack storm packag info command dpkg stcommon regist packag info chang ignor error ye tag version name version check stack storm alreadi instal set fact instal packag path tag version name version get instal stack storm version revis set fact instal version packag path replac version instal revis packag path replac version instal tag version,0.0,0.0,0.0,0.0,0.0,0.0,0.0,0.0,0.0,0.0,0.0,0.0,0.0,0.0,0.0,0.0,0.0,0.0,0.0,0.0,0.0,0.0,0.0,0.0,0.0,0.0,0.0,0.0,0.0,0.0,0.0,0.0,0.0,0.0,0.0,0.0,0.0,0.0,0.0
0.0,1.0,1.0,1.0,0.0,0.0,0.0,d638d06f11a97f15604c572dc75395b7ce91afaf,0.0,1449574589.0,0.0,no,roles/mistral/tasks/main.yml,0.0,0.0,7.0,0.0,0.0,0.0,0.0,0.0,0.0,0.0,0.0,0.0,0.0,0.0,0.0,0.0,0.0,0.0,0.0,7.0,0.0,0.0,0.0,0.0,0.0,0.0,0.0,7.0,0.0,0.0,0.0,7.0,0.0,0.0,0.0,0.0,0.0,0.0,0.0,0.0,7.0,14.0,0.0,0.0,0.0,roles/mistral/tasks/main.yml,StackStorm/ansible-st2,2.4,includ gather path includ instal path includ instal path includ instal path includ path includ path includ instal path,0.0,0.0,0.0,0.0,0.0,0.0,0.0,0.0,0.0,0.0,0.0,0.0,0.0,0.0,0.0,0.0,0.0,0.0,0.0,0.0,0.0,0.0,0.0,0.0,0.0,0.0,0.0,0.0,0.0,0.0,0.0,0.0,0.0,0.0,0.0,0.0,0.0,0.0,0.0
0.0,7.0,1.0,1.0,0.0,0.0,0.0,d638d06f11a97f15604c572dc75395b7ce91afaf,0.0,1449574589.0,0.0,no,roles/st2/tasks/1.requirements.yml,0.0,2.0,15.0,2.0,0.0,0.0,0.0,0.0,0.0,0.0,0.0,0.0,0.0,0.0,0.0,2.0,0.0,0.0,0.0,3.0,0.0,0.0,0.0,0.0,0.0,0.0,0.0,0.0,0.0,0.0,0.0,15.0,0.0,0.0,0.0,0.0,0.0,0.0,1.0,1.0,3.0,88.0,3.0,0.0,1.0,roles/st2requirements/tasks/main.yml,StackStorm/ansible-st2,5.36,name requir check enough memori fail msg least requir memori requir instal current ansibl memtot ansibl memtot requir memoryint tag requir name requir get avail disk space shell varlib grep filesystemtmpfscdrom awk print regist free disk space chang tag requir name requir check enough disc space fail msg least requir space varlib requir instal free disk path requir space tag requir,0.0,0.0,0.0,0.0,0.0,0.0,0.0,0.0,0.0,0.0,0.0,0.0,0.0,0.0,0.0,0.0,0.0,0.0,0.0,0.0,0.0,0.0,0.0,0.0,0.0,0.0,0.0,0.0,0.0,0.0,0.0,0.0,0.0,0.0,0.0,0.0,0.0,0.0,0.0
0.0,26.0,1.0,1.0,0.0,0.0,0.0,d638d06f11a97f15604c572dc75395b7ce91afaf,0.0,1449574589.0,0.0,no,roles/mistral/meta/main.yml,0.0,0.0,24.0,0.0,0.0,0.0,0.0,0.0,0.0,0.0,0.0,0.0,0.0,0.0,0.0,0.0,0.0,0.0,0.0,0.0,1.0,0.0,0.0,0.0,0.0,0.0,0.0,0.0,0.0,0.0,0.0,21.0,0.0,0.0,0.0,2.0,0.0,1.0,0.0,0.0,1.0,51.0,3.0,0.0,0.0,roles/mysql/templates/dump.j2,StackStorm/ansible-st2,5.31,galaxi info descript instal custom open stack mistral patch stack storm author armab compani stack storm licens apach min ansibl version platform name ubuntu version trusti precis categori system depend role path version tag postgresql sudo ye postgresql databas name mistral postgresql user name mistral usernam pass mistral password encrypt ye,0.0,0.0,0.0,0.0,0.0,0.0,0.0,0.0,0.0,0.0,0.0,0.0,0.0,0.0,0.0,0.0,0.0,0.0,0.0,0.0,0.0,0.0,0.0,0.0,0.0,0.0,0.0,0.0,0.0,0.0,0.0,0.0,0.0,0.0,0.0,0.0,0.0,0.0,0.0
