0.0,6.0,2.0,7.0,0.0,0.0,0.0,44f0da6f332902c5ba6664635741f537df387d46,0.0,1500230570.0,0.0,no,tasks/bootstrap-firewall.yml,0.0,3.0,24.0,0.0,0.0,0.0,0.0,0.0,0.0,0.0,0.0,0.0,0.0,0.0,0.0,1.0,0.0,0.0,0.0,4.0,0.0,0.0,2.0,0.0,0.0,0.0,0.0,0.0,0.0,0.0,0.0,23.0,0.0,2.0,0.0,0.0,0.0,0.0,0.0,0.0,4.0,73.0,4.0,0.0,0.0,tasks/firewall.yml,stackbuilders/sb-debian-base,5.41,name debian version introduc bug workaround lineinfil dest etcdefaultufw regexp ipvy line ipvno ansibl distribut debian name enabl ufw ufw state enabl polici deni name open gener port ufw rule allow port item proto tcp item port default name open port ufw rule allow src path port path proto tcp dict port ip default,0.0,0.0,0.0,0.0,0.0,0.0,0.0,0.0,0.0,0.0,0.0,0.0,0.0,0.0,0.0,0.0,0.0,0.0,0.0,0.0,0.0,0.0,0.0,0.0,0.0,0.0,0.0,0.0,0.0,0.0,0.0,0.0,0.0,0.0,0.0,0.0,0.0,0.0,0.0
0.0,5.0,2.0,7.0,6.0,6.0,6.0,44f0da6f332902c5ba6664635741f537df387d46,1.0,1500230570.0,1.0,no,tasks/haskell-stack.yml,100.0,6.0,36.0,0.0,6.0,6.0,6.0,0.0,0.0,0.0,1.0,0.0,0.0,0.0,0.0,6.0,0.0,0.0,0.0,7.0,0.0,0.0,0.0,0.0,0.0,0.0,0.0,0.0,0.0,0.0,0.0,36.0,0.0,0.0,0.0,0.0,0.0,0.0,0.0,0.0,7.0,117.0,8.0,0.0,0.0,tasks/haskell-stack-tasks.yml,stackbuilders/sb-debian-base,5.1,name add fpco pgp public key debian apt key url http path state present ansibl distribut debian name add fpco pgp public key ubuntu apt key url http path state present ansibl distribut ubuntu name add fpco deb repositori jessi apt repositori repo deb http path stabl main state present ansibl distribut releas jessi name add fpco deb repositori stretch apt repositori repo deb http path stabl main state present ansibl distribut releas stretch name add fpco deb repositori trusti apt repositori repo deb http path trusti main state present ansibl distribut releas trusti name add fpco deb repositori xenial apt repositori repo deb http path xenial main state present ansibl distribut releas xenial name instal stack packag apt name stack state present updat cach ye cach valid time,0.0,0.0,1.0,5.0,0.0,0.0,0.0,0.0,1.0,0.0,0.0,0.0,1.0,0.0,0.0,0.0,0.0,0.0,0.0,0.0,0.0,0.0,0.0,0.0,5.0,0.0,0.0,0.0,0.0,0.0,0.0,0.0,0.0,1.0,18.0,1.0,0.0,0.0,-0.01
0.0,6.0,2.0,7.0,0.0,0.0,0.0,44f0da6f332902c5ba6664635741f537df387d46,0.0,1500230570.0,0.0,no,tasks/set-authorized-keys-admin.yml,0.0,0.0,5.0,0.0,0.0,0.0,0.0,0.0,0.0,0.0,0.0,0.0,0.0,0.0,0.0,0.0,0.0,0.0,0.0,1.0,0.0,0.0,0.0,0.0,0.0,0.0,0.0,0.0,0.0,0.0,0.0,5.0,0.0,0.0,0.0,0.0,0.0,0.0,0.0,0.0,1.0,23.0,1.0,0.0,0.0,tasks/set-authorized-keys-admin.yml,stackbuilders/sb-debian-base,4.26,name set author key file admin user author key user debian base admin user key debian base admin user author key join exclus ye,0.0,0.0,0.0,0.0,0.0,0.0,0.0,0.0,0.0,0.0,0.0,0.0,0.0,0.0,0.0,0.0,0.0,0.0,0.0,0.0,0.0,0.0,0.0,0.0,0.0,0.0,0.0,0.0,0.0,0.0,0.0,0.0,0.0,0.0,0.0,0.0,0.0,0.0,0.0
0.0,4.0,2.0,7.0,0.0,0.0,0.0,44f0da6f332902c5ba6664635741f537df387d46,0.0,1500230570.0,0.0,no,handlers/main.yml,0.0,0.0,4.0,0.0,0.0,0.0,0.0,0.0,0.0,0.0,0.0,0.0,0.0,0.0,0.0,0.0,0.0,0.0,0.0,1.0,0.0,0.0,0.0,0.0,0.0,0.0,0.0,0.0,0.0,0.0,0.0,4.0,0.0,0.0,0.0,0.0,0.0,0.0,0.0,0.0,1.0,8.0,2.0,0.0,0.0,handlers/main.yml,stackbuilders/sb-debian-base,2.5,name restart ssh servic name ssh state restart,0.0,0.0,0.0,0.0,0.0,0.0,0.0,0.0,0.0,0.0,0.0,0.0,0.0,0.0,0.0,0.0,0.0,0.0,0.0,0.0,0.0,0.0,0.0,0.0,0.0,0.0,0.0,0.0,0.0,0.0,0.0,0.0,0.0,0.0,0.0,0.0,0.0,0.0,0.0
0.0,4.0,2.0,7.0,0.0,0.0,0.0,44f0da6f332902c5ba6664635741f537df387d46,0.0,1500230570.0,0.0,no,tasks/main.yml,0.0,5.0,27.0,0.0,0.0,0.0,0.0,0.0,0.0,0.0,0.0,0.0,0.0,0.0,0.0,6.0,0.0,0.0,0.0,6.0,0.0,0.0,0.0,0.0,0.0,0.0,0.0,6.0,0.0,0.0,0.0,25.0,0.0,0.0,0.0,0.0,0.0,0.0,0.0,0.0,6.0,72.0,0.0,0.0,0.0,tasks/main.yml,stackbuilders/sb-debian-base,4.26,includ path remot user root prebootstrap defin includ path remot user debian base admin user becom ye bootstrap defin includ path remot user debian base admin user becom ye instal haskel depend defin includ path remot user debian base admin user becom ye instal haskel stack defin includ path remot user debian base admin user becom ye instal rubi depend defin tag rubydepend includ path remot user debian base admin user becom ye add remov key defin tag addremovekey,0.0,0.0,0.0,0.0,0.0,0.0,0.0,0.0,0.0,0.0,0.0,0.0,0.0,0.0,0.0,0.0,0.0,0.0,0.0,0.0,0.0,0.0,0.0,0.0,0.0,0.0,0.0,0.0,0.0,0.0,0.0,0.0,0.0,0.0,0.0,0.0,0.0,0.0,0.0
0.0,6.0,2.0,7.0,0.0,0.0,0.0,44f0da6f332902c5ba6664635741f537df387d46,0.0,1500230570.0,0.0,no,tasks/set-authorized-keys-user.yml,0.0,0.0,5.0,0.0,0.0,0.0,0.0,0.0,0.0,0.0,0.0,0.0,0.0,0.0,0.0,0.0,0.0,0.0,0.0,1.0,0.0,0.0,0.0,0.0,0.0,0.0,0.0,0.0,0.0,0.0,0.0,5.0,0.0,0.0,0.0,0.0,0.0,0.0,0.0,0.0,1.0,23.0,1.0,0.0,0.0,tests/keys/deploy_users,stackbuilders/sb-debian-base,4.26,name set author key file deploy user author key user debian base deploy user key debian base deploy user author key join exclus ye,0.0,0.0,0.0,0.0,0.0,0.0,0.0,0.0,0.0,0.0,0.0,0.0,0.0,0.0,0.0,0.0,0.0,0.0,0.0,0.0,0.0,0.0,0.0,0.0,0.0,0.0,0.0,0.0,0.0,0.0,0.0,0.0,0.0,0.0,0.0,0.0,0.0,0.0,0.0
0.0,2.0,2.0,7.0,0.0,0.0,0.0,44f0da6f332902c5ba6664635741f537df387d46,0.0,1500230570.0,0.0,no,tasks/set-authorized-keys.yml,0.0,1.0,3.0,0.0,0.0,0.0,0.0,0.0,0.0,0.0,0.0,0.0,0.0,0.0,0.0,1.0,0.0,0.0,0.0,2.0,0.0,0.0,0.0,0.0,0.0,0.0,0.0,2.0,0.0,0.0,0.0,3.0,0.0,0.0,0.0,0.0,0.0,0.0,0.0,0.0,2.0,8.0,0.0,0.0,0.0,tasks/extra-tasks.yml,stackbuilders/sb-debian-base,2.75,includ path includ path debian base deploy user defin,0.0,0.0,0.0,0.0,0.0,0.0,0.0,0.0,0.0,0.0,0.0,0.0,0.0,0.0,0.0,0.0,0.0,0.0,0.0,0.0,0.0,0.0,0.0,0.0,0.0,0.0,0.0,0.0,0.0,0.0,0.0,0.0,0.0,0.0,0.0,0.0,0.0,0.0,0.0
0.0,13.0,2.0,7.0,0.0,0.0,0.0,44f0da6f332902c5ba6664635741f537df387d46,0.0,1500230570.0,0.0,no,tasks/ruby-dependencies.yml,0.0,0.0,13.0,0.0,0.0,0.0,0.0,0.0,0.0,0.0,0.0,0.0,0.0,0.0,0.0,0.0,0.0,0.0,0.0,1.0,0.0,0.0,0.0,0.0,0.0,0.0,0.0,0.0,0.0,0.0,0.0,5.0,0.0,1.0,0.0,1.0,0.0,0.0,0.0,0.0,1.0,20.0,2.0,0.0,0.0,tasks/ruby-dependencies-tasks.yml,stackbuilders/sb-debian-base,4.22,name instal rvm depend apt name item state present item buildessenti tklib zlibgdev libssldev libreadlinegplvdev libxml libxmldev libxsltdev,0.0,0.0,0.0,0.0,0.0,0.0,0.0,0.0,0.0,0.0,0.0,0.0,0.0,0.0,0.0,0.0,0.0,0.0,0.0,0.0,0.0,0.0,0.0,0.0,0.0,0.0,0.0,0.0,0.0,0.0,0.0,0.0,0.0,0.0,0.0,0.0,0.0,0.0,0.0
0.0,4.0,3.0,5.0,0.0,0.0,0.0,92e47f3c2f3c1fe85c4437419b66937ba1c6f1bb,0.0,1501163677.0,0.0,no,tasks/bootstrap.yml,0.0,9.0,40.0,0.0,0.0,0.0,0.0,0.0,0.0,0.0,0.0,0.0,0.0,0.0,1.0,2.0,0.0,0.0,0.0,10.0,0.0,0.0,0.0,0.0,0.0,0.0,0.0,3.0,0.0,0.0,0.0,38.0,0.0,1.0,0.0,3.0,0.0,0.0,0.0,0.0,10.0,108.0,10.0,0.0,0.0,tasks/bootstrap-tasks.yml,stackbuilders/sb-debian-base,5.82,includ path name disallow ssh password authent lineinfil dest etcsshsshd config regexp password authent line password authent state present name disallow root ssh access lineinfil dest etcsshsshd config regexp permit root login line permit root login state present notifi restart ssh name set hostnam hostspecif variabl hostnam name hostnam hostnam defin tag sethostnam name set time zone timezon name debian base ntp timezon name enabl ntp command timedatectl setntp name updat packag cach upgrad packag apt upgrad dist updat cach ye cach valid time name instal extra packag apt name item state latest item debian base extra packag includ path debian base firewal includ path debian base deploy user defin,0.0,0.0,0.0,0.0,0.0,0.0,0.0,0.0,0.0,0.0,0.0,0.0,0.0,0.0,0.0,0.0,0.0,0.0,0.0,0.0,0.0,0.0,0.0,0.0,0.0,0.0,0.0,0.0,0.0,0.0,0.0,0.0,0.0,0.0,0.0,0.0,0.0,0.0,0.0
0.0,5.0,3.0,5.0,0.0,0.0,0.0,92e47f3c2f3c1fe85c4437419b66937ba1c6f1bb,0.0,1501163677.0,0.0,no,tasks/prebootstrap.yml,0.0,3.0,20.0,0.0,0.0,0.0,0.0,0.0,0.0,0.0,0.0,0.0,0.0,0.0,0.0,0.0,0.0,0.0,0.0,4.0,0.0,0.0,0.0,0.0,0.0,0.0,0.0,1.0,0.0,0.0,0.0,20.0,0.0,0.0,0.0,1.0,0.0,0.0,0.0,0.0,4.0,55.0,5.0,0.0,0.0,tasks/prebootstrap-tasks.yml,stackbuilders/sb-debian-base,5.23,name add privileg admin user user name debian base admin user comment privileg admin user shell binbash group sudo append ye name instal sudo packag apt name sudo state latest updat cach ye name use sudo without password lineinfil dest etcsudo state present regexp sudo line sudo nopasswd valid visudo includ path,0.0,0.0,0.0,0.0,0.0,0.0,0.0,0.0,0.0,0.0,0.0,0.0,0.0,0.0,0.0,0.0,0.0,0.0,0.0,0.0,0.0,0.0,0.0,0.0,0.0,0.0,0.0,0.0,0.0,0.0,0.0,0.0,0.0,0.0,0.0,0.0,0.0,0.0,0.0
0.0,41.0,3.0,5.0,0.0,0.0,0.0,92e47f3c2f3c1fe85c4437419b66937ba1c6f1bb,0.0,1501163677.0,0.0,no,meta/main.yml,0.0,4.0,41.0,4.0,0.0,0.0,0.0,0.0,0.0,0.0,0.0,0.0,0.0,0.0,0.0,3.0,0.0,0.0,0.0,0.0,1.0,0.0,0.0,0.0,0.0,0.0,0.0,0.0,0.0,0.0,0.0,31.0,0.0,0.0,0.0,0.0,0.0,0.0,0.0,0.0,1.0,87.0,2.0,0.0,0.0,meta/main.yml,stackbuilders/sb-debian-base,5.58,galaxi info author justin leitgeb descript base imag common role compani stack builder licens mit min ansibl version platform name debian version jessi stretch name ubuntu version trusti xenial galaxi tag debian develop product secur system bootstrap ubuntu depend src path version becom ye remot user debian base admin user swapfil size debian base swap file size bootstrap defin src path version becom ye remot user debian base admin user unattend mail debian base email alert unattend automat reboot bootstrap defin src path version becom ye remot user debian base admin user bootstrap defin,0.0,0.0,0.0,0.0,0.0,0.0,0.0,0.0,0.0,0.0,0.0,0.0,0.0,0.0,0.0,0.0,0.0,0.0,0.0,0.0,0.0,0.0,0.0,0.0,0.0,0.0,0.0,0.0,0.0,0.0,0.0,0.0,0.0,0.0,0.0,0.0,0.0,0.0,0.0
0.0,6.0,3.0,5.0,0.0,0.0,0.0,92e47f3c2f3c1fe85c4437419b66937ba1c6f1bb,0.0,1501163677.0,0.0,no,tasks/bootstrap-deploy-user.yml,0.0,5.0,36.0,0.0,0.0,0.0,0.0,0.0,0.0,0.0,0.0,0.0,0.0,0.0,0.0,0.0,0.0,0.0,0.0,6.0,0.0,0.0,0.0,0.0,0.0,0.0,0.0,1.0,0.0,0.0,0.0,35.0,1.0,0.0,0.0,2.0,0.0,0.0,0.0,0.0,6.0,119.0,7.0,0.0,0.0,tasks/deploy-username-tasks.yml,stackbuilders/sb-debian-base,5.2,name creat deploy user group group name debian base deploy user group state present name creat deploy user user name debian base deploy user comment unprivileg debian base deploy user user group debian base deploy user group shell binbash name creat applic deploy directori file path debian base app path state directori owner debian base deploy user group debian base deploy user group mode tag createappdirectori includ path name add deploy user ssh privat key copi dest debian base deploy user dir path rsa content debian base deploy user privat key owner debian base deploy user group debian base deploy user group mode name ensur path known host lineinfil dest home debian base deploy user path host creat ye state present line lookup pipe sshkeyscan rsa path regexp path group debian base deploy user group owner debian base deploy user,0.0,0.0,0.0,0.0,0.0,0.0,0.0,0.0,0.0,0.0,0.0,0.0,0.0,0.0,0.0,0.0,0.0,0.0,0.0,0.0,0.0,0.0,0.0,0.0,0.0,0.0,0.0,0.0,0.0,0.0,0.0,0.0,0.0,0.0,0.0,0.0,0.0,0.0,0.0
0.0,8.0,3.0,5.0,0.0,0.0,0.0,92e47f3c2f3c1fe85c4437419b66937ba1c6f1bb,1.0,1501163677.0,1.0,no,tasks/haskell-dependencies.yml,100.0,0.0,8.0,0.0,1.0,1.0,1.0,1.0,1.0,1.0,1.0,0.0,0.0,0.0,0.0,0.0,0.0,0.0,0.0,1.0,0.0,0.0,0.0,0.0,0.0,0.0,0.0,0.0,0.0,0.0,0.0,5.0,0.0,1.0,0.0,1.0,0.0,0.0,0.0,0.0,1.0,17.0,2.0,0.0,0.0,tasks/aws-prebootstrap-task.yml,stackbuilders/sb-debian-base,3.97,name instal common haskel build depend apt name item state latest item libpcredev libsqlitedev libpqdev,0.0,0.0,0.0,0.0,0.0,0.0,0.0,0.0,0.0,0.0,0.0,0.0,0.0,0.0,0.0,0.0,0.0,0.0,0.0,0.0,0.0,0.0,0.0,0.0,0.0,0.0,0.0,0.0,0.0,0.0,0.0,0.0,0.0,0.0,0.0,0.0,0.0,0.0,0.0
0.0,6.0,3.0,5.0,-7.0,-7.0,-7.0,92e47f3c2f3c1fe85c4437419b66937ba1c6f1bb,1.0,1501163677.0,1.0,no,tasks/bootstrap-firewall.yml,100.0,2.0,18.0,0.0,0.0,0.0,0.0,7.0,7.0,7.0,1.0,0.0,0.0,0.0,0.0,0.0,0.0,0.0,0.0,3.0,0.0,0.0,2.0,0.0,0.0,0.0,0.0,0.0,0.0,0.0,0.0,17.0,0.0,2.0,0.0,0.0,0.0,0.0,0.0,0.0,3.0,51.0,3.0,0.0,0.0,tasks/firewall.yml,stackbuilders/sb-debian-base,4.66,name enabl ufw ufw state enabl polici deni name open gener port ufw rule allow port item proto tcp item port default name open port ufw rule allow src path port path proto tcp dict port ip default,0.0,0.0,-1.0,-6.0,0.0,0.0,0.0,0.0,-1.0,0.0,0.0,0.0,-1.0,0.0,0.0,0.0,0.0,0.0,0.0,0.0,0.0,0.0,0.0,0.0,-6.0,0.0,0.0,0.0,0.0,0.0,0.0,0.0,0.0,-1.0,-22.0,-1.0,0.0,0.0,-0.75
0.0,6.0,3.0,5.0,-18.0,-18.0,-18.0,92e47f3c2f3c1fe85c4437419b66937ba1c6f1bb,1.0,1501163677.0,1.0,no,tasks/haskell-stack.yml,100.0,3.0,20.0,1.0,9.0,9.0,9.0,27.0,27.0,27.0,9.0,0.0,0.0,0.0,0.0,2.0,0.0,0.0,0.0,4.0,0.0,0.0,1.0,0.0,0.0,0.0,0.0,0.0,0.0,0.0,0.0,20.0,0.0,0.0,0.0,0.0,0.0,0.0,0.0,0.0,4.0,66.0,5.0,0.0,0.0,tasks/haskell-stack-tasks.yml,stackbuilders/sb-debian-base,5.16,name add fpco pgp public key apt key url http path ansibl distribut lower path state present name add fpco deb repositori debian apt repositori repo deb http path stabl main state present ansibl distribut debian name add fpco deb repositori ubuntu apt repositori repo deb http path ansibl distribut releas main state present ansibl distribut ubuntu name instal stack packag apt name stack state latest updat cach ye cach valid time,0.0,1.0,-3.0,-16.0,1.0,0.0,0.0,0.0,-4.0,0.0,0.0,0.0,-3.0,0.0,0.0,1.0,0.0,0.0,0.0,0.0,0.0,0.0,0.0,0.0,-16.0,0.0,0.0,0.0,0.0,0.0,0.0,0.0,0.0,-3.0,-51.0,-3.0,0.0,0.0,0.06
0.0,6.0,3.0,5.0,0.0,0.0,0.0,92e47f3c2f3c1fe85c4437419b66937ba1c6f1bb,0.0,1501163677.0,0.0,no,tasks/set-authorized-keys-admin.yml,0.0,0.0,5.0,0.0,0.0,0.0,0.0,0.0,0.0,0.0,0.0,0.0,0.0,0.0,0.0,0.0,0.0,0.0,0.0,1.0,0.0,0.0,0.0,0.0,0.0,0.0,0.0,0.0,0.0,0.0,0.0,5.0,0.0,0.0,0.0,0.0,0.0,0.0,0.0,0.0,1.0,23.0,1.0,0.0,0.0,tasks/set-authorized-keys-admin.yml,stackbuilders/sb-debian-base,4.26,name set author key file admin user author key user debian base admin user key debian base admin user author key join exclus ye,0.0,0.0,0.0,0.0,0.0,0.0,0.0,0.0,0.0,0.0,0.0,0.0,0.0,0.0,0.0,0.0,0.0,0.0,0.0,0.0,0.0,0.0,0.0,0.0,0.0,0.0,0.0,0.0,0.0,0.0,0.0,0.0,0.0,0.0,0.0,0.0,0.0,0.0,0.0
0.0,4.0,3.0,5.0,0.0,0.0,0.0,92e47f3c2f3c1fe85c4437419b66937ba1c6f1bb,0.0,1501163677.0,0.0,no,handlers/main.yml,0.0,0.0,4.0,0.0,0.0,0.0,0.0,0.0,0.0,0.0,0.0,0.0,0.0,0.0,0.0,0.0,0.0,0.0,0.0,1.0,0.0,0.0,0.0,0.0,0.0,0.0,0.0,0.0,0.0,0.0,0.0,4.0,0.0,0.0,0.0,0.0,0.0,0.0,0.0,0.0,1.0,8.0,2.0,0.0,0.0,handlers/main.yml,stackbuilders/sb-debian-base,2.5,name restart ssh servic name ssh state restart,0.0,0.0,0.0,0.0,0.0,0.0,0.0,0.0,0.0,0.0,0.0,0.0,0.0,0.0,0.0,0.0,0.0,0.0,0.0,0.0,0.0,0.0,0.0,0.0,0.0,0.0,0.0,0.0,0.0,0.0,0.0,0.0,0.0,0.0,0.0,0.0,0.0,0.0,0.0
0.0,4.0,3.0,5.0,0.0,0.0,0.0,92e47f3c2f3c1fe85c4437419b66937ba1c6f1bb,0.0,1501163677.0,0.0,no,tasks/main.yml,0.0,5.0,27.0,0.0,0.0,0.0,0.0,0.0,0.0,0.0,0.0,0.0,0.0,0.0,0.0,6.0,0.0,0.0,0.0,6.0,0.0,0.0,0.0,0.0,0.0,0.0,0.0,6.0,0.0,0.0,0.0,25.0,0.0,0.0,0.0,0.0,0.0,0.0,0.0,0.0,6.0,72.0,0.0,0.0,0.0,tasks/main.yml,stackbuilders/sb-debian-base,4.26,includ path remot user root prebootstrap defin includ path remot user debian base admin user becom ye bootstrap defin includ path remot user debian base admin user becom ye instal haskel depend defin includ path remot user debian base admin user becom ye instal haskel stack defin includ path remot user debian base admin user becom ye instal rubi depend defin tag rubydepend includ path remot user debian base admin user becom ye add remov key defin tag addremovekey,0.0,0.0,0.0,0.0,0.0,0.0,0.0,0.0,0.0,0.0,0.0,0.0,0.0,0.0,0.0,0.0,0.0,0.0,0.0,0.0,0.0,0.0,0.0,0.0,0.0,0.0,0.0,0.0,0.0,0.0,0.0,0.0,0.0,0.0,0.0,0.0,0.0,0.0,0.0
0.0,6.0,3.0,5.0,0.0,0.0,0.0,92e47f3c2f3c1fe85c4437419b66937ba1c6f1bb,0.0,1501163677.0,0.0,no,tasks/set-authorized-keys-user.yml,0.0,0.0,5.0,0.0,0.0,0.0,0.0,0.0,0.0,0.0,0.0,0.0,0.0,0.0,0.0,0.0,0.0,0.0,0.0,1.0,0.0,0.0,0.0,0.0,0.0,0.0,0.0,0.0,0.0,0.0,0.0,5.0,0.0,0.0,0.0,0.0,0.0,0.0,0.0,0.0,1.0,23.0,1.0,0.0,0.0,tests/keys/deploy_users,stackbuilders/sb-debian-base,4.26,name set author key file deploy user author key user debian base deploy user key debian base deploy user author key join exclus ye,0.0,0.0,0.0,0.0,0.0,0.0,0.0,0.0,0.0,0.0,0.0,0.0,0.0,0.0,0.0,0.0,0.0,0.0,0.0,0.0,0.0,0.0,0.0,0.0,0.0,0.0,0.0,0.0,0.0,0.0,0.0,0.0,0.0,0.0,0.0,0.0,0.0,0.0,0.0
0.0,2.0,3.0,5.0,0.0,0.0,0.0,92e47f3c2f3c1fe85c4437419b66937ba1c6f1bb,0.0,1501163677.0,0.0,no,tasks/set-authorized-keys.yml,0.0,1.0,3.0,0.0,0.0,0.0,0.0,0.0,0.0,0.0,0.0,0.0,0.0,0.0,0.0,1.0,0.0,0.0,0.0,2.0,0.0,0.0,0.0,0.0,0.0,0.0,0.0,2.0,0.0,0.0,0.0,3.0,0.0,0.0,0.0,0.0,0.0,0.0,0.0,0.0,2.0,8.0,0.0,0.0,0.0,tasks/extra-tasks.yml,stackbuilders/sb-debian-base,2.75,includ path includ path debian base deploy user defin,0.0,0.0,0.0,0.0,0.0,0.0,0.0,0.0,0.0,0.0,0.0,0.0,0.0,0.0,0.0,0.0,0.0,0.0,0.0,0.0,0.0,0.0,0.0,0.0,0.0,0.0,0.0,0.0,0.0,0.0,0.0,0.0,0.0,0.0,0.0,0.0,0.0,0.0,0.0
0.0,13.0,3.0,5.0,0.0,0.0,0.0,92e47f3c2f3c1fe85c4437419b66937ba1c6f1bb,0.0,1501163677.0,0.0,no,tasks/ruby-dependencies.yml,0.0,0.0,13.0,0.0,0.0,0.0,0.0,0.0,0.0,0.0,0.0,0.0,0.0,0.0,0.0,0.0,0.0,0.0,0.0,1.0,0.0,0.0,0.0,0.0,0.0,0.0,0.0,0.0,0.0,0.0,0.0,5.0,0.0,1.0,0.0,1.0,0.0,0.0,0.0,0.0,1.0,20.0,2.0,0.0,0.0,tasks/ruby-dependencies-tasks.yml,stackbuilders/sb-debian-base,4.22,name instal rvm depend apt name item state present item buildessenti tklib zlibgdev libssldev libreadlinegplvdev libxml libxmldev libxsltdev,0.0,0.0,0.0,0.0,0.0,0.0,0.0,0.0,0.0,0.0,0.0,0.0,0.0,0.0,0.0,0.0,0.0,0.0,0.0,0.0,0.0,0.0,0.0,0.0,0.0,0.0,0.0,0.0,0.0,0.0,0.0,0.0,0.0,0.0,0.0,0.0,0.0,0.0,0.0
0.0,4.0,5.0,5.0,0.0,0.0,0.0,d7a578091d5c2ea003447c90f407d68f58be574b,1.0,1502916696.0,1.0,no,tasks/bootstrap.yml,100.0,9.0,40.0,0.0,1.0,1.0,1.0,1.0,1.0,1.0,1.0,0.0,0.0,0.0,1.0,2.0,0.0,0.0,0.0,10.0,0.0,0.0,1.0,0.0,0.0,0.0,0.0,3.0,0.0,0.0,0.0,38.0,0.0,1.0,0.0,3.0,0.0,0.0,0.0,0.0,10.0,110.0,10.0,0.0,0.0,tasks/bootstrap-tasks.yml,stackbuilders/sb-debian-base,5.86,includ path name disallow ssh password authent lineinfil dest etcsshsshd config regexp password authent line password authent state present name disallow root ssh access lineinfil dest etcsshsshd config regexp permit root login line permit root login state present notifi restart ssh name set hostnam hostspecif variabl hostnam name hostnam hostnam defin tag sethostnam name set time zone timezon name debian base ntp timezon name enabl ntp command timedatectl setntp name updat packag cach upgrad packag apt upgrad dist updat cach ye cach valid time name instal extra packag apt name item state latest item debian base extra packag union debian base supplementari packag includ path debian base firewal includ path debian base deploy user defin,0.0,0.0,0.0,0.0,0.0,0.0,0.0,0.0,0.0,0.0,0.0,0.0,0.0,0.0,0.0,1.0,0.0,0.0,0.0,0.0,0.0,0.0,0.0,0.0,0.0,0.0,0.0,0.0,0.0,0.0,0.0,0.0,0.0,0.0,2.0,0.0,0.0,0.0,0.04
0.0,5.0,5.0,5.0,0.0,0.0,0.0,d7a578091d5c2ea003447c90f407d68f58be574b,0.0,1502916696.0,0.0,no,tasks/prebootstrap.yml,0.0,3.0,20.0,0.0,0.0,0.0,0.0,0.0,0.0,0.0,0.0,0.0,0.0,0.0,0.0,0.0,0.0,0.0,0.0,4.0,0.0,0.0,0.0,0.0,0.0,0.0,0.0,1.0,0.0,0.0,0.0,20.0,0.0,0.0,0.0,1.0,0.0,0.0,0.0,0.0,4.0,55.0,5.0,0.0,0.0,tasks/prebootstrap-tasks.yml,stackbuilders/sb-debian-base,5.23,name add privileg admin user user name debian base admin user comment privileg admin user shell binbash group sudo append ye name instal sudo packag apt name sudo state latest updat cach ye name use sudo without password lineinfil dest etcsudo state present regexp sudo line sudo nopasswd valid visudo includ path,0.0,0.0,0.0,0.0,0.0,0.0,0.0,0.0,0.0,0.0,0.0,0.0,0.0,0.0,0.0,0.0,0.0,0.0,0.0,0.0,0.0,0.0,0.0,0.0,0.0,0.0,0.0,0.0,0.0,0.0,0.0,0.0,0.0,0.0,0.0,0.0,0.0,0.0,0.0
0.0,41.0,5.0,5.0,0.0,0.0,0.0,d7a578091d5c2ea003447c90f407d68f58be574b,0.0,1502916696.0,0.0,no,meta/main.yml,0.0,4.0,41.0,4.0,0.0,0.0,0.0,0.0,0.0,0.0,0.0,0.0,0.0,0.0,0.0,3.0,0.0,0.0,0.0,0.0,1.0,0.0,0.0,0.0,0.0,0.0,0.0,0.0,0.0,0.0,0.0,31.0,0.0,0.0,0.0,0.0,0.0,0.0,0.0,0.0,1.0,87.0,2.0,0.0,0.0,meta/main.yml,stackbuilders/sb-debian-base,5.58,galaxi info author justin leitgeb descript base imag common role compani stack builder licens mit min ansibl version platform name debian version jessi stretch name ubuntu version trusti xenial galaxi tag debian develop product secur system bootstrap ubuntu depend src path version becom ye remot user debian base admin user swapfil size debian base swap file size bootstrap defin src path version becom ye remot user debian base admin user unattend mail debian base email alert unattend automat reboot bootstrap defin src path version becom ye remot user debian base admin user bootstrap defin,0.0,0.0,0.0,0.0,0.0,0.0,0.0,0.0,0.0,0.0,0.0,0.0,0.0,0.0,0.0,0.0,0.0,0.0,0.0,0.0,0.0,0.0,0.0,0.0,0.0,0.0,0.0,0.0,0.0,0.0,0.0,0.0,0.0,0.0,0.0,0.0,0.0,0.0,0.0
0.0,6.0,5.0,5.0,0.0,0.0,0.0,d7a578091d5c2ea003447c90f407d68f58be574b,0.0,1502916696.0,0.0,no,tasks/bootstrap-deploy-user.yml,0.0,5.0,36.0,0.0,0.0,0.0,0.0,0.0,0.0,0.0,0.0,0.0,0.0,0.0,0.0,0.0,0.0,0.0,0.0,6.0,0.0,0.0,0.0,0.0,0.0,0.0,0.0,1.0,0.0,0.0,0.0,35.0,1.0,0.0,0.0,2.0,0.0,0.0,0.0,0.0,6.0,119.0,7.0,0.0,0.0,tasks/deploy-username-tasks.yml,stackbuilders/sb-debian-base,5.2,name creat deploy user group group name debian base deploy user group state present name creat deploy user user name debian base deploy user comment unprivileg debian base deploy user user group debian base deploy user group shell binbash name creat applic deploy directori file path debian base app path state directori owner debian base deploy user group debian base deploy user group mode tag createappdirectori includ path name add deploy user ssh privat key copi dest debian base deploy user dir path rsa content debian base deploy user privat key owner debian base deploy user group debian base deploy user group mode name ensur path known host lineinfil dest home debian base deploy user path host creat ye state present line lookup pipe sshkeyscan rsa path regexp path group debian base deploy user group owner debian base deploy user,0.0,0.0,0.0,0.0,0.0,0.0,0.0,0.0,0.0,0.0,0.0,0.0,0.0,0.0,0.0,0.0,0.0,0.0,0.0,0.0,0.0,0.0,0.0,0.0,0.0,0.0,0.0,0.0,0.0,0.0,0.0,0.0,0.0,0.0,0.0,0.0,0.0,0.0,0.0
0.0,8.0,5.0,5.0,0.0,0.0,0.0,d7a578091d5c2ea003447c90f407d68f58be574b,0.0,1502916696.0,0.0,no,tasks/haskell-dependencies.yml,0.0,0.0,8.0,0.0,0.0,0.0,0.0,0.0,0.0,0.0,0.0,0.0,0.0,0.0,0.0,0.0,0.0,0.0,0.0,1.0,0.0,0.0,0.0,0.0,0.0,0.0,0.0,0.0,0.0,0.0,0.0,5.0,0.0,1.0,0.0,1.0,0.0,0.0,0.0,0.0,1.0,17.0,2.0,0.0,0.0,tasks/aws-prebootstrap-task.yml,stackbuilders/sb-debian-base,3.97,name instal common haskel build depend apt name item state latest item libpcredev libsqlitedev libpqdev,0.0,0.0,0.0,0.0,0.0,0.0,0.0,0.0,0.0,0.0,0.0,0.0,0.0,0.0,0.0,0.0,0.0,0.0,0.0,0.0,0.0,0.0,0.0,0.0,0.0,0.0,0.0,0.0,0.0,0.0,0.0,0.0,0.0,0.0,0.0,0.0,0.0,0.0,0.0
0.0,6.0,5.0,5.0,0.0,0.0,0.0,d7a578091d5c2ea003447c90f407d68f58be574b,0.0,1502916696.0,0.0,no,tasks/bootstrap-firewall.yml,0.0,2.0,18.0,0.0,0.0,0.0,0.0,0.0,0.0,0.0,0.0,0.0,0.0,0.0,0.0,0.0,0.0,0.0,0.0,3.0,0.0,0.0,2.0,0.0,0.0,0.0,0.0,0.0,0.0,0.0,0.0,17.0,0.0,2.0,0.0,0.0,0.0,0.0,0.0,0.0,3.0,51.0,3.0,0.0,0.0,tasks/firewall.yml,stackbuilders/sb-debian-base,4.66,name enabl ufw ufw state enabl polici deni name open gener port ufw rule allow port item proto tcp item port default name open port ufw rule allow src path port path proto tcp dict port ip default,0.0,0.0,0.0,0.0,0.0,0.0,0.0,0.0,0.0,0.0,0.0,0.0,0.0,0.0,0.0,0.0,0.0,0.0,0.0,0.0,0.0,0.0,0.0,0.0,0.0,0.0,0.0,0.0,0.0,0.0,0.0,0.0,0.0,0.0,0.0,0.0,0.0,0.0,0.0
0.0,6.0,5.0,5.0,0.0,0.0,0.0,d7a578091d5c2ea003447c90f407d68f58be574b,0.0,1502916696.0,0.0,no,tasks/haskell-stack.yml,0.0,3.0,20.0,1.0,0.0,0.0,0.0,0.0,0.0,0.0,0.0,0.0,0.0,0.0,0.0,2.0,0.0,0.0,0.0,4.0,0.0,0.0,1.0,0.0,0.0,0.0,0.0,0.0,0.0,0.0,0.0,20.0,0.0,0.0,0.0,0.0,0.0,0.0,0.0,0.0,4.0,66.0,5.0,0.0,0.0,tasks/haskell-stack-tasks.yml,stackbuilders/sb-debian-base,5.16,name add fpco pgp public key apt key url http path ansibl distribut lower path state present name add fpco deb repositori debian apt repositori repo deb http path stabl main state present ansibl distribut debian name add fpco deb repositori ubuntu apt repositori repo deb http path ansibl distribut releas main state present ansibl distribut ubuntu name instal stack packag apt name stack state latest updat cach ye cach valid time,0.0,0.0,0.0,0.0,0.0,0.0,0.0,0.0,0.0,0.0,0.0,0.0,0.0,0.0,0.0,0.0,0.0,0.0,0.0,0.0,0.0,0.0,0.0,0.0,0.0,0.0,0.0,0.0,0.0,0.0,0.0,0.0,0.0,0.0,0.0,0.0,0.0,0.0,0.0
0.0,6.0,5.0,5.0,0.0,0.0,0.0,d7a578091d5c2ea003447c90f407d68f58be574b,0.0,1502916696.0,0.0,no,tasks/set-authorized-keys-admin.yml,0.0,0.0,5.0,0.0,0.0,0.0,0.0,0.0,0.0,0.0,0.0,0.0,0.0,0.0,0.0,0.0,0.0,0.0,0.0,1.0,0.0,0.0,0.0,0.0,0.0,0.0,0.0,0.0,0.0,0.0,0.0,5.0,0.0,0.0,0.0,0.0,0.0,0.0,0.0,0.0,1.0,23.0,1.0,0.0,0.0,tasks/set-authorized-keys-admin.yml,stackbuilders/sb-debian-base,4.26,name set author key file admin user author key user debian base admin user key debian base admin user author key join exclus ye,0.0,0.0,0.0,0.0,0.0,0.0,0.0,0.0,0.0,0.0,0.0,0.0,0.0,0.0,0.0,0.0,0.0,0.0,0.0,0.0,0.0,0.0,0.0,0.0,0.0,0.0,0.0,0.0,0.0,0.0,0.0,0.0,0.0,0.0,0.0,0.0,0.0,0.0,0.0
0.0,4.0,5.0,5.0,0.0,0.0,0.0,d7a578091d5c2ea003447c90f407d68f58be574b,0.0,1502916696.0,0.0,no,handlers/main.yml,0.0,0.0,4.0,0.0,0.0,0.0,0.0,0.0,0.0,0.0,0.0,0.0,0.0,0.0,0.0,0.0,0.0,0.0,0.0,1.0,0.0,0.0,0.0,0.0,0.0,0.0,0.0,0.0,0.0,0.0,0.0,4.0,0.0,0.0,0.0,0.0,0.0,0.0,0.0,0.0,1.0,8.0,2.0,0.0,0.0,handlers/main.yml,stackbuilders/sb-debian-base,2.5,name restart ssh servic name ssh state restart,0.0,0.0,0.0,0.0,0.0,0.0,0.0,0.0,0.0,0.0,0.0,0.0,0.0,0.0,0.0,0.0,0.0,0.0,0.0,0.0,0.0,0.0,0.0,0.0,0.0,0.0,0.0,0.0,0.0,0.0,0.0,0.0,0.0,0.0,0.0,0.0,0.0,0.0,0.0
